,Order,Speaker,Time,Text,Has Arguments,All Arguments Summarized,(Beta) For proposal: Implement RCV as an alternative method both to elected officials and representatives at all levels,(Beta) Against proposal: Implement RCV as an alternative method both to elected officials and representatives at all levels,(Beta) Proposal raw ouput for debugging: Implement RCV as an alternative method both to elected officials and representatives at all levels,(Beta) For proposal: Change the primary system,(Beta) Against proposal: Change the primary system,(Beta) Proposal raw ouput for debugging: Change the primary system,(Beta) For proposal: Use proportional representatives to elect elected officials,(Beta) Against proposal: Use proportional representatives to elect elected officials,(Beta) Proposal raw ouput for debugging: Use proportional representatives to elect elected officials,(Beta) For proposal: Change the current electoral college,(Beta) Against proposal: Change the current electoral college,(Beta) Proposal raw ouput for debugging: Change the current electoral college,(Beta) For proposal: Implement more accessibility to voting,(Beta) Against proposal: Implement more accessibility to voting,(Beta) Proposal raw ouput for debugging: Implement more accessibility to voting,(Beta) For proposal: Restore federal and state voting rights to citizens with felony convictions upon their release from prison,(Beta) Against proposal: Restore federal and state voting rights to citizens with felony convictions upon their release from prison,(Beta) Proposal raw ouput for debugging: Restore federal and state voting rights to citizens with felony convictions upon their release from prison,(Beta) For proposal: Implement voting standards that are less strict,(Beta) Against proposal: Implement voting standards that are less strict,(Beta) Proposal raw ouput for debugging: Implement voting standards that are less strict,(Beta) For proposal: Implement more measures to address voter fraud,(Beta) Against proposal: Implement more measures to address voter fraud,(Beta) Proposal raw ouput for debugging: Implement more measures to address voter fraud,(Beta) For proposal: Implement more fairness and transparency in the election process,(Beta) Against proposal: Implement more fairness and transparency in the election process,(Beta) Proposal raw ouput for debugging: Implement more fairness and transparency in the election process,(Beta) For proposal: Implement limits on financing individual candidates and parties,(Beta) Against proposal: Implement limits on financing individual candidates and parties,(Beta) Proposal raw ouput for debugging: Implement limits on financing individual candidates and parties,(Beta) For proposal: Increase in public funding and financing for campaigns,(Beta) Against proposal: Increase in public funding and financing for campaigns,(Beta) Proposal raw ouput for debugging: Increase in public funding and financing for campaigns,(Beta) For proposal: Implement a term limit for Supreme Court Justices,(Beta) Against proposal: Implement a term limit for Supreme Court Justices,(Beta) Proposal raw ouput for debugging: Implement a term limit for Supreme Court Justices,(Beta) For proposal: Increase opportunities for learning about civic education in schools,(Beta) Against proposal: Increase opportunities for learning about civic education in schools,(Beta) Proposal raw ouput for debugging: Increase opportunities for learning about civic education in schools,comparisonToCurrentSystem,votingDecisions,partyRepresentation,voterTurnout,strategicVoting,moderateCandidates,moneyInPolitics,other,notRelevant
0,1,48639,"""2:05"""," hi, i'm joe. nice. i live in california.",No,,,,,,,,,,,,,,,,,,,,,,,,,,,,,,,,,,,,,,,,,False,False,False,False,False,False,False,False,False
1,2,48686,"""2:16"""," hello, my name is christopher and i live in vermont.",No,,,,,,,,,,,,,,,,,,,,,,,,,,,,,,,,,,,,,,,,,False,False,False,False,False,False,False,False,False
2,3,9856,"""2:21""", hi. my name is carla and i live in texas.,No,,,,,,,,,,,,,,,,,,,,,,,,,,,,,,,,,,,,,,,,,False,False,False,False,False,False,False,False,False
3,4,48615,"""2:25"""," hi, my name is mark and i live in pennsylvania.",No,,,,,,,,,,,,,,,,,,,,,,,,,,,,,,,,,,,,,,,,,False,False,False,False,False,False,False,False,False
4,5,10017,"""2:29"""," hi, daniel and i live in new york city.",No,,,,,,,,,,,,,,,,,,,,,,,,,,,,,,,,,,,,,,,,,False,False,False,False,False,False,False,False,False
5,6,48638,"""2:34"""," krista, and i also live in new york state.",No,,,,,,,,,,,,,,,,,,,,,,,,,,,,,,,,,,,,,,,,,False,False,False,False,False,False,False,False,False
6,7,48689,"""2:37""", i'm died an hour and i live in illinois.,No,,,,,,,,,,,,,,,,,,,,,,,,,,,,,,,,,,,,,,,,,False,False,False,False,False,False,False,False,False
7,8,48600,"""2:44""", i'm also carla and i live in florida.,No,,,,,,,,,,,,,,,,,,,,,,,,,,,,,,,,,,,,,,,,,False,False,False,False,False,False,False,False,False
8,9,48689,"""11:02""", i think there's already enough influence with them so that we don't need to change what we're doing with it.,Yes,"The speaker's argument is that there is already enough influence with ""them"" (presumably referring to a specific group or entity) and therefore, there is no need to change what they are currently doing with it.",,,"1. [A] Reason: The argument suggests that there is already enough influence from a specific group or entity, implying that the current system is working well and does not need to be changed. This aligns with a pro stance on the proposal.
2. [A] Reason: The argument states that increasing opportunities for learning about civic education in schools is okay, indicating a positive view towards the proposal. This aligns with a pro stance.
3. [B] Reason: The argument states that increasing opportunities for learning about civic education in schools is bad, indicating a negative view towards the proposal. This aligns with a con stance.
4. [A] Reason: The argument states that increasing opportunities for learning about civic education in schools is the best thing ever, indicating a highly positive view towards the proposal. This aligns with a pro stance.
5. [B] Reason: The argument states that increasing opportunities for learning about civic education in schools is the worst thing ever, indicating a highly negative view towards the proposal. This aligns with a con stance.",,,"1. [Argument 1] C Reason: The argument is not applicable to the given proposal as it does not directly address the use of proportional representatives to elect elected officials.
2. [Argument 2] A Reason: This argument is in favor of the proposal, stating that using proportional representatives to elect elected officials is okay.
3. [Argument 3] B Reason: This argument is against the proposal, stating that using proportional representatives to elect elected officials is bad.
4. [Argument 4] A Reason: This argument is in favor of the proposal, stating that using proportional representatives to elect elected officials is the best thing ever.
5. [Argument 5] B Reason: This argument is against the proposal, stating that using proportional representatives to elect elected officials is the worst thing ever.",,,"1. [Argument 1] C Reason: The argument is not applicable to the given proposal because it does not directly address the increase in public funding and financing for campaigns.
2. [Argument 2] A Reason: This argument is in favor of the proposal, stating that an increase in public funding and financing for campaigns is acceptable.
3. [Argument 3] B Reason: This argument is against the proposal, claiming that an increase in public funding and financing for campaigns is bad.
4. [Argument 4] A Reason: This argument is in favor of the proposal, stating that an increase in public funding and financing for campaigns is the best thing ever.
5. [Argument 5] B Reason: This argument is against the proposal, claiming that an increase in public funding and financing for campaigns is the worst thing ever.",,,"1. [Argument 1] C Reason: The argument does not provide a clear stance on the proposal. It does not support or oppose the implementation of a term limit for Supreme Court Justices, but rather suggests that there is already enough influence with a specific group or entity.
2. [Argument 2] A Reason: This argument supports the proposal by stating that implementing a term limit for Supreme Court Justices is okay.
3. [Argument 3] B Reason: This argument opposes the proposal by stating that implementing a term limit for Supreme Court Justices is bad.
4. [Argument 4] A Reason: This argument supports the proposal by stating that implementing a term limit for Supreme Court Justices is the best thing ever.
5. [Argument 5] B Reason: This argument opposes the proposal by stating that implementing a term limit for Supreme Court Justices is the worst thing ever.",,,"1. [Argument 1] C Reason: The argument does not directly address the proposal of implementing more measures to address voter fraud. It focuses on the idea that there is already enough influence with a specific group or entity, which is not directly related to the proposal.
2. [Argument 2] A Reason: This argument supports the proposal of implementing more measures to address voter fraud, indicating that it is okay to do so.
3. [Argument 3] B Reason: This argument opposes the proposal of implementing more measures to address voter fraud, stating that it is bad.
4. [Argument 4] A Reason: This argument strongly supports the proposal of implementing more measures to address voter fraud, stating that it is the best thing ever.
5. [Argument 5] B Reason: This argument strongly opposes the proposal of implementing more measures to address voter fraud, stating that it is the worst thing ever.",,,"1. [A] Reason: The argument suggests that the current influence held by ""them"" is sufficient, indicating support for the proposal to implement RCV as an alternative method.
2. [A] Reason: The statement expresses approval for implementing RCV as an alternative method, indicating support for the proposal.
3. [B] Reason: The statement expresses disapproval for implementing RCV as an alternative method, indicating opposition to the proposal.
4. [A] Reason: The statement expresses strong approval for implementing RCV as an alternative method, indicating support for the proposal.
5. [B] Reason: The statement expresses strong disapproval for implementing RCV as an alternative method, indicating opposition to the proposal.",,,"1. [Argument 1] B Reason: The argument suggests that there is already enough influence with a specific group or entity, implying that changing the primary system would not be beneficial.
2. [Argument 2] A Reason: The argument supports changing the primary system, indicating a positive stance towards the proposal.
3. [Argument 3] B Reason: The argument opposes changing the primary system, indicating a negative stance towards the proposal.
4. [Argument 4] A Reason: The argument states that changing the primary system is the best thing ever, indicating a positive stance towards the proposal.
5. [Argument 5] B Reason: The argument claims that changing the primary system is the worst thing ever, indicating a negative stance towards the proposal.",,,"1. [Argument 1] C Reason: The argument is not applicable to the given proposal as it does not provide a clear stance on whether the electoral college should be changed or not. It only mentions that there is already enough influence with a specific group or entity, but does not directly address the proposal itself.
2. [Argument 2] A Reason: The argument is in favor of changing the current electoral college, indicating a pro stance on the proposal.
3. [Argument 3] B Reason: The argument is against changing the current electoral college, indicating a con stance on the proposal.
4. [Argument 4] A Reason: The argument is in favor of changing the current electoral college, indicating a pro stance on the proposal.
5. [Argument 5] B Reason: The argument is against changing the current electoral college, indicating a con stance on the proposal.",,,"1. [Argument 1] B Reason: The argument opposes the proposal by suggesting that there is no need for change, indicating a con stance.
2. [Argument 2] A Reason: The argument supports the proposal by stating that it is okay, indicating a pro stance.
3. [Argument 3] B Reason: The argument opposes the proposal by stating that it is bad, indicating a con stance.
4. [Argument 4] A Reason: The argument supports the proposal by stating that it is the best thing ever, indicating a pro stance.
5. [Argument 5] B Reason: The argument opposes the proposal by stating that it is the worst thing ever, indicating a con stance.",,,"1. [Argument 1] B Reason: The argument suggests that there is no need to change the current influence held by a specific group or entity, implying resistance to implementing more accessibility to voting.
2. [Argument 2] A Reason: The argument supports the proposal of implementing more accessibility to voting, indicating a positive stance.
3. [Argument 3] B Reason: The argument states that implementing more accessibility to voting is bad, indicating opposition to the proposal.
4. [Argument 4] A Reason: The argument expresses that implementing more accessibility to voting is the best thing ever, showing support for the proposal.
5. [Argument 5] B Reason: The argument claims that implementing more accessibility to voting is the worst thing ever, indicating strong opposition to the proposal.",,,"1. [A] Reason: The argument suggests that there is already enough influence with a specific group or entity, indicating support for the proposal to restore voting rights to citizens with felony convictions upon release from prison.
2. [A] Reason: The statement expresses agreement with the proposal, indicating support for restoring voting rights to citizens with felony convictions upon release from prison.
3. [B] Reason: The statement expresses disagreement with the proposal, indicating opposition to restoring voting rights to citizens with felony convictions upon release from prison.
4. [A] Reason: The statement expresses strong support for the proposal, indicating agreement with restoring voting rights to citizens with felony convictions upon release from prison.
5. [B] Reason: The statement expresses strong opposition to the proposal, indicating disagreement with restoring voting rights to citizens with felony convictions upon release from prison.","The speaker's argument is that there is already enough influence with ""them"" (presumably referring to a specific group or entity) and therefore, there is no need to change what they are currently doing with it.",,"1. Argument 1: [B] Reason: The argument is against implementing less strict voting standards, suggesting that the current level of influence is sufficient and does not require any changes.
2. Argument 2: [A] Reason: The argument is in favor of implementing less strict voting standards, indicating that it is acceptable.
3. Argument 3: [B] Reason: The argument is against implementing less strict voting standards, stating that it is bad.
4. Argument 4: [A] Reason: The argument is in favor of implementing less strict voting standards, claiming that it is the best thing ever.
5. Argument 5: [B] Reason: The argument is against implementing less strict voting standards, asserting that it is the worst thing ever.",,,"1. [Argument 1] C Reason: The argument does not directly address the proposal of implementing limits on financing individual candidates and parties. It focuses on the existing influence of a specific group or entity, which is not applicable to the proposal itself.
2. [Argument 2] A Reason: This argument supports the proposal, indicating that implementing limits on financing individual candidates and parties is acceptable.
3. [Argument 3] B Reason: This argument opposes the proposal, suggesting that implementing limits on financing individual candidates and parties is bad.
4. [Argument 4] B Reason: This argument strongly supports the proposal, stating that it is the best thing ever.
5. [Argument 5] B Reason: This argument strongly opposes the proposal, claiming that it is the worst thing ever.",False,False,False,False,False,False,False,True,False
