,Order,Speaker,Time,Text,Has Arguments,All Arguments Summarized,(Beta) For proposal: Implement RCV as an alternative method both to elected officials and representatives at all levels,(Beta) Against proposal: Implement RCV as an alternative method both to elected officials and representatives at all levels,(Beta) Proposal raw ouput for debugging: Implement RCV as an alternative method both to elected officials and representatives at all levels,(Beta) For proposal: Change the primary system,(Beta) Against proposal: Change the primary system,(Beta) Proposal raw ouput for debugging: Change the primary system,(Beta) For proposal: Use proportional representatives to elect elected officials,(Beta) Against proposal: Use proportional representatives to elect elected officials,(Beta) Proposal raw ouput for debugging: Use proportional representatives to elect elected officials,(Beta) For proposal: Change the current electoral college,(Beta) Against proposal: Change the current electoral college,(Beta) Proposal raw ouput for debugging: Change the current electoral college,(Beta) For proposal: Implement more accessibility to voting,(Beta) Against proposal: Implement more accessibility to voting,(Beta) Proposal raw ouput for debugging: Implement more accessibility to voting,(Beta) For proposal: Restore federal and state voting rights to citizens with felony convictions upon their release from prison,(Beta) Against proposal: Restore federal and state voting rights to citizens with felony convictions upon their release from prison,(Beta) Proposal raw ouput for debugging: Restore federal and state voting rights to citizens with felony convictions upon their release from prison,(Beta) For proposal: Implement voting standards that are less strict,(Beta) Against proposal: Implement voting standards that are less strict,(Beta) Proposal raw ouput for debugging: Implement voting standards that are less strict,(Beta) For proposal: Implement more measures to address voter fraud,(Beta) Against proposal: Implement more measures to address voter fraud,(Beta) Proposal raw ouput for debugging: Implement more measures to address voter fraud,(Beta) For proposal: Implement more fairness and transparency in the election process,(Beta) Against proposal: Implement more fairness and transparency in the election process,(Beta) Proposal raw ouput for debugging: Implement more fairness and transparency in the election process,(Beta) For proposal: Implement limits on financing individual candidates and parties,(Beta) Against proposal: Implement limits on financing individual candidates and parties,(Beta) Proposal raw ouput for debugging: Implement limits on financing individual candidates and parties,(Beta) For proposal: Increase in public funding and financing for campaigns,(Beta) Against proposal: Increase in public funding and financing for campaigns,(Beta) Proposal raw ouput for debugging: Increase in public funding and financing for campaigns,(Beta) For proposal: Implement a term limit for Supreme Court Justices,(Beta) Against proposal: Implement a term limit for Supreme Court Justices,(Beta) Proposal raw ouput for debugging: Implement a term limit for Supreme Court Justices,(Beta) For proposal: Increase opportunities for learning about civic education in schools,(Beta) Against proposal: Increase opportunities for learning about civic education in schools,(Beta) Proposal raw ouput for debugging: Increase opportunities for learning about civic education in schools,comparisonToCurrentSystem,votingDecisions,partyRepresentation,voterTurnout,strategicVoting,moderateCandidates,moneyInPolitics,other,notRelevant
0,1,48613,"""2:04""", hi greg again. nice to see you guys.,No,,,,,,,,,,,,,,,,,,,,,,,,,,,,,,,,,,,,,,,,,False,False,False,False,False,False,False,False,False
1,2,48599,"""2:10""", high as soon as you can. i see you guys again.,No,,,,,,,,,,,,,,,,,,,,,,,,,,,,,,,,,,,,,,,,,False,False,False,False,False,False,False,False,False
2,3,9871,"""2:14""", yep. it's always nice to see everyone.,No,,,,,,,,,,,,,,,,,,,,,,,,,,,,,,,,,,,,,,,,,False,False,False,False,False,False,False,False,False
3,4,10353,"""2:17""", tarik. happy thursday.,No,,,,,,,,,,,,,,,,,,,,,,,,,,,,,,,,,,,,,,,,,False,False,False,False,False,False,False,False,False
4,5,48677,"""2:20"""," yeah, i'm back. paul from nashville.",No,,,,,,,,,,,,,,,,,,,,,,,,,,,,,,,,,,,,,,,,,False,False,False,False,False,False,False,False,False
5,6,48654,"""2:25""", hello everyone. it's josh again. nice to see you all again.,No,,,,,,,,,,,,,,,,,,,,,,,,,,,,,,,,,,,,,,,,,False,False,False,False,False,False,False,False,False
6,7,9650,"""2:29"""," hello. it's karen again and it's 92 here, very hot.",No,,,,,,,,,,,,,,,,,,,,,,,,,,,,,,,,,,,,,,,,,False,False,False,False,False,False,False,False,False
7,8,10353,"""12:48"""," i think that public financing, which is next topic can mitigate a lot of the issues caused by, you know, dollar amounts because it's actually, it doesn't take that much per capita for small donors to outspend big donors. the issue is people just don't do it. so that is mainly a public financing issue where the millionaires billionaires, they got that money because like a million people like 100 million, people spent like ten dollars each at their store but if",Yes,"- Public financing can mitigate the issues caused by large dollar amounts in campaign financing.
- Small donors can outspend big donors if they contribute enough per capita.
- The main issue is that people do not contribute enough, which is a public financing problem.
- Millionaires and billionaires have accumulated their wealth because a large number of people spent money at their stores.",,,"1. Public financing can mitigate the issues caused by large dollar amounts in campaign financing.
C Reason: This argument is not applicable to the given proposal of implementing a term limit for Supreme Court Justices. Public financing is related to campaign financing, not term limits for Supreme Court Justices.

2. Small donors can outspend big donors if they contribute enough per capita.
C Reason: This argument is not applicable to the given proposal. It discusses the potential of small donors outspending big donors, which is unrelated to implementing term limits for Supreme Court Justices.

3. The main issue is that people do not contribute enough, which is a public financing problem.
C Reason: This argument is not applicable to the given proposal. It focuses on the issue of people not contributing enough, which is related to public financing, not term limits for Supreme Court Justices.

4. Millionaires and billionaires have accumulated their wealth because a large number of people spent money at their stores.
C Reason: This argument is not applicable to the given proposal. It discusses the accumulation of wealth by millionaires and billionaires, which is unrelated to implementing term limits for Supreme Court Justices.

5. Implement a term limit for Supreme Court Justices is okay.
A Reason: This argument is a pro argument",,,"1. [Argument 1] A Reason: This argument is a pro because public financing can help level the playing field and reduce the influence of large campaign donations, making the electoral process more accessible and fair for all voters.
2. [Argument 2] A Reason: This argument is a pro because it suggests that small donors can have a significant impact on campaign financing if they contribute enough per capita. This can encourage more individuals to participate in the political process and make their voices heard.
3. [Argument 3] A Reason: This argument is not applicable to the given proposal. It discusses the issue of people not contributing enough, which is related to public financing, but it does not directly address the accessibility of voting.
4. [Argument 4] B Reason: This argument is a con because it suggests that millionaires and billionaires have accumulated their wealth due to people spending money at their stores. While this may be true, it does not directly relate to the proposal of implementing more accessibility to voting.
5. [Argument 5] C Reason: This argument is not applicable to the given proposal. It simply states that implementing more accessibility to voting is okay without providing any reasoning or supporting arguments.",,,"1. Public financing can mitigate the issues caused by large dollar amounts in campaign financing.
A) Pro
Reason: This argument supports the proposal by suggesting that public financing can help address the problems associated with large campaign financing. 

2. Small donors can outspend big donors if they contribute enough per capita.
A) Pro
Reason: This argument supports the proposal by highlighting the potential of small donors to have a significant impact if they contribute enough per person. It suggests that limiting financing can level the playing field between small and big donors.

3. The main issue is that people do not contribute enough, which is a public financing problem.
A) Pro
Reason: This argument supports the proposal by stating that the main issue lies in insufficient contributions from individuals. It implies that implementing limits on financing can help address this problem by encouraging more people to contribute.

4. Millionaires and billionaires have accumulated their wealth because a large number of people spent money at their stores.
C) Not applicable
Reason: This argument does not directly relate to the proposal of implementing limits on financing individual candidates and parties. It discusses the accumulation of wealth by millionaires and billionaires, which is not directly relevant to the topic.

5. Implement limits on financing individual candidates and parties is okay.
C) Not",,,"1. [A] Reason: Public financing can help reduce the influence of large dollar amounts in campaign financing by providing equal funding to all candidates, regardless of their financial resources. This argument supports the proposal.
2. [A] Reason: If small donors contribute enough per capita, they can collectively outspend big donors. This argument suggests that public financing can level the playing field and empower small donors, which aligns with the proposal.
3. [A] Reason: The argument states that the main issue is the lack of sufficient contributions, which implies that public financing can address this problem by providing additional funding for campaigns. This argument supports the proposal.
4. [B] Reason: The argument about millionaires and billionaires accumulating wealth due to people spending money at their stores is not directly applicable to the proposal of increasing public funding and financing for campaigns. It does not provide a clear stance on the proposal itself.
5. [C] Reason: The argument simply states that an increase in public funding and financing for campaigns is okay without providing any reasoning or explanation. It does not contribute to the discussion or provide a clear stance on the proposal.",,,"1. [A] Reason: Public financing can help level the playing field and reduce the influence of big donors in campaigns, which is a positive aspect in addressing voter fraud.
2. [A] Reason: If small donors contribute enough per capita, they can collectively outspend big donors, which can help counterbalance the influence of wealthy individuals and reduce the potential for voter fraud.
3. [A] Reason: The argument suggests that the main issue is the lack of sufficient contributions, which can be addressed through public financing. This aligns with the proposal's aim to implement more measures to address voter fraud.
4. [B] Reason: The argument discusses the accumulation of wealth by millionaires and billionaires, which is not directly related to the proposal of implementing more measures to address voter fraud. It is more focused on the economic impact of consumer spending.
5. [C] Reason: This argument does not provide any clear stance or relevance to the proposal. It is not applicable to determining whether the proposal is pro, con, or not applicable.",,,"1. [A] Reason: Public financing can help level the playing field and reduce the influence of large campaign donations, which is a positive aspect of the proposal.
2. [A] Reason: If small donors contribute enough per capita, they can collectively outspend big donors, which supports the idea of proportional representation and reducing the influence of wealthy individuals.
3. [A] Reason: The proposal addresses the issue of insufficient contributions by advocating for public financing, which can help increase overall funding for campaigns and reduce the reliance on a small number of wealthy donors.
4. [B] Reason: This argument is not applicable to the given proposal as it focuses on the accumulation of wealth by millionaires and billionaires, which is not directly related to the use of proportional representation to elect officials.
5. [C] Reason: This argument is not applicable to the given proposal as it simply states that using proportional representation to elect officials is acceptable without providing any specific reasoning or analysis.",,,"1. Public financing can mitigate the issues caused by large dollar amounts in campaign financing.
A) Pro
Reason: This argument supports the proposal by suggesting that public financing can help address the problems associated with campaign financing, which is a positive aspect of implementing RCV.

2. Small donors can outspend big donors if they contribute enough per capita.
A) Pro
Reason: This argument supports the proposal by highlighting the potential advantage of small donors being able to outspend big donors if they contribute enough per capita, which is a positive aspect of implementing RCV.

3. The main issue is that people do not contribute enough, which is a public financing problem.
A) Pro
Reason: This argument supports the proposal by identifying the main issue as people not contributing enough, which implies that implementing RCV could help address this problem through public financing.

4. Millionaires and billionaires have accumulated their wealth because a large number of people spent money at their stores.
C) Not applicable
Reason: This argument does not directly relate to the proposal of implementing RCV as an alternative method to elected officials and representatives. It discusses the accumulation of wealth by millionaires and billionaires, which is not directly relevant to the topic.

5. Implement RCV as an alternative method both to elected",,,"1. [A] Reason: Public financing can help level the playing field in campaign financing by reducing the influence of large dollar amounts from wealthy donors. This argument supports the proposal.
2. [A] Reason: If small donors contribute enough per capita, they can collectively outspend big donors, which can help reduce the influence of wealthy individuals in elections. This argument supports the proposal.
3. [A] Reason: The argument suggests that the main issue in campaign financing is the lack of sufficient contributions from the public, indicating a need for public financing. This argument supports the proposal.
4. [A] Reason: This argument highlights that millionaires and billionaires have accumulated their wealth due to people spending money at their stores, implying that the public's financial contributions have played a significant role in their success. This argument supports the proposal.
5. [C] Reason: This statement does not present an argument for or against the proposal. It simply states that restoring voting rights to citizens with felony convictions upon release from prison is acceptable.",,,"1. [A] Reason: Public financing can help reduce the influence of large dollar amounts in campaign financing, which is a positive aspect of the proposal to increase opportunities for learning about civic education in schools.
2. [A] Reason: If small donors contribute enough per capita, they can outspend big donors, which supports the idea that increasing opportunities for learning about civic education in schools can lead to a more informed and engaged citizenry.
3. [A] Reason: The argument suggests that the main issue is the lack of sufficient contributions, which can be addressed through public financing. This aligns with the proposal to increase opportunities for learning about civic education in schools, as it aims to educate individuals about the importance of civic participation and potentially encourage more contributions.
4. [B] Reason: The argument discusses how millionaires and billionaires have accumulated wealth through people spending money at their stores. While this may be true, it is not directly applicable to the proposal to increase opportunities for learning about civic education in schools. It does not provide a clear argument for or against the proposal.
5. [C] Reason: The statement simply states that the proposal to increase opportunities for learning about civic education in schools is okay. It does not provide any argument or reasoning, making it not",,,"1. [Argument 1] A Reason: This argument is a pro because public financing can help reduce the influence of large dollar amounts in campaign financing, making the primary system more fair and accessible to candidates who may not have access to significant financial resources.

2. [Argument 2] A Reason: This argument is a pro because it suggests that small donors, if they contribute enough per capita, can outspend big donors. This can level the playing field and reduce the influence of wealthy individuals or special interest groups in the primary system.

3. [Argument 3] A Reason: This argument is a pro because it highlights the main issue of people not contributing enough, which can be addressed through public financing. By providing adequate public financing options, more individuals may be encouraged to contribute, leading to a more inclusive and representative primary system.

4. [Argument 4] B Reason: This argument is a con because it presents a different perspective that is not directly related to the proposal of changing the primary system. While it acknowledges the wealth accumulation of millionaires and billionaires, it does not provide a clear connection to the primary system or how changing it would address this issue.

5. [Argument 5] C Reason: This argument is marked as ""not applicable"" because",,,"1. [A] Reason: Public financing can help level the playing field and reduce the influence of large dollar amounts in campaign financing, which is a positive aspect of the proposal.
2. [A] Reason: If small donors contribute enough per capita, they can potentially outspend big donors, which is another positive aspect of the proposal.
3. [A] Reason: The proposal suggests that the main issue lies in the lack of sufficient contributions, which can be addressed through public financing. Therefore, this argument supports the proposal.
4. [B] Reason: This argument is not applicable to the given proposal. It discusses the accumulation of wealth by millionaires and billionaires, which is not directly related to changing the electoral college.
5. [C] Reason: This argument is not applicable to the given proposal. It simply states that changing the current electoral college is acceptable without providing any specific reasoning or argument.",,,"1. [Argument 1] A Reason: This argument is a pro because it suggests that implementing voting standards that are less strict can help mitigate the issues caused by large dollar amounts in campaign financing.
2. [Argument 2] A Reason: This argument is a pro because it suggests that small donors can outspend big donors if they contribute enough per capita, which implies that implementing voting standards that are less strict can allow for more equal participation and influence in campaign financing.
3. [Argument 3] A Reason: This argument is not applicable to the given proposal because it discusses the issue of people not contributing enough, which is related to public financing, rather than voting standards.
4. [Argument 4] B Reason: This argument is a con because it suggests that millionaires and billionaires have accumulated their wealth due to people spending money at their stores, which is unrelated to the proposal of implementing less strict voting standards.
5. [Argument 5] C Reason: This argument is not applicable to the given proposal because it simply states that implementing voting standards that are less strict is okay, without providing any reasoning or supporting arguments.",,,"1. [Argument 1] A Reason: Public financing can help level the playing field by reducing the influence of large campaign donations, which promotes fairness and transparency in the election process.
2. [Argument 2] A Reason: If small donors contribute enough per capita, they can collectively outspend big donors, which promotes fairness in the election process.
3. [Argument 3] A Reason: The argument highlights that the main issue lies in the lack of sufficient contributions, which suggests that public financing can address this problem and promote fairness and transparency in the election process.
4. [Argument 4] B Reason: The argument is not directly applicable to the given proposal as it focuses on the accumulation of wealth by millionaires and billionaires, rather than addressing fairness and transparency in the election process.
5. [Argument 5] C Reason: The statement does not present an argument but rather expresses a general acceptance or agreement with the proposal. Therefore, it is not applicable to determine if it is a pro or con argument.",False,False,False,False,False,False,False,False,False
