Order,Speaker,Time,Text,Has Arguments,All Arguments Summarized,FOR: limitCampaignContributions,AGAINST: limitCampaignContributions,FOR: closeForeignLoopholes,AGAINST: closeForeignLoopholes,FOR: establishRedistrictingCommissions,AGAINST: establishRedistrictingCommissions,FOR: implementProportionalRepresentation,AGAINST: implementProportionalRepresentation,FOR: encourageTransparency,AGAINST: encourageTransparency,FOR: promoteCivicEducation,AGAINST: promoteCivicEducation,FOR: explorePublicFunding,AGAINST: explorePublicFunding,other,notRelevant,FOR: limitCampaignContributions (bool),AGAINST: limitCampaignContributions (bool),FOR: closeForeignLoopholes (bool),AGAINST: closeForeignLoopholes (bool),FOR: establishRedistrictingCommissions (bool),AGAINST: establishRedistrictingCommissions (bool),FOR: implementProportionalRepresentation (bool),AGAINST: implementProportionalRepresentation (bool),FOR: encourageTransparency (bool),AGAINST: encourageTransparency (bool),FOR: promoteCivicEducation (bool),AGAINST: promoteCivicEducation (bool),FOR: explorePublicFunding (bool),AGAINST: explorePublicFunding (bool),other (bool),notRelevant (bool)
1,9780,"""2:06""","Welcome back, everybody. It's that's okay. Here in the Hudson Valley, New York area.",no,,,,,,,,,,,,,,,,,,False,False,False,False,False,False,False,False,False,False,False,False,False,False,False,False
2,9687,"""2:12""",,no,,,,,,,,,,,,,,,,,,False,False,False,False,False,False,False,False,False,False,False,False,False,False,False,False
3,9687,"""2:12""",I get everyone Mike. It's been nice talking to you all the past couple of times here.,no,,,,,,,,,,,,,,,,,,False,False,False,False,False,False,False,False,False,False,False,False,False,False,False,False
4,48742,"""2:19""",Hi again everybody. This is Katia from Vermont.,no,,,,,,,,,,,,,,,,,,False,False,False,False,False,False,False,False,False,False,False,False,False,False,False,False
5,48738,"""2:23""",I am Jesse. I'm from West Virginia.,no,,,,,,,,,,,,,,,,,,False,False,False,False,False,False,False,False,False,False,False,False,False,False,False,False
6,48741,"""2:26""",,no,,,,,,,,,,,,,,,,,,False,False,False,False,False,False,False,False,False,False,False,False,False,False,False,False
7,48743,"""2:30""",,no,,,,,,,,,,,,,,,,,,False,False,False,False,False,False,False,False,False,False,False,False,False,False,False,False
8,9687,"""12:59""","Me personally, I would never be a donor of anywhere near any of these amounts. Did contrary to many candidates these dollar amounts are way too high for me to even think about",yes," 1. The speaker feels that the dollar amounts mentioned are too high for them to consider donating.
2. The speaker states that they have never been, and never would be, a donor of such amounts.
3. The speaker contrasts themselves with many other candidates, implying that these candidates may be more willing to donate such high amounts.", The speaker feels that the dollar amounts mentioned are too high for them to consider donating," The speaker states that they have never been, and never would be, a donor of such amounts",,,,,,,,,,,,,," The speaker contrasts themselves with many other candidates, implying that these candidates may be more willing to donate such high amounts",True,True,False,False,False,False,False,False,False,False,False,False,False,False,False,True
9,9780,"""13:17""","Yeah, I tend to agree with that. Mike. I think our candidates are more inclined to listen to the, the upper echelon. The one percenters as opposed to Everyday people like you and",no,,,,,,,,,,,,,,,,,,False,False,False,False,False,False,False,False,False,False,False,False,False,False,False,False
10,48742,"""13:35""","I agree with Mike as well, and these amounts already high and I think just increasing the limit would just make it harder for Less wealthy individuals to participate in to support that. So I think they probably should be left alone since they already high enough as it is.",yes," 1. The speaker agrees with Mike's viewpoint.
2. The amounts being discussed are already high.
3. The speaker thinks increasing the limit would make it harder for less wealthy individuals to participate.
4. The speaker believes the amounts should be left alone since they are already high enough.", The speaker thinks increasing the limit would make it harder for less wealthy individuals to participate, The speaker believes the amounts should be left alone since they are already high enough,,,,,,,,,,,,, The amounts being discussed are already high, The speaker agrees with Mike's viewpoint,True,True,False,False,False,False,False,False,False,False,False,False,False,False,True,True
11,48743,"""14:00""","Yeah, I'm in complete agreement to that. Those numbers are high enough. I think we all suffer the consequences of seeing when these campaigns get going with the extra money especially from the packs how their commercials on TV and everything else really don't accomplish anything other than negative advertising.",no,,,,,,,,,,,,,,,,,,False,False,False,False,False,False,False,False,False,False,False,False,False,False,False,False
12,9687,"""14:31""","I do like the idea of closing loopholes for foreign control money coming into the election because I don't think the foreigners should have any kind of influence over the US election system. However, no matter what laws, you make to close, loopholes someone who still going to find a way to break them or around them.",no,,,,,,,,,,,,,,,,,,False,False,False,False,False,False,False,False,False,False,False,False,False,False,False,False
13,9780,"""14:53""",,no,,,,,,,,,,,,,,,,,,False,False,False,False,False,False,False,False,False,False,False,False,False,False,False,False
14,9780,"""14:53""","Well, I think this is an evolutionary I'll Endeavor the more we know, the more we can Institute change. I am all for closing, those loopholes from foreign entities and that influence that comes with it, particularly with the online ads. So yes, someone will find a way to get through but then we'll have to go back and address that as well.",no,,,,,,,,,,,,,,,,,,False,False,False,False,False,False,False,False,False,False,False,False,False,False,False,False
15,48743,"""15:21""","I think any of the major donors, whether it's the pack, or whether it's corporations, or whatever, there needs to be some regulation, or something to tighten up on the expenditures that they're making for the elections with a pretty much just taking the normal person out of the vote.",yes," 1. The need for regulation of major donors, such as corporations, is highlighted.
2. These donors are currently making large expenditures for elections.
3. Such large expenditures are seen as preventing the normal person from participating effectively in the voting process."," The need for regulation of major donors, such as corporations, is highlighted",,,,,,,,,,,,,, These donors are currently making large expenditures for elections, Such large expenditures are seen as preventing the normal person from participating effectively in the voting process,True,False,False,False,False,False,False,False,False,False,False,False,False,False,True,True
16,9780,"""15:45""",,no,,,,,,,,,,,,,,,,,,False,False,False,False,False,False,False,False,False,False,False,False,False,False,False,False
17,9780,"""15:45""",How does everyone feel about using the Democracy that ouch errs to engage? The Everyday People Like Us.,no,,,,,,,,,,,,,,,,,,False,False,False,False,False,False,False,False,False,False,False,False,False,False,False,False
18,48742,"""15:57""","I like that a lot. I think it will give voice to a lot of little people who would not normally have the, have their voices heard",no,,,,,,,,,,,,,,,,,,False,False,False,False,False,False,False,False,False,False,False,False,False,False,False,False
19,9687,"""16:07""","Just feels like an added text that, you know, some of us may not be willing to pay.",yes," 1. The text is about something that feels like an optional addition.
2. Some people may not be willing to pay for this added feature.",,,,,,,,,,,,,,,, The text is about something that feels like an optional addition  Some people may not be willing to pay for this added feature,False,False,False,False,False,False,False,False,False,False,False,False,False,False,False,True
20,48738,"""16:13""","Yeah, I feel like unless they're going to impose these fines for people to not vote than that's really, it's not realistic.",no,,,,,,,,,,,,,,,,,,False,False,False,False,False,False,False,False,False,False,False,False,False,False,False,False
21,9687,"""16:24""",putting a fine for not voting is,no,,,,,,,,,,,,,,,,,,False,False,False,False,False,False,False,False,False,False,False,False,False,False,False,False
22,9687,"""16:24"""," that doesn't sit right either because a lot of people just choose not to vote, I mean there's there should be nothing forcing me to vote, but there should be, you know, the civic responsibility that says you should vote.",yes," 1. Some people choose not to vote.
2. Not forcing people to vote is a common view.
3. There should be a civic responsibility to vote.",,,,,,,,,,,,,,,, Some people choose not to vote  Not forcing people to vote is a common view  There should be a civic responsibility to vote,False,False,False,False,False,False,False,False,False,False,False,False,False,False,False,True
23,48738,"""16:42""",,no,,,,,,,,,,,,,,,,,,False,False,False,False,False,False,False,False,False,False,False,False,False,False,False,False
24,48738,"""16:42""",,no,,,,,,,,,,,,,,,,,,False,False,False,False,False,False,False,False,False,False,False,False,False,False,False,False
25,48738,"""16:42""",,no,,,,,,,,,,,,,,,,,,False,False,False,False,False,False,False,False,False,False,False,False,False,False,False,False
26,48742,"""16:50""","I just wanted to say that, forcing somebody to vote would also violate freedom of speech or freedom of choice. I think we should all have a should have that choice even though it should be encouraged.",yes," 1. The author believes that forcing someone to vote is a violation of their freedom of speech or freedom of choice.
2. The author thinks that every person should have the choice to vote.
3. Although the author believes that voting should be encouraged.",,,,,,,,,,,,,,,, The author believes that forcing someone to vote is a violation of their freedom of speech or freedom of choice  The author thinks that every person should have the choice to vote  Although the author believes that voting should be encouraged,False,False,False,False,False,False,False,False,False,False,False,False,False,False,False,True
27,48743,"""17:02""",,no,,,,,,,,,,,,,,,,,,False,False,False,False,False,False,False,False,False,False,False,False,False,False,False,False
28,48743,"""17:02""","I mean, if you have to force somebody to vote, then I'm not really sure we're going to get any kind of accurate. Voting people are just going to walk in thinking through a bunch of, you know, check-offs and then head out some",yes," 1. Forcing someone to vote may not result in accurate voting.
2. Voters may not carefully consider their choices when forced to vote.
3. They may just quickly go through the motions of voting and leave.
4. The process may become a mere checklist exercise for them.",,,,,,,,,,,,,,,, Forcing someone to vote may not result in accurate voting  Voters may not carefully consider their choices when forced to vote  They may just quickly go through the motions of voting and leave  The process may become a mere checklist exercise for them,False,False,False,False,False,False,False,False,False,False,False,False,False,False,False,True
29,9780,"""17:21""",,no,,,,,,,,,,,,,,,,,,False,False,False,False,False,False,False,False,False,False,False,False,False,False,False,False
30,9780,"""17:21""","Well, that I agree with 100% And also, who's going to monitor this? I mean, come on. I'm totally against finds not building, but seriously, just monitoring who doesn't doesn't vote is going to be",yes," 1. The speaker agrees with a previous statement completely.
2. The speaker expresses their disagreement with finds not building.
3. The speaker raises a concern about who will monitor those who don't vote.
4. The speaker expresses their skepticism about the feasibility of monitoring non-voters.",,,,,,,,,,,,,,,, The speaker agrees with a previous statement completely  The speaker expresses their disagreement with finds not building  The speaker raises a concern about who will monitor those who don't vote  The speaker expresses their skepticism about the feasibility of monitoring non-voters,False,False,False,False,False,False,False,False,False,False,False,False,False,False,False,True
31,9687,"""17:42""","Well, I think they already have the voter rolls, you know, registry. I know when I go in to vote, they look up my name on a piece of paper. They cross my name off, so that I can't go stand at the end of the line and vote a second time. So they kind of know who does and doesn't vote, you know, as long as you're registered to vote.",no,,,,,,,,,,,,,,,,,,False,False,False,False,False,False,False,False,False,False,False,False,False,False,False,False
32,48743,"""20:22""","You know, it doesn't seem like people like us should be worried about, you know, our two hundred dollar contribution, it should be more of the pack organizations, the industrial groups things like that that are contributing large amounts of money. I mean, you see the ads on TV and it's not even endorsed by the candidate. It just says, this is, you know, this ad has been taken out by such and such",yes," 1. The text is about the issue of campaign contributions in elections.
2. The speaker believes that people like them, who contribute small amounts of money, should not be as concerned as larger organizations.
3. The speaker refers to these larger organizations as ""pack organizations"" and ""industrial groups.""
4. The speaker mentions seeing political ads on TV that are not endorsed by the candidate.
5. These ads are taken out by unnamed organizations, as indicated by the phrase ""this ad has been taken out by such and such.""", The text is about the issue of campaign contributions in elections," The speaker believes that people like them, who contribute small amounts of money, should not be as concerned as larger organizations",,,,,,,""" The speaker mentions seeing political ads on TV that are not endorsed by the candidate"," These ads are taken out by unnamed organizations, as indicated by the phrase ""this ad has been taken out by such and such",,,"""",," The speaker refers to these larger organizations as ""pack organizations"" and ""industrial groups",,True,True,False,False,False,False,False,False,True,True,False,False,True,False,True,False
33,48743,"""20:22""", and it just seems kind of ridiculous. It pretty much takes the general population out of the vote.,yes," 1. The text expresses a view that something seems unreasonable.
2. This situation is described as making it difficult for the general population to vote.",,,,,,,,,,,,,,,, The text expresses a view that something seems unreasonable  This situation is described as making it difficult for the general population to vote,False,False,False,False,False,False,False,False,False,False,False,False,False,False,False,True
34,9687,"""21:04""","Yeah. Again I don't like the idea of using public funds because it's just going to become a tax. I just really quickly did the math on it and let's say twenty billion dollars divided by 325 million people in this country that's about sixty dollars tax additional that we'd all have to pay just to, you know, give people to spend money on on voting and",no,,,,,,,,,,,,,,,,,,False,False,False,False,False,False,False,False,False,False,False,False,False,False,False,False
35,9687,"""21:04""", It doesn't sit quite right.,no,,,,,,,,,,,,,,,,,,False,False,False,False,False,False,False,False,False,False,False,False,False,False,False,False
36,10381,"""21:45""",I agree with Mike.,yes," 1. You agree with Mike's perspective.

Note: This is a brief summary as the original text only contains a single sentence expressing agreement with someone named Mike.",  e: This is a brief summary as the original text only contains a single sentence expressing agreement with someone named Mike,,,,,,,,,,,,,,, You agree with Mike's perspective,True,False,False,False,False,False,False,False,False,False,False,False,False,False,False,True
37,9687,"""21:56""","And you know, going back to what Bob was saying about, you know, individual contributions under $200. It's a pain because I attended event and I made a 20 dollar donation and I was basically forced to fill out paperwork for that 20 dollar donation.",yes," 1. Bob discussed individual contributions under $200.
2. The speaker attended an event and made a $20 donation.
3. The speaker was required to complete paperwork for the $20 donation.", The speaker was required to complete paperwork for the $20 donation,,,,,,,, Bob discussed individual contributions under $200,,,,,,, The speaker attended an event and made a $20 donation,True,False,False,False,False,False,False,False,True,False,False,False,False,False,False,True
38,9687,"""21:56"""," Which, you know, means now, they have my name now, they have my address now, they have my phone number and, you know, next time there's a campaign going on. I'm sure they'll be calling me directly or mailing me directly because I was a previous donor.",yes," 1. The person's name has been obtained by the recipient of the donation.
2. The recipient now has the person's address.
3. The recipient also has the person's phone number.
4. The recipient will likely contact the person directly in future campaigns, due to their previous donation.
5. The contact may be through phone calls or direct mail."," The recipient will likely contact the person directly in future campaigns, due to their previous donation",,,,,,,,,,,,,,, The person's name has been obtained by the recipient of the donation  The recipient now has the person's address  The recipient also has the person's phone number  The contact may be through phone calls or direct mail,True,False,False,False,False,False,False,False,False,False,False,False,False,False,False,True
39,48742,"""22:42""","Well, I just wanted to agree with the previous statements that it would be nice to minimize the use of public funds. It did sound, I like the idea of the Democracy vouchers. But yeah, it would be nice to not utilize public funds as much.",yes," 1. The reader agrees with previous statements about minimizing the use of public funds.
2. The reader likes the idea of Democracy vouchers.
3. However, the reader still prefers to minimize the use of public funds.",,,,,,,,,,,,, The reader likes the idea of Democracy vouchers," The reader agrees with previous statements about minimizing the use of public funds  However, the reader still prefers to minimize the use of public funds",,,False,False,False,False,False,False,False,False,False,False,False,False,True,True,False,False
40,9687,"""23:04""","The other certainly much better uses of public funds, helping homeless or hungry, or whatever school systems, then to go to, you know, political candidates. Digging dirt on each.",yes," 1. Public funds should be used for beneficial purposes.
2. Some more beneficial uses of public funds include helping the homeless and hungry, and improving school systems.
3. Using public funds to support political candidates and dig up dirt on them is not a good use of resources.",,,,,,,,,,,,, Public funds should be used for beneficial purposes, Using public funds to support political candidates and dig up dirt on them is not a good use of resources,," Some more beneficial uses of public funds include helping the homeless and hungry, and improving school systems",False,False,False,False,False,False,False,False,False,False,False,False,True,True,False,True
41,48743,"""23:29""","It would almost seem to make sense to put a cap on the total expenditure for a major elections like the presidency and things like that. Because it is getting out of hand, the amount of money spent and the bombardment of negative ads and other things, it would make more sense to cap it instead of worrying about increasing, it better utilize the funding that they do bring in.",yes," 1. The idea of placing a cap on total expenditure for major elections, such as the presidency, has been proposed.
2. The reason for this suggestion is that the amount of money spent on elections has been increasing and becoming excessive.
3. The bombardment of negative ads and other election-related content has also been criticized.
4. Instead of focusing on increasing the funding, it is believed that capping the expenditure would be more beneficial.
5. This would also ensure better utilization of the funding that political campaigns do bring in."," The idea of placing a cap on total expenditure for major elections, such as the presidency, has been proposed  Instead of focusing on increasing the funding, it is believed that capping the expenditure would be more beneficial",,,,,,,,, The bombardment of negative ads and other election-related content has also been criticized,,, The reason for this suggestion is that the amount of money spent on elections has been increasing and becoming excessive,,, This would also ensure better utilization of the funding that political campaigns do bring in,True,False,False,False,False,False,False,False,False,True,False,False,True,False,False,True
42,48738,"""23:58""","Bob, I definitely agree with that.",no,,,,,,,,,,,,,,,,,,False,False,False,False,False,False,False,False,False,False,False,False,False,False,False,False
43,48742,"""24:01""",I also agree with Bob. Once the cap is met the either stop doing their ads or stop promoting or is it just wisely spread it out over the whole campaign? Does it get enough exposure? And I think that would be the wisest thing then trying to spend more and more money.,yes," 1. The speaker agrees with Bob's previous statement.
2. The speaker suggests three possible actions when a cap is met:
	* Stop doing their ads.
	* Stop promoting.
	* Wisely spread out the promotional efforts over the entire campaign.
3. The speaker questions whether the budget limit would provide enough exposure.
4. The speaker suggests that it would be wiser to stop spending more money.", The speaker suggests three possible actions when a cap is met: Stop doing their ads,,,,,,,,,,,,,,, The speaker agrees with Bob's previous statement  Stop promoting  Wisely spread out the promotional efforts over the entire campaign  The speaker questions whether the budget limit would provide enough exposure  The speaker suggests that it would be wiser to stop spending more money,True,False,False,False,False,False,False,False,False,False,False,False,False,False,False,True
44,9687,"""25:40""",I would say there's no such thing as independent nonpartisan.,no,,,,,,,,,,,,,,,,,,False,False,False,False,False,False,False,False,False,False,False,False,False,False,False,False
45,48743,"""25:45""","I kind of agree with you, but I'd rather at least try to get something like that, then one of the political parties, sorting it out because, you know, they're not going to go against their own Goods.",no,,,,,,,,,,,,,,,,,,False,False,False,False,False,False,False,False,False,False,False,False,False,False,False,False
46,9687,"""26:04""","There should probably be a law that that the districts drawn need to represent, you know, rectangular let's say boundaries something along those lines. You can't you can't have a district that looks. I don't know. I don't know what the best way to describe it would be but like you know like a puzzle piece where you have you know Cuts in and out and goes and going around just to try and get the groups of people that you want.",yes," 1. The districts drawn should represent rectangular boundaries.
2. It is not acceptable to have a district that resembles a puzzle piece with cuts and irregular shapes.
3. This is to ensure that the grouping of people is fair and not manipulated to achieve a desired outcome.",,,,, It is not acceptable to have a district that resembles a puzzle piece with cuts and irregular shapes  This is to ensure that the grouping of people is fair and not manipulated to achieve a desired outcome,,,,,,,,,,, The districts drawn should represent rectangular boundaries,False,False,False,False,True,False,False,False,False,False,False,False,False,False,False,True
47,9687,"""26:04""", Not in a particular District to be part of that.,no,,,,,,,,,,,,,,,,,,False,False,False,False,False,False,False,False,False,False,False,False,False,False,False,False
48,48743,"""26:37""","No, I agree with you completely. It is kind of humorous. The think that you would draw a line going to the third elm tree and then you're going to go down three more blocks and then go around the lake and then skip it trying to get a few extra votes in there. It should be something that's clearly defined you know take a take the state break it up into sections either by population or or I guess population probably the best bet.",no,,,,,,,,,,,,,,,,,,False,False,False,False,False,False,False,False,False,False,False,False,False,False,False,False
49,9780,"""27:05""","Yeah, one of the graphics in our materials showed what they called a Pluto, kicking Donald Duck type of districting, and I think we, excuse me to get away from that. I'm really big on giving the idea of independent nonpartisan redistricting commissions ago. But here's my thing with all other items is this guy",no,,,,,,,,,,,,,,,,,,False,False,False,False,False,False,False,False,False,False,False,False,False,False,False,False
50,9780,"""27:05"""," Got to be a standard. That's got to be some sense, uniformity throughout the country.",no,,,,,,,,,,,,,,,,,,False,False,False,False,False,False,False,False,False,False,False,False,False,False,False,False
