90,48393,"""34:25""","I think what they're saying with the in, like, in comparison to jury duty, if I get a summons to go to jury duty and I don't show up, I'm going to get a fine. I might possibly be arrested because that is a civic duty. That is something I am expected to do as a participating member of this society and to say that voting is less important than jury duty. I think is wrong. I think jury duty is equally as important and it's a civic duty that we should be following through on. And like, we talked about",yes," 1. Not showing up for jury duty may result in a fine or possible arrest.
2. Jury duty is a civic duty expected of participating members of society.
3. The speaker thinks saying that voting is less important than jury duty is incorrect.
4. The speaker believes that voting is of equal importance to jury duty.
5. Voting is a civic duty that we should follow through on, similar to jury duty.",,,,,,,,,,,," Voting is a civic duty that we should follow through on, similar to jury duty",,,, Not showing up for jury duty may result in a fine or possible arrest  Jury duty is a civic duty expected of participating members of society  The speaker thinks saying that voting is less important than jury duty is incorrect  The speaker believes that voting is of equal importance to jury duty,False,False,False,False,False,False,False,False,False,False,False,True,False,False,False,True
91,48393,"""34:25"""," Before. If you want to submit a blank ballot, no one's forcing you to pick a specific candidate. No one's forcing you to make any choice, but you do. It is important that you participate in the system that you are a part.",no,,,,,,,,,,,,,,,,,,False,False,False,False,False,False,False,False,False,False,False,False,False,False,False,False
92,48464,"""35:06""",Okay. So that that makes sense to me. I think if you're going to require obligation people should also give a concession. Like I think this would go nicely hand-in-hand with making,no,,,,,,,,,,,,,,,,,,False,False,False,False,False,False,False,False,False,False,False,False,False,False,False,False
93,48464,"""35:06""", Federal making making Election Day a federal holiday with say mandatory pay so that people aren't being cost too much to vote.,yes," 1. Federal government is considering making Election Day a federal holiday.
2. The proposal includes mandatory pay for workers who take time off to vote.
3. The goal is to reduce costs for people who want to vote.",,,,,,,,,,,,,,,, Federal government is considering making Election Day a federal holiday  The proposal includes mandatory pay for workers who take time off to vote  The goal is to reduce costs for people who want to vote,False,False,False,False,False,False,False,False,False,False,False,False,False,False,False,True
94,48310,"""35:33""","Yeah, I agree with that.",no,,,,,,,,,,,,,,,,,,False,False,False,False,False,False,False,False,False,False,False,False,False,False,False,False
95,9839,"""35:36""","Yes, I think that it should be a Federal holiday so that it would be it, make it easier for people to vote, who work to vote.",no,,,,,,,,,,,,,,,,,,False,False,False,False,False,False,False,False,False,False,False,False,False,False,False,False
96,10458,"""35:46""","Since I moved to Colorado, I have never voted on Election Day because mail-in ballots. So I'd rather us just moved completely to a mail-in ballot then have to have a federal election day and the burden that would put on small businesses.",yes," 1. The person moved to Colorado.
2. They no longer vote on Election Day.
3. The reason for this is the availability of mail-in ballots.
4. They prefer a complete switch to mail-in ballots.
5. They believe having a federal Election Day would burden small businesses.",,,,,,,,,,,,,,, They believe having a federal Election Day would burden small businesses, The person moved to Colorado  They no longer vote on Election Day  The reason for this is the availability of mail-in ballots  They prefer a complete switch to mail-in ballots,False,False,False,False,False,False,False,False,False,False,False,False,False,False,True,True
97,48479,"""36:05""",My I actually had to work on Election Day so I wasn't able to go out and vote myself. So I would appreciate having a holiday on Election Day.,yes," 1. The person had to work on Election Day.
2. They were not able to go out and vote.
3. They would appreciate having a holiday on Election Day.",,,,,,,,,,,,,,,, The person had to work on Election Day  They were not able to go out and vote  They would appreciate having a holiday on Election Day,False,False,False,False,False,False,False,False,False,False,False,False,False,False,False,True
98,9500,"""36:21""","I agree, especially for those who have to work or have children or whatever, like you can't. Just drop work to go vote and make sense.",no,,,,,,,,,,,,,,,,,,False,False,False,False,False,False,False,False,False,False,False,False,False,False,False,False
99,48393,"""36:30""","Well, and I'm wondering if a full national holiday is not feasible, due to different businesses and all those needs. I mean we were comparing it to jury duty like when you go on jury duty, that's a protected thing and you are compensated for your time. If not enough, but your employer can't fire you for going to jury duty so whether that means people get an hour during their work shift that you can go and vote and your employer can't",no,,,,,,,,,,,,,,,,,,False,False,False,False,False,False,False,False,False,False,False,False,False,False,False,False
100,48393,"""36:30""", retaliate against you for doing your civic duty.,no,,,,,,,,,,,,,,,,,,False,False,False,False,False,False,False,False,False,False,False,False,False,False,False,False
