34,48524,"""22:14""","That would be exactly and I'm agreeing with James and, and I'm sorry, it was just just before their time. I don't think it necessarily independent counsel and that have an issues with whether it's actually independent or not, we can pretty much guarantee a special ops the legislature is not going to be intended, any respect and let's create the gerrymandered districts already is anything, but independent, so to have a panel of experts James, I think that's a very good point. Avila panel of experts come in there and say these are some suggestions that would make public that conversation and",no,,,,,,,,,,,,,,,,,,False,False,False,False,False,False,False,False,False,False,False,False,False,False,False,False
35,48524,"""22:14"""," Those people who are trying to just make, just make political maps advantage.",yes," 1. Some people are trying to create political maps.
2. These people have the goal of making the maps advantageous for themselves or their affiliated group.
3. The maps are being made for political purposes.",,,,,, Some people are trying to create political maps  These people have the goal of making the maps advantageous for themselves or their affiliated group,,,,,,,,, The maps are being made for political purposes,,False,False,False,False,False,True,False,False,False,False,False,False,False,False,True,False
36,9788,"""22:48""",I also like James idea of the even computer generated map that could be compared to what map is actually created to show some of their inaccuracies or ways are trying to sway the mapping to the,yes," 1. The user agrees with James' idea of creating a computer-generated map.
2. This computer-generated map can be compared to an actual map to show inaccuracies.
3. The comparison can also demonstrate ways in which maps may be manipulated to influence the user's perception.",,,,,,,,,,,,,,,, The user agrees with James' idea of creating a computer-generated map  This computer-generated map can be compared to an actual map to show inaccuracies  The comparison can also demonstrate ways in which maps may be manipulated to influence the user's perception,False,False,False,False,False,False,False,False,False,False,False,False,False,False,False,True
37,48313,"""23:58""","I think these are all good ideas, but like Matthew and a couple other people that were here discussed in our last small group or separated from you all a lot of other states around the world about 20 or so Implement compulsory voting and some of them have some of them have punitive measures if you don't vote. But I think could be I would much prefer to see incentive you know like a tax credit or something of the sort of something where if I need to be off the grid or if like I'm traveling away and I forget to vote, I'm not going to",yes," 1. The text discusses the idea of compulsory voting.
2. Some states around the world have implemented compulsory voting.
3. Some of these states have punitive measures for not voting.
4. The author would prefer to see incentives for voting, such as a tax credit.
5. The author mentions the possibility of being unable to vote due to being ""off the grid"" or traveling.",,,,,,,,,,,,,,,," The text discusses the idea of compulsory voting  Some states around the world have implemented compulsory voting  Some of these states have punitive measures for not voting  The author would prefer to see incentives for voting, such as a tax credit  The author mentions the possibility of being unable to vote due to being ""off the grid"" or traveling",False,False,False,False,False,False,False,False,False,False,False,False,False,False,False,True
38,48313,"""23:58""", be penalized for that. Yeah.,no,,,,,,,,,,,,,,,,,,False,False,False,False,False,False,False,False,False,False,False,False,False,False,False,False
39,48333,"""24:31""","I think he's probably right about that. I don't like the compulsory aspect for one thing that would be people with religious or philosophical objections to voting and, and traditionally As Americans we don't like imposing that sort of thing, third parties, okay. But I think there needs to be a reasonable threshold. We don't want the, you know, dog walkers party to spend thousands and thousands of dollars of public money and they have nothing to contribute. I do like",no,,,,,,,,,,,,,,,,,,False,False,False,False,False,False,False,False,False,False,False,False,False,False,False,False
40,48333,"""24:31""", The holiday that is something really important for Working Class People because they can't always just go to the polls when they want to.,no,,,,,,,,,,,,,,,,,,False,False,False,False,False,False,False,False,False,False,False,False,False,False,False,False
41,9738,"""25:07""","I think that we discussed this the other day is the idea of an incentive to vote, not a penalty, if you don't vote.",no,,,,,,,,,,,,,,,,,,False,False,False,False,False,False,False,False,False,False,False,False,False,False,False,False
42,10512,"""25:17""","Right. Yeah, I don't like the mandatory voting. We As Americans should have the right to abstain, you know, we have the right to abstain from religion. We have the right to abstain from a lot of other things, and if you don't want to be involved in the political process, you're giving up your right to complain. Pretty much, but it should be. I think it should be okay, not to participate.",yes," 1. The person expresses their dislike for mandatory voting.
2. They believe Americans should have the right to abstain from voting.
3. They compare this right to the freedom of religion and the right to abstain from other things.
4. They suggest that not participating in voting should be acceptable.
5. They also imply that if one chooses not to vote, they give up their right to complain about the political process.",,,,,,,,,,,,,,,," The person expresses their dislike for mandatory voting  They believe Americans should have the right to abstain from voting  They compare this right to the freedom of religion and the right to abstain from other things  They suggest that not participating in voting should be acceptable  They also imply that if one chooses not to vote, they give up their right to complain about the political process",False,False,False,False,False,False,False,False,False,False,False,False,False,False,False,True
43,48502,"""25:44""","Yeah, I'm first one. Yes, Independence, I'll be able to get on there. Just really easy number to for the national election. I think. Yes national holiday for the election, but the last two finds no, and 16 year old. So",no,,,,,,,,,,,,,,,,,,False,False,False,False,False,False,False,False,False,False,False,False,False,False,False,False
44,48502,"""25:44""",,no,,,,,,,,,,,,,,,,,,False,False,False,False,False,False,False,False,False,False,False,False,False,False,False,False
45,48474,"""26:01""","Yeah, I'm with you on those. I like the first two proposals but making voting mandatory is a no from me. Also, I'm not I just don't see how 16 year olds are really going to be able to contribute as much as maybe the proponents of them voting think they would.",no,,,,,,,,,,,,,,,,,,False,False,False,False,False,False,False,False,False,False,False,False,False,False,False,False
46,9788,"""26:24""","I'm not sure how difficult it is for third parties to get on the ballot. Now, I don't know that any more difficult than any other person trying to get on a ballot, definitely against the national holiday for the election day.",no,,,,,,,,,,,,,,,,,,False,False,False,False,False,False,False,False,False,False,False,False,False,False,False,False
47,9788,"""26:24""",,no,,,,,,,,,,,,,,,,,,False,False,False,False,False,False,False,False,False,False,False,False,False,False,False,False
48,48490,"""27:01""","Yes, I'll actually like, all of the ideas, especially the holiday make it a national holiday because it is difficult for most of us to get off work. And also, sometimes it our jobs, our companies do not allow us that time to get off or request PTO. But also for our 16 year olds, I think that would be good because I believe more than one more interested as they get older and you start seeing what their parents go through with their parents are making decisions.",no,,,,,,,,,,,,,,,,,,False,False,False,False,False,False,False,False,False,False,False,False,False,False,False,False
49,48490,"""27:01""", Asians or even with the news. If they're up to date on current events most schools do allow some of the classroom depending on what class I think its history class or politic class a loud for them to see exactly what's going on in the real world with current events.,no,,,,,,,,,,,,,,,,,,False,False,False,False,False,False,False,False,False,False,False,False,False,False,False,False
50,48474,"""32:43""","Seems like a good question to me, to know who's actually going to benefit before making it a policy.",no,,,,,,,,,,,,,,,,,,False,False,False,False,False,False,False,False,False,False,False,False,False,False,False,False
51,10512,"""32:53""","Yeah, a lot of people don't get National early's, national holidays off. Anyway, depends on where they work. And in Tennessee, there is a law that requires employers to give a three-hour paid time period on Election Day. If the polling hours are the same as the work shift and so there are ways to do that without making it a national holiday.",yes," 1. Not all people get National holidays off, depending on where they work.
2. Tennessee has a law that requires employers to give a three-hour paid time period on Election Day.
3. This paid time period is provided if the polling hours coincide with the work shift.
4. This law is not a national holiday but is a state-specific law.",,,,,,,,,,,,,,, Tennessee has a law that requires employers to give a three-hour paid time period on Election Day," Not all people get National holidays off, depending on where they work  This paid time period is provided if the polling hours coincide with the work shift  This law is not a national holiday but is a state-specific law",False,False,False,False,False,False,False,False,False,False,False,False,False,False,True,True
52,48524,"""33:22""","Yeah, I think of anything to create an incentive for people to go in and out and I know a lot of people will hard time specially working two or three jobs, have a hard time getting in the boat and anything that makes it easier. Especially with so many people. Insisting people vote in person. I think is a very good idea. Would also make it much more special day.",no,,,,,,,,,,,,,,,,,,False,False,False,False,False,False,False,False,False,False,False,False,False,False,False,False
53,48333,"""33:56""","I think it's a good question. I would have to point out that anything would pass almost be bound to be an improvement, over what we have now. So there's that",no,,,,,,,,,,,,,,,,,,False,False,False,False,False,False,False,False,False,False,False,False,False,False,False,False
54,10512,"""34:10""","When way of addressing, that is the idea from yesterday of having multi representatives for each district, you know, in the way everybody would be included.",no,,,,,,,,,,,,,,,,,,False,False,False,False,False,False,False,False,False,False,False,False,False,False,False,False
55,48524,"""34:39""","Adjust my point, given raise raise Point earlier. I think it is very frightening for some people, not so much for others. When they're small private donations are exposed to public scrutiny. As public, certain is usually looked up by people who want to make a point certain of Corporations though certainly with large donations. I think those things sort of public disclosure",yes," 1. The point about public scrutiny of donations should be adjusted.
2. Small, private donations being exposed to public scrutiny can be frightening for some people.
3. This fear is not as prevalent for people who donate larger amounts.
4. Public disclosure of donations is often sought after by people who want to make a point about corporations.
5. Large donations are usually looked up by people who want to scrutinize the actions of these corporations.",,,,,,,,," Small, private donations being exposed to public scrutiny can be frightening for some people  Public disclosure of donations is often sought after by people who want to make a point about corporations  Large donations are usually looked up by people who want to scrutinize the actions of these corporations",,,,,,, The point about public scrutiny of donations should be adjusted  This fear is not as prevalent for people who donate larger amounts,False,False,False,False,False,False,False,False,True,False,False,False,False,False,False,True
56,48374,"""35:03""","Yeah, I agree with David. I believe that the corporations and launched owners should be disclosed because their donations has the biggest influence than our small donations will be.",yes," 1. The opinion of the speaker aligns with David's.
2. Corporations and launched owners should disclose their donations.
3. The donations from corporations and launched owners have a bigger influence than small donations.", The donations from corporations and launched owners have a bigger influence than small donations,,,,,,,, Corporations and launched owners should disclose their donations,,,, The opinion of the speaker aligns with David's,,,,True,False,False,False,False,False,False,False,True,False,False,False,True,False,False,False
57,48474,"""35:32""","I'd be interested to know if you had AI. Has been used. I'm suspect. Probably not yet, at least not with our knowledge. I guess. We'll see how that develops.",no,,,,,,,,,,,,,,,,,,False,False,False,False,False,False,False,False,False,False,False,False,False,False,False,False
58,48333,"""35:46""","That's an interesting question. I follow the field pretty closely and to my knowledge, the answer is no, but I'm far from being omniscient so I'd be curious to get an expert opinion.",no,,,,,,,,,,,,,,,,,,False,False,False,False,False,False,False,False,False,False,False,False,False,False,False,False
59,9738,"""35:58""","What are the things that we should always think about is? We always talk about AI is being autonomous, it was programmed by somebody, somebody that does the programming decides, how it's going to make certain decisions and then it makes them. So this will allow the programmers or the companies that produce them to actually influence how the redistricting to be made without anyone being aware. They're influencing it.",yes," 1. AI can be autonomous, meaning it makes decisions based on how it was programmed.
2. The programmers or companies that produce AI have the ability to influence how decisions are made.
3. This influence can be applied to the process of redistricting without others being aware.
4. Therefore, it's important to consider the potential for bias or manipulation in AI decision-making.",,,,, This influence can be applied to the process of redistricting without others being aware,,,,,,,,,, The programmers or companies that produce AI have the ability to influence how decisions are made," AI can be autonomous, meaning it makes decisions based on how it was programmed  Therefore, it's important to consider the potential for bias or manipulation in AI decision-making",False,False,False,False,True,False,False,False,False,False,False,False,False,False,True,True
60,48374,"""36:23""","Yeah, I definitely, I'm definitely skeptical of the a I believe first we should have the humans, get it. Right? And then once they get, you know, the AI regulated then maybe it would be good in the future. But now I think that's like a human's responsibility at this time.",yes," 1. The speaker is skeptical about AI.
2. They believe humans should come first.
3. The speaker thinks AI should be regulated for humans.
4. They suggest that AI might be beneficial in the future.
5. The speaker emphasizes that it is currently a human's responsibility.",,,,,,,,,,,,,,,, The speaker is skeptical about AI  They believe humans should come first  The speaker thinks AI should be regulated for humans  They suggest that AI might be beneficial in the future  The speaker emphasizes that it is currently a human's responsibility,False,False,False,False,False,False,False,False,False,False,False,False,False,False,False,True
61,48333,"""36:46""","Modern-day eyes are much more complicated than that. I mean they do they always have some level of narrative bias. Any system built by humans? Always will but they to some extent program themselves and if the data you're using to, to teach them is reasonably well, balanced. The end result should be as well. Now, as with anything technological, there's always holes, but it's less of a problem than I think.",no,,,,,,,,,,,,,,,,,,False,False,False,False,False,False,False,False,False,False,False,False,False,False,False,False
62,48333,"""36:46""", Some people might think.,no,,,,,,,,,,,,,,,,,,False,False,False,False,False,False,False,False,False,False,False,False,False,False,False,False
63,48524,"""37:17""","Yeah, I don't agree with that. I don't think would be a problem for saying there. Be so many checks and balances in place, and so many humans, overseeing it. And so many people, checking, the people who created this system programmed at that, I think would probably benefit everyone in the final analysis.",yes," 1. The speaker does not agree with an unspecified point.
2. They believe that there would not be a problem with saying ""there"" due to numerous checks and balances in place.
3. Many humans oversee the system.
4. Numerous people check the work of the system's creators and programmers.
5. The speaker thinks this situation would benefit everyone in the end.",,,,,,,,,,,,,,,," The speaker does not agree with an unspecified point  They believe that there would not be a problem with saying ""there"" due to numerous checks and balances in place  Many humans oversee the system  Numerous people check the work of the system's creators and programmers  The speaker thinks this situation would benefit everyone in the end",False,False,False,False,False,False,False,False,False,False,False,False,False,False,False,True
64,48313,"""37:32""","So, being in the east side of Seattle, I work very closely adjacent to a, i development, and I can say that it's something something that would be used for this purpose is not going to be particularly Advanced, the technology. Absolutely exist. It's probably existed for a long time now. So there's probably less concerns about like you know narrative or someone programming it for nefarious purposes it's pretty logical. And mathematically based and it just takes the human error in",no,,,,,,,,,,,,,,,,,,False,False,False,False,False,False,False,False,False,False,False,False,False,False,False,False
65,48313,"""37:32""", When militia malice out of the situation.,no,,,,,,,,,,,,,,,,,,False,False,False,False,False,False,False,False,False,False,False,False,False,False,False,False
66,48474,"""38:05""","What's a good? Be worthwhile to have a. I take a stab at it and see what they come up with or see what's suggested, it can always be voted down or if it isn't a good idea.",yes," 1. Having a good idea is subjective and can vary from person to person.
2. It is worthwhile to suggest an idea and see the response.
3. The suggested idea can be voted down if not considered good.
4. If an idea is not a good one, it will not be accepted.",,,,,,,,,,,,,,, It is worthwhile to suggest an idea and see the response," Having a good idea is subjective and can vary from person to person  The suggested idea can be voted down if not considered good  If an idea is not a good one, it will not be accepted",False,False,False,False,False,False,False,False,False,False,False,False,False,False,True,True
67,48333,"""38:36""","I was just speaking to the issue. I mentioned earlier about having some, you know party that has 5 members that spins a massive amount of public money. I guarantee if public financing becomes reality, this exploit will occur, which is why I think there needs to be a threshold.",yes," 1. The speaker was discussing an issue related to a party with 5 members misusing a large amount of public money.
2. The speaker believes that if public financing becomes a reality, this exploitation will happen.
3. The speaker thinks there should be a threshold for public financing to prevent this misuse of funds.",,,,,,,,,,,,, The speaker thinks there should be a threshold for public financing to prevent this misuse of funds," The speaker believes that if public financing becomes a reality, this exploitation will happen",, The speaker was discussing an issue related to a party with 5 members misusing a large amount of public money,False,False,False,False,False,False,False,False,False,False,False,False,True,True,False,True
68,48474,"""38:54""","Yeah, I'd say around maybe $5000 $10000. When you get up above that amount we're talking about wealthy influences, perhaps having an undue effect on the outcome.",no,,,,,,,,,,,,,,,,,,False,False,False,False,False,False,False,False,False,False,False,False,False,False,False,False
69,9738,"""39:40""","I think, you know tax credit may not be the best type of award that could be given for voting. But how do you put something out there that anybody could get that between them? And the computer says they voted. I don't know what other word it's going to do, otherwise, it becomes punitive",yes," 1. The text suggests that tax credits may not be the best incentive for voting.
2. The idea of an award that anyone could get for voting, verified by a computer system, is proposed.
3. The text expresses uncertainty about how to implement this idea effectively.
4. The text suggests that making the incentive punitive could be a potential consequence of finding another word or method to verify voting.",,,,,,,,,,," The idea of an award that anyone could get for voting, verified by a computer system, is proposed",,,, The text expresses uncertainty about how to implement this idea effectively, The text suggests that tax credits may not be the best incentive for voting  The text suggests that making the incentive punitive could be a potential consequence of finding another word or method to verify voting,False,False,False,False,False,False,False,False,False,False,True,False,False,False,True,True
70,48524,"""40:09""","Yeah, not sure tax credits. The idea although it's not it's not a bad one. I kind of like it but I like the fact that there's an incentive as opposed to being punished punishment.",no,,,,,,,,,,,,,,,,,,False,False,False,False,False,False,False,False,False,False,False,False,False,False,False,False
71,10512,"""40:33""","I'm sorry, that was sort of a cynical question, but I just kind of feel like we regard, Lazar where the money's coming from? It's always going to be a an issue, but that doesn't mean we shouldn't talk about it.",no,,,,,,,,,,,,,,,,,,False,False,False,False,False,False,False,False,False,False,False,False,False,False,False,False
72,48333,"""40:46""",I don't think it by itself is going to solve the problem. I think it in conjunction with some of the other things we've talked about maybe is a has a potential to contribute quite a bit.,no,,,,,,,,,,,,,,,,,,False,False,False,False,False,False,False,False,False,False,False,False,False,False,False,False
73,9788,"""41:03""","I think you're right on, I think it would take a huge amount of money to make any kind of impact.",no,,,,,,,,,,,,,,,,,,False,False,False,False,False,False,False,False,False,False,False,False,False,False,False,False
74,10512,"""41:24""",I've had three sixteen year olds in their good smart. They were get smart kids but I'm not sure they were capable of making policy decisions about school. I don't know though.,no,,,,,,,,,,,,,,,,,,False,False,False,False,False,False,False,False,False,False,False,False,False,False,False,False
75,48333,"""41:40""","I mean, if you look at, I'm going to get geeky on you. If you look at cognitive Neuroscience, honestly, we should take the vote away from 21 to 24 year-olds. Not give it to some people. Younger still because the brain is really fully developed until you hit 2526 somewhere that neighborhood. So the younger you go, the bigger problems you got. It's just real.",yes," 1. The brain is not fully developed until the age of 25-26.
2. Cognitive neuroscience supports the idea that the brain continues to develop beyond the age of 18.
3. The voter qualification age should be increased to 24 or 25 based on cognitive neuroscience findings.
4. The speaker argues that younger voters may have more significant problems due to their still-developing brains.",,,,,,,,,,,,,,,, The brain is not fully developed until the age of 25-26  Cognitive neuroscience supports the idea that the brain continues to develop beyond the age of 18  The voter qualification age should be increased to 24 or 25 based on cognitive neuroscience findings  The speaker argues that younger voters may have more significant problems due to their still-developing brains,False,False,False,False,False,False,False,False,False,False,False,False,False,False,False,True
76,48313,"""42:03""","I want to be against this, not that I really have so much say in the matter, but I think a good compromise could be something akin to US. Territories will have a symbolic represented or a non-voting, representative who will be a Congress and they can cast it like a symbolic vote, something where the kids could still be involved in the process and they can cast a symbolic vote that may or may not reflect the reality of what actually happens. But one it, it wanted fact. He was actually hired",no,,,,,,,,,,,,,,,,,,False,False,False,False,False,False,False,False,False,False,False,False,False,False,False,False
