Order,Speaker,Time,Text,Has Arguments,All Arguments Summarized,FOR: limitCampaignContributions,AGAINST: limitCampaignContributions,FOR: closeForeignLoopholes,AGAINST: closeForeignLoopholes,FOR: establishRedistrictingCommissions,AGAINST: establishRedistrictingCommissions,FOR: implementProportionalRepresentation,AGAINST: implementProportionalRepresentation,FOR: encourageTransparency,AGAINST: encourageTransparency,FOR: promoteCivicEducation,AGAINST: promoteCivicEducation,FOR: explorePublicFunding,AGAINST: explorePublicFunding,other,notRelevant,FOR: limitCampaignContributions (bool),AGAINST: limitCampaignContributions (bool),FOR: closeForeignLoopholes (bool),AGAINST: closeForeignLoopholes (bool),FOR: establishRedistrictingCommissions (bool),AGAINST: establishRedistrictingCommissions (bool),FOR: implementProportionalRepresentation (bool),AGAINST: implementProportionalRepresentation (bool),FOR: encourageTransparency (bool),AGAINST: encourageTransparency (bool),FOR: promoteCivicEducation (bool),AGAINST: promoteCivicEducation (bool),FOR: explorePublicFunding (bool),AGAINST: explorePublicFunding (bool),other (bool),notRelevant (bool)
1,48303,"""9:51""","So I may I may say something that's, I don't know, cause for discussion or controversial or whatever but I believe that everything should be capped somehow, definitely, close the loopholes. Absolutely. And then I don't I mean the freedom of speech equation I somewhat disagree with because as was pointed out in that video, the other side is they don't want to make it public who.",yes," 1. The speaker believes that everything should have a limit or cap.
2. The speaker thinks that loopholes should be closed.
3. The speaker has some disagreement with the concept of freedom of speech.
4. The speaker references a video where it was pointed out that the other side does not want to make it public who.", The speaker believes that everything should have a limit or cap,, The speaker thinks that loopholes should be closed,,,,,,,,,,,,, The speaker has some disagreement with the concept of freedom of speech  The speaker references a video where it was pointed out that the other side does not want to make it public who,True,False,True,False,False,False,False,False,False,False,False,False,False,False,False,True
2,48303,"""9:51"""," They donated. So to me, if you're going to have freedom of speech, you're going to say I like this candidate. There it is. So why on the flip side of this? Can you say? Well, but I don't want anyone to know, I like this candidate and gave them money, that's ridiculous.",yes," 1. The person expressed their support for freedom of speech.
2. They mentioned that this should include the ability to publicly express support for a candidate.
3. They pointed out that they had donated to a candidate, indicating their liking for that candidate.
4. They questioned why someone would want to hide their support for a candidate, finding it ridiculous.",,,,,,,,, They mentioned that this should include the ability to publicly express support for a candidate,,,,,,," The person expressed their support for freedom of speech  They pointed out that they had donated to a candidate, indicating their liking for that candidate  They questioned why someone would want to hide their support for a candidate, finding it ridiculous",False,False,False,False,False,False,False,False,True,False,False,False,False,False,False,True
3,10268,"""10:42""",I think that it's a good idea to close the loophole on foreign investing and the voting campaign as well as Lee be leaving the,yes," 1. It is suggested to close the loophole regarding foreign investing and voting campaign.
2. Lee is planning to leave the relevant organization or position.",,, It is suggested to close the loophole regarding foreign investing and voting campaign,,,,,,,,,,,,, Lee is planning to leave the relevant organization or position,False,False,True,False,False,False,False,False,False,False,False,False,False,False,False,True
4,10268,"""10:42"""," This is the thing, open for the person to have the right to vote or not vote. Without penalization the, you know, a small fee, or something like that. To me, it's just seems a tad redundant. I mean, the Voting is, you know, a choice and everything. And I don't see where it should be penalized, you know, if you don't partake in,",yes," 1. The text discusses the right to vote without penalization.
2. The proposed penalties could be a small fee or some other form of punishment.
3. The author questions the need for penalties for not voting.
4. The author believes voting is a choice and should not be penalized.",,,,,,,,,,,,,,, The proposed penalties could be a small fee or some other form of punishment, The text discusses the right to vote without penalization  The author questions the need for penalties for not voting  The author believes voting is a choice and should not be penalized,False,False,False,False,False,False,False,False,False,False,False,False,False,False,True,True
5,48370,"""11:24""","Yeah, I mean I don't necessarily disagree with what the current caps are at the big part that I think needs. We talked about is the creation of super Pacs and everything because",no,,,,,,,,,,,,,,,,,,False,False,False,False,False,False,False,False,False,False,False,False,False,False,False,False
6,48370,"""11:24"""," It's always hard to track where that money comes from whether it's actual citizens or foreign investments. So, yeah, I think we need to really make sure that money can't be flowing in without a way, to properly track it. So we know who's really who's telling us to vote for these people who do, who actually owns them. Because well, I care about who gets the money. Then who votes for them? It seems",no,,,,,,,,,,,,,,,,,,False,False,False,False,False,False,False,False,False,False,False,False,False,False,False,False
7,48386,"""12:02""","Yeah, I think a big thing that I don't think they've talked about enough is that we like have campaigns that go on for a year-and-a-half specially for the presidential primaries by. It goes on for like 14 months and then like, even Senate campaigns or like housekeeping became months earlier. I think like for a we should just limit the time time. Spent campaigning such as moving all the primary dates to like one one day that that sold at elections become so less expensive.",yes," 1. There are campaigns for the presidential primaries that last for a year and a half.
2. These campaigns, which include Senate and House races, can start months earlier.
3. The speaker proposes limiting the time spent campaigning.
4. A suggestion is made to move all primary dates to one day.
5. Elections would be less expensive with this proposed change.",,,,,,,,,,,,,,, Elections would be less expensive with this proposed change," There are campaigns for the presidential primaries that last for a year and a half  These campaigns, which include Senate and House races, can start months earlier  The speaker proposes limiting the time spent campaigning  A suggestion is made to move all primary dates to one day",False,False,False,False,False,False,False,False,False,False,False,False,False,False,True,True
8,48386,"""12:02"""," Of. And I mean, even in Britain, Campa campaigning is only for, like, five weeks up to the dear general election. So, and and also, I don't, I think that corporations should be like should be limited in like how much stays poor can like poor until like Super PAC.",yes," 1. In Britain, Campa campaigning is limited to five weeks before a general election.
2. The speaker thinks corporations should be limited in how much money they can spend on political campaigns before Super PAC.
3. The speaker is unclear in their argument, using phrases like ""like"" and ""I think"" without fully expressing their point."," In Britain, Campa campaigning is limited to five weeks before a general election  The speaker thinks corporations should be limited in how much money they can spend on political campaigns before Super PAC",,,,,,,,,,,,,,," The speaker is unclear in their argument, using phrases like ""like"" and ""I think"" without fully expressing their point",True,False,False,False,False,False,False,False,False,False,False,False,False,False,False,True
9,48268,"""12:47""","I really don't know how they're going to stop the money coming from overseas or or illegal money coming in. I don't know how they're going to do that, but they sure should. And since the midterms I was like, 8 months before the midterms and then since the midterms even though people didn't even declare their presidency, the candidacy for president we've had commercials every five minutes.",no,,,,,,,,,,,,,,,,,,False,False,False,False,False,False,False,False,False,False,False,False,False,False,False,False
10,48268,"""12:47""", Minutes. I mean you can go on the toes and right now look something has to be done. I believe in in a time frame where they're allowed to,no,,,,,,,,,,,,,,,,,,False,False,False,False,False,False,False,False,False,False,False,False,False,False,False,False
11,48268,"""12:47""", campaign and then stop camping. It's getting,no,,,,,,,,,,,,,,,,,,False,False,False,False,False,False,False,False,False,False,False,False,False,False,False,False
12,48303,"""13:32""","I agree with what Scott said do as far as like, it is ridiculous because he have the super Pacs and whatnot who have been running ads and negative attack ads. I think that there needs to be a time limit as far as overall. Again, freedom of speak. So you can run an attack ad but there needs to be a limit, you know, I mean if we're for three years a year and a half, two years, whatever",yes," 1. The speaker agrees with Scott's viewpoint.
2. They believe it is ridiculous that super PACs can run ads and negative attack ads.
3. The speaker thinks there should be a time limit on how long these ads can run.
4. They acknowledge the importance of freedom of speech, but argue that there should be a limit to how long attack ads can run, which they estimate to be around three years, a year and a half to two years."," They acknowledge the importance of freedom of speech, but argue that there should be a limit to how long attack ads can run, which they estimate to be around three years, a year and a half to two years",,,,,,,, They believe it is ridiculous that super PACs can run ads and negative attack ads  The speaker thinks there should be a time limit on how long these ads can run,,,,,,, The speaker agrees with Scott's viewpoint,True,False,False,False,False,False,False,False,True,False,False,False,False,False,False,True
13,48303,"""13:32"""," Outside of an election, I don't think there should be a lot of money that's being pumped into it, because frankly, you could use that money for for something else. That's more positive than running an attack ad.",yes," 1. Money should not be heavily invested in elections outside of the actual election period.
2. The funds used for election campaigns could be allocated to more positive causes.
3. Running attack ads is not a positive use of resources.",,,,,,,,, Running attack ads is not a positive use of resources,,,,,, Money should not be heavily invested in elections outside of the actual election period  The funds used for election campaigns could be allocated to more positive causes,,False,False,False,False,False,False,False,False,True,False,False,False,False,False,True,False
14,48380,"""14:16""",,no,,,,,,,,,,,,,,,,,,False,False,False,False,False,False,False,False,False,False,False,False,False,False,False,False
15,48380,"""14:16""",Well I'm definitely for closing the loopholes that allow for like foreign donors or super Pacs to contribute to the candidate. So,yes, 1. The person is in favor of closing loopholes that allow for foreign donors or super PACs to contribute to a candidate.,,, The person is in favor of closing loopholes that allow for foreign donors or super PACs to contribute to a candidate,,,,,,,,,,,,,,False,False,True,False,False,False,False,False,False,False,False,False,False,False,False,False
16,48380,"""14:16"""," The other the limits, I'm pretty much okay, with? I really wish that there was something where everybody contributes like five dollars or something and that money is spent equally for the nominee of each party, and so something like that, okay?",no,,,,,,,,,,,,,,,,,,False,False,False,False,False,False,False,False,False,False,False,False,False,False,False,False
17,48303,"""16:53""","Well, I already said in the first part that, as far as the disclosure goes, I think there should be disclosure. I don't think it has anything to do with re speech. Personally, the Free Speech part is cruising what candidate you like. And if you're going to State what candidate you like, why would you want to hide? You disclosure? The second thing this follows up with what I believe it was Choice. Was just saying, you know, everybody has the option if that files?",no,,,,,,,,,,,,,,,,,,False,False,False,False,False,False,False,False,False,False,False,False,False,False,False,False
18,48303,"""16:53""","Income tax. There's always that little thing is like, would you like to donate a dollar? It doesn't say to what political party and it's not reported and it's only a dollar. So everybody has that option already. So I'm talking about say the minimum or whatever like it's $500, over $500.",no,,,,,,,,,,,,,,,,,,False,False,False,False,False,False,False,False,False,False,False,False,False,False,False,False
19,48268,"""17:38""",,no,,,,,,,,,,,,,,,,,,False,False,False,False,False,False,False,False,False,False,False,False,False,False,False,False
20,48268,"""17:38""","Well, again, why do they need any more money? That's what I want to know. I mean, if we, if we take money from them, then they will be able to run these ads. 24/7, 10 years in a row. I mean, that's what I say take it from them and and disclosures",yes," 1. The text discusses the issue of more money being needed.
2. The speaker questions the necessity of obtaining additional funds.
3. If money is taken, the entity in question will be able to run ads continuously (24/7) for a decade-long period.
4. The speaker suggests taking the money from this entity.
5. The speaker also mentions the idea of disclosures.",," If money is taken, the entity in question will be able to run ads continuously (24/7) for a decade-long period",,,,,,, The speaker also mentions the idea of disclosures,,,,,, The text discusses the issue of more money being needed  The speaker questions the necessity of obtaining additional funds, The speaker suggests taking the money from this entity,False,True,False,False,False,False,False,False,True,False,False,False,False,False,True,True
21,48268,"""17:38"""," That's a fine line because there is a First Amendment and I don't know about that for corporations, for sure. I think they should dispose. But individuals, the way today is, if you're voting for the wrong person, you might get shot so I'd say no to that.",no,,,,,,,,,,,,,,,,,,False,False,False,False,False,False,False,False,False,False,False,False,False,False,False,False
22,48186,"""18:23""",,no,,,,,,,,,,,,,,,,,,False,False,False,False,False,False,False,False,False,False,False,False,False,False,False,False
23,48186,"""18:23""",,no,,,,,,,,,,,,,,,,,,False,False,False,False,False,False,False,False,False,False,False,False,False,False,False,False
24,48186,"""18:23""",,no,,,,,,,,,,,,,,,,,,False,False,False,False,False,False,False,False,False,False,False,False,False,False,False,False
25,48186,"""18:23""",,no,,,,,,,,,,,,,,,,,,False,False,False,False,False,False,False,False,False,False,False,False,False,False,False,False
26,10459,"""18:32""","We can't hear you, Kevin.",no,,,,,,,,,,,,,,,,,,False,False,False,False,False,False,False,False,False,False,False,False,False,False,False,False
27,48303,"""18:50""","Is your mic is muted, I believe.",no,,,,,,,,,,,,,,,,,,False,False,False,False,False,False,False,False,False,False,False,False,False,False,False,False
28,48268,"""18:59""",Can't hear any of us.,no,,,,,,,,,,,,,,,,,,False,False,False,False,False,False,False,False,False,False,False,False,False,False,False,False
29,48380,"""19:10""",,no,,,,,,,,,,,,,,,,,,False,False,False,False,False,False,False,False,False,False,False,False,False,False,False,False
30,10093,"""19:10""","I was just going to say, I do believe in full disclosure and I do not think that public funds should be used for.",yes," 1. The speaker believes in full disclosure.
2. The speaker does not think public funds should be used for undisclosed purposes.",,,,,,,,, The speaker believes in full disclosure,,,, The speaker does not think public funds should be used for undisclosed purposes,,,,False,False,False,False,False,False,False,False,True,False,False,False,True,False,False,False
31,10093,"""19:10""", The candidates to contribute.,no,,,,,,,,,,,,,,,,,,False,False,False,False,False,False,False,False,False,False,False,False,False,False,False,False
32,48370,"""19:31""","Yeah, I do not agree with the public funds being used either. Yeah, the only thing I could see about disclosures would be, I definitely think everything needs were disclosed over a certain dollar amount. And I think the question is just be, she like that dollar amount. Be tied to inflation, should be tied to something.",yes," 1. The speaker does not agree with the use of public funds.
2. The speaker thinks that disclosures are necessary for expenditures over a certain dollar amount.
3. The speaker believes that the specific dollar amount for disclosure should be discussed and decided.
4. The speaker suggests that the disclosure threshold should be adjusted for inflation.",,,,,,,,, The speaker thinks that disclosures are necessary for expenditures over a certain dollar amount  The speaker believes that the specific dollar amount for disclosure should be discussed and decided  The speaker suggests that the disclosure threshold should be adjusted for inflation,,,,, The speaker does not agree with the use of public funds,,,False,False,False,False,False,False,False,False,True,False,False,False,False,True,False,False
33,48370,"""19:31""", Because I do kind of roulette.,no,,,,,,,,,,,,,,,,,,False,False,False,False,False,False,False,False,False,False,False,False,False,False,False,False
34,48370,"""19:31""","you know, I could kind of your shins over 200 like does it need to be 200 does 3 4 500 make sense nowadays",no,,,,,,,,,,,,,,,,,,False,False,False,False,False,False,False,False,False,False,False,False,False,False,False,False
35,48370,"""19:31"""," so, I guess I'd like to be my only thought of",no,,,,,,,,,,,,,,,,,,False,False,False,False,False,False,False,False,False,False,False,False,False,False,False,False
36,48370,"""19:31""","No, I don't think the new more money. I'm just saying that, you know, people are going to, you know, contribute to candidates. I think that needs to be disclosed but I don't have any to be disclosed. I like the current level 200. Maybe it's people could have any five hundredths to be disclosed now,",no,,,,,,,,,,,,,,,,,,False,False,False,False,False,False,False,False,False,False,False,False,False,False,False,False
37,48268,"""20:05""",,no,,,,,,,,,,,,,,,,,,False,False,False,False,False,False,False,False,False,False,False,False,False,False,False,False
38,48268,"""20:05""",Excuse me. Why do you think they need more money? Understand why anybody thinks they need number?,no,,,,,,,,,,,,,,,,,,False,False,False,False,False,False,False,False,False,False,False,False,False,False,False,False
39,48268,"""20:05""",,no,,,,,,,,,,,,,,,,,,False,False,False,False,False,False,False,False,False,False,False,False,False,False,False,False
40,48386,"""20:29""","So I think something with a democracy vouchers. Something that I think that's something that we could, maybe, give give it a try and",no,,,,,,,,,,,,,,,,,,False,False,False,False,False,False,False,False,False,False,False,False,False,False,False,False
41,48386,"""20:29""","And as far as this disclosure goes, I think it should be like fully transparent. And then, let's see. I mean, I think the current little bit, like requirement for the full disclosure, to Candace campaign over 200. I mean, I mean, I think that's fine at this point. I mean, I remember a while ago, I can go. Look, look up names and then I could see my name to why. I like, how much I contributed during like the, the last like,",no,,,,,,,,,,,,,,,,,,False,False,False,False,False,False,False,False,False,False,False,False,False,False,False,False
42,48386,"""20:29""",I think it's back in 2019 and all that. So,no,,,,,,,,,,,,,,,,,,False,False,False,False,False,False,False,False,False,False,False,False,False,False,False,False
43,10459,"""21:14""","I could be wrong, but I think I read about some place in Washington trying democracy vouchers. So, I think it would be interesting to hear how that went and what kind of impact if any it had. But I don't really think that we need to be spending public funds on elections clearly, there's already probably too much money in it and there are better things that we can spend that public money on. There's a limited supply of resources and we need to be",no,,,,,,,,,,,,,,,,,,False,False,False,False,False,False,False,False,False,False,False,False,False,False,False,False
44,10459,"""21:14""", be a little bit better about where we're pulling out some of that money.,no,,,,,,,,,,,,,,,,,,False,False,False,False,False,False,False,False,False,False,False,False,False,False,False,False
45,48380,"""21:48""",,no,,,,,,,,,,,,,,,,,,False,False,False,False,False,False,False,False,False,False,False,False,False,False,False,False
46,48380,"""21:48""",I'm not really for the vouchers.,yes," 1. The text is about the speaker's opinion on something, which is negative.
2. The speaker is referring to ""vouchers,"" but it is unclear what type of vouchers they are talking about.
3. The speaker does not provide any arguments to support their opinion.",,,,,,,,,,,,,,,," The text is about the speaker's opinion on something, which is negative  The speaker is referring to ""vouchers,"" but it is unclear what type of vouchers they are talking about  The speaker does not provide any arguments to support their opinion",False,False,False,False,False,False,False,False,False,False,False,False,False,False,False,True
47,48380,"""21:48""","I do think that, you know, the individual contributions to individual candidates or parties could be raised to 500. I think 200 is a little low you know, without disclosing everything else. It needs to be disclosed. I want to know you know who's",no,,,,,,,,,,,,,,,,,,False,False,False,False,False,False,False,False,False,False,False,False,False,False,False,False
48,48370,"""23:07""","I am strongly for this being in Wisconsin, which is extremely gerrymandered to a ridiculous degree. I just, I don't think State sentence and wraps should get to draw their own districts.",yes," 1. The speaker strongly favors having a certain event or entity in Wisconsin.
2. Wisconsin is described as being extremely gerrymandered.
3. The speaker finds the level of gerrymandering in Wisconsin to be ridiculous.
4. The speaker believes that state legislatures should not be responsible for drawing their own districts.",,,,, The speaker believes that state legislatures should not be responsible for drawing their own districts, The speaker finds the level of gerrymandering in Wisconsin to be ridiculous,,,,,,,,, Wisconsin is described as being extremely gerrymandered, The speaker strongly favors having a certain event or entity in Wisconsin,False,False,False,False,True,True,False,False,False,False,False,False,False,False,True,True
49,48370,"""23:07"""," Because they are just going to draw the district. That is safe for them and not actually one that properly, you know, breaks down the state and allows everyone in the state to be properly represented.",yes," 1. The action of the people in question is to draw the district.
2. This action is considered safe by them.
3. The districts are not created in a way that breaks down the state and allows for proper representation of all people in the state.",,,,, The districts are not created in a way that breaks down the state and allows for proper representation of all people in the state, The action of the people in question is to draw the district,,,,,,,,,, This action is considered safe by them,False,False,False,False,True,True,False,False,False,False,False,False,False,False,False,True
50,48386,"""23:36""","I had a knife. I think the states with nonpartisan redistricting commissions are a good idea, but I think of you in better idea would be to give that kind of responsibility to like the Census Bureau because they're the ones that do the census every ten years or so. So I think letting them because if you",yes," 1. The speaker possessed a knife.
2. The speaker thinks that states with nonpartisan redistricting commissions are a good idea.
3. The speaker suggests that the responsibility of redistricting should be given to the Census Bureau.
4. The Census Bureau is suggested as a good candidate for redistricting because they conduct the census every ten years.",,,,, The speaker thinks that states with nonpartisan redistricting commissions are a good idea  The speaker suggests that the responsibility of redistricting should be given to the Census Bureau  The Census Bureau is suggested as a good candidate for redistricting because they conduct the census every ten years,,,,,,,,,,, The speaker possessed a knife,False,False,False,False,True,False,False,False,False,False,False,False,False,False,False,True
