44,48503,"""27:18""","As far as third power and party candidates, I think that the, the bar should be lowered for them. They do definitely do not have equal representation compulsive area voting. I don't think that should be a thing. Like, like Chelsea said, there's already too many walls and registrations on that. Election day is a holiday I think is, is a good idea. And I think it that would encourage more people to go vote and 16 year olds to vote.",yes," 1. The bar should be lowered for third party and independent candidates.
2. There is not equal representation for these candidates in compulsory area voting.
3. Election day being a holiday is a good idea.
4. This would encourage more people to go vote.
5. Allowing 16 year olds to vote is supported.",,,,,,,,,,,,,,, The bar should be lowered for third party and independent candidates  There is not equal representation for these candidates in compulsory area voting, Election day being a holiday is a good idea  This would encourage more people to go vote  Allowing 16 year olds to vote is supported,False,False,False,False,False,False,False,False,False,False,False,False,False,False,True,True
45,48503,"""27:18""","And Local School elections. I think that should be should be granted the, they at 16 years old typically you're smart enough to know what's going on with your homeschool, especially this generation of children.",yes," 1. The argument is for allowing 16-year-olds to vote in Local School elections.
2. The justification for this argument is that 16-year-olds are typically smart enough to understand what is happening with their homeschool education.
3. This argument is particularly relevant for the current generation of children.",,,,,,,,,,, This argument is particularly relevant for the current generation of children,,,,, The argument is for allowing 16-year-olds to vote in Local School elections  The justification for this argument is that 16-year-olds are typically smart enough to understand what is happening with their homeschool education,False,False,False,False,False,False,False,False,False,False,True,False,False,False,False,True
46,48270,"""28:02""","First of all, I think that it should not be a national holiday. I mean, people, nowadays think of Memorial Day, it's big time to have barbecues and go to sales at the money for local stores Company. Still alive, muscle loud, people time to go. If I don't know if there's a fixed time, how many hours but they still required to let the people go vote?",no,,,,,,,,,,,,,,,,,,False,False,False,False,False,False,False,False,False,False,False,False,False,False,False,False
47,48429,"""28:27""","Yeah, I think that making a making it against the law to not vote, is a horrible idea. I think that would only pop punish impoverished communities are already impoverished communities as well as yeah. I just think that's a horrible idea. But I think blow allowing 16 year olds to vote in the School Board elections would be awesome because it gives them a good idea of you know a start to start the voting and voting for what affects them.",no,,,,,,,,,,,,,,,,,,False,False,False,False,False,False,False,False,False,False,False,False,False,False,False,False
48,48526,"""28:57""",,no,,,,,,,,,,,,,,,,,,False,False,False,False,False,False,False,False,False,False,False,False,False,False,False,False
49,48526,"""28:57""","I would be okay with 16 year olds voting in their Local School Board elections. I think that's a great idea, they're usually in a lot of them are interested in Civics and their own School Board elections. And there's, you know, there's certain cancel and I wouldn't agree that laws. It should be against the law to or get a small fine for not voting. I think that would be a",no,,,,,,,,,,,,,,,,,,False,False,False,False,False,False,False,False,False,False,False,False,False,False,False,False
50,48526,"""28:57""", discourage.,no,,,,,,,,,,,,,,,,,,False,False,False,False,False,False,False,False,False,False,False,False,False,False,False,False
51,48274,"""29:31""",I think allowing 16 year old to vote is a great way to have the Practical aspect of civic education and I think compulsory voting only makes sense if there's a change in culture and the way we view voting and our rights and responsibilities as Citizens.,yes," 1. Allowing 16 year olds to vote is a good idea.
2. This would provide practical experience in civic education.
3. Compulsory voting is only effective if there is a change in culture and the way people view voting, rights, and responsibilities as citizens.",,,,,,,,,,, This would provide practical experience in civic education,,,," Compulsory voting is only effective if there is a change in culture and the way people view voting, rights, and responsibilities as citizens", Allowing 16 year olds to vote is a good idea,False,False,False,False,False,False,False,False,False,False,True,False,False,False,True,True
52,48503,"""29:56""","So is fart, so do your comment on that there's already laws in place? So 20, 30 states require time off to vote, sorry. 30 states require time off to vote when he states do not have any, any laws and Florida is one of them, which I've never had time off mandated, by the state to go vote. So, that's that's not a thing.",yes," 1. Some states have laws that require time off for employees to vote.
2. Twenty to thirty states are included in this group.
3. Florida is one of the states that does not mandate time off for employees to vote.
4. The speaker has never had mandated time off for voting in Florida.",,,,,,,,,,,,,,,, Some states have laws that require time off for employees to vote  Twenty to thirty states are included in this group  Florida is one of the states that does not mandate time off for employees to vote  The speaker has never had mandated time off for voting in Florida,False,False,False,False,False,False,False,False,False,False,False,False,False,False,False,True
53,48368,"""30:24""","A few years ago, I stood in line for three hours to vote. I don't think any employer would give me three hours off to vote. I was pretty angry about that. That was the year that there were only two working ballot machines in my, in my district. As I do know that Australia has mandatory voting and I think they have some kind of fine system in place and people really",no,,,,,,,,,,,,,,,,,,False,False,False,False,False,False,False,False,False,False,False,False,False,False,False,False
54,48368,"""30:24""", Don't being required to vote and then they cast their votes for you to deliberately choose people who are not good governors.,yes," 1. Not being required to vote is a choice for some individuals.
2. These individuals may still choose to vote.
3. In some cases, they may cast their votes for people who are not good governors.
4. This could be a deliberate choice.",,,,,,,,,,,,,,,," Not being required to vote is a choice for some individuals  These individuals may still choose to vote  In some cases, they may cast their votes for people who are not good governors  This could be a deliberate choice",False,False,False,False,False,False,False,False,False,False,False,False,False,False,False,True
55,48503,"""31:11""","I think, in general, people just hate being told to do to do anything. There's always no matter what it is, you know, people, they'll be people, you know, with backlash or bad against it, when the laws for seat belts are being implemented. For instance, people were very against that because they're being told to put on a seat belt. So just any time you tell someone, hey, you need to do something. Even if it's a good idea, people will be resistant against it just added in a general sense.",yes," 1. People dislike being told what to do in general.
2. There is often backlash or opposition when new laws are implemented.
3. An example of this is the implementation of seatbelt laws.
4. People were against the seatbelt laws because they felt they were being told what to do.
5. This resistance to being told what to do occurs even when the instructions are for their own good.",,,,,,,,,,,,,,,, People dislike being told what to do in general  There is often backlash or opposition when new laws are implemented  An example of this is the implementation of seatbelt laws  People were against the seatbelt laws because they felt they were being told what to do  This resistance to being told what to do occurs even when the instructions are for their own good,False,False,False,False,False,False,False,False,False,False,False,False,False,False,False,True
56,48274,"""31:41""",,no,,,,,,,,,,,,,,,,,,False,False,False,False,False,False,False,False,False,False,False,False,False,False,False,False
57,48274,"""31:41""","Well following up on the seat belt Waldo. Now it is a law and people realize that it's good for them. So if there is a change in culture and people realize that voting and actively participating in democracy is good for them. I don't know if that's necessarily a bad idea, there's got to be a lot of changes before that can happen, but I don't, I don't think the fact that, you know, people don't like to be told what to do is a good argument for not considering",yes," 1. The seat belt law is now in effect and has been accepted by people as a good practice for their safety.
2. This example is suggested as a possible way to encourage people to participate in democracy, such as voting.
3. It is acknowledged that achieving this change in culture would require many adjustments.
4. The argument that ""people don't like to be told what to do"" is not seen as a strong reason to dismiss this idea.",,,,,,,,,,,,,,,," The seat belt law is now in effect and has been accepted by people as a good practice for their safety  This example is suggested as a possible way to encourage people to participate in democracy, such as voting  It is acknowledged that achieving this change in culture would require many adjustments  The argument that ""people don't like to be told what to do"" is not seen as a strong reason to dismiss this idea",False,False,False,False,False,False,False,False,False,False,False,False,False,False,False,True
58,48274,"""31:41""", bring it.,no,,,,,,,,,,,,,,,,,,False,False,False,False,False,False,False,False,False,False,False,False,False,False,False,False
59,48368,"""32:14""","I don't know, mask mandates and vaccination mandates come to mind and there was an unbelievable backlash. And those were, you know, proven to be saving lives but it just became a political football. I don't think we need to criminalize anything else in this country.",yes," 1. The person brings up mask mandates and vaccination mandates as examples of measures that have faced significant backlash.
2. These mandates have been proven to save lives.
3. The person does not think that any further measures should be criminalized in the country.",,,,,,,,,,,,,,,, The person brings up mask mandates and vaccination mandates as examples of measures that have faced significant backlash  These mandates have been proven to save lives  The person does not think that any further measures should be criminalized in the country,False,False,False,False,False,False,False,False,False,False,False,False,False,False,False,True
60,48368,"""37:10""",I think this one's good to go.,no,,,,,,,,,,,,,,,,,,False,False,False,False,False,False,False,False,False,False,False,False,False,False,False,False
61,48503,"""37:15""","I would I would agree on that. So I have just a general question for everybody after listen to all the experts talk and everything, has anyone here change their mind or their Viewpoint of learn something that they didn't previously know, or had a misconception about about how some things work? I know, me, personally, I've definitely learned some things and I think I've definitely changed my mind on some of my viewpoints from speed, you know, listening to The Experts",no,,,,,,,,,,,,,,,,,,False,False,False,False,False,False,False,False,False,False,False,False,False,False,False,False
62,48356,"""37:52""",I think that one sounds good to me.,no,,,,,,,,,,,,,,,,,,False,False,False,False,False,False,False,False,False,False,False,False,False,False,False,False
63,48368,"""38:21""","Another excellent question and answer your question, your the question, Matthew. Yeah, I really, I still don't know as much as I'd like to know about proportional voting or proportional representation. That was A New Concept for me, so I find it interesting and I like that with this, there was a discussion yesterday, you know, about ranked Choice voting because that's that conversation is getting more publicity now.",no,,,,,,,,,,,,,,,,,,False,False,False,False,False,False,False,False,False,False,False,False,False,False,False,False
64,48274,"""39:26""","I really like this question, especially the part that asks, what alternatives to a fine? I think that's a that's a really good question.",no,,,,,,,,,,,,,,,,,,False,False,False,False,False,False,False,False,False,False,False,False,False,False,False,False
65,48356,"""40:12""",I don't think this is a good idea at all.,no,,,,,,,,,,,,,,,,,,False,False,False,False,False,False,False,False,False,False,False,False,False,False,False,False
66,48368,"""40:17""","Yeah, I'm not in favor of more public financing. Do you know again it's government its government money going into their own pockets and their families Pockets, who run ad agencies Etc.",no,,,,,,,,,,,,,,,,,,False,False,False,False,False,False,False,False,False,False,False,False,False,False,False,False
67,48497,"""40:43""",Voting is a choice. How can they find us?,no,,,,,,,,,,,,,,,,,,False,False,False,False,False,False,False,False,False,False,False,False,False,False,False,False
68,48368,"""40:51""","That's the whole point is to turn it into something that if you don't do it, then you get a penalty. It's no longer a choice, it's a requirement.",no,,,,,,,,,,,,,,,,,,False,False,False,False,False,False,False,False,False,False,False,False,False,False,False,False
69,48368,"""41:15""",This is my question and it's just because I don't know what rules currently restrict third-party candidates from getting on the ballot. So I would actually be learning a lot at this. One gets asked.,no,,,,,,,,,,,,,,,,,,False,False,False,False,False,False,False,False,False,False,False,False,False,False,False,False
70,48402,"""41:28""","Usual restriction for third-party candidates, is they require a certain percentage of the public registration to support that candidate. That's usually what you see in the majority of states.",no,,,,,,,,,,,,,,,,,,False,False,False,False,False,False,False,False,False,False,False,False,False,False,False,False
71,48356,"""41:43""","Most of the time, the third party candidates just take votes away from the major candidates.",yes, 1. Third party candidates often divert votes from major candidates.,,,,,,,,,,,,,,, Third party candidates often divert votes from major candidates,,False,False,False,False,False,False,False,False,False,False,False,False,False,False,True,False
72,48274,"""41:52""","In my understanding that is the case. When you have a first-past-the-post system in proportional representation, it is easier for third-party to to gain some sort of representation. So Yesterday When the panel were talking about, you know, moving away from a duopoly proportional representation is is a good alternative for that.",no,,,,,,,,,,,,,,,,,,False,False,False,False,False,False,False,False,False,False,False,False,False,False,False,False
73,48503,"""42:19""","And that's also how third parties don't come come up because it's kind of a kind of a rotating Circle, you know, third parties, take it away from from, you know, Democrats or Republicans. Therefore, you shouldn't vote for third parties and because you're not voting for third parties. They never, they never, you know, Come to Papa, you know, come to power. So it's just, it's just one of those self-defeating, you know, things if you think about it, that way, I think the idea.",yes," 1. Third parties have difficulty entering the political landscape.
2. This is due to a ""rotating circle"" of Democrats and Republicans.
3. Voting for third parties is not common.
4. Third parties rarely gain power because they do not receive many votes.
5. The lack of power for third parties is a self-defeating cycle.",,,,,,,,,,,,,,, Third parties have difficulty entering the political landscape  Third parties rarely gain power because they do not receive many votes  The lack of power for third parties is a self-defeating cycle," This is due to a ""rotating circle"" of Democrats and Republicans  Voting for third parties is not common",False,False,False,False,False,False,False,False,False,False,False,False,False,False,True,True
74,48503,"""42:19"""," There's no restrictions for it. But you want to make it easier for third parties to calm, you know, to be able to come up because, you know, the, I think a duopoly is a terrible. Terrible idea, makes a very much US versus them type thing and you",no,,,,,,,,,,,,,,,,,,False,False,False,False,False,False,False,False,False,False,False,False,False,False,False,False
75,48274,"""43:16""",,no,,,,,,,,,,,,,,,,,,False,False,False,False,False,False,False,False,False,False,False,False,False,False,False,False
76,48274,"""43:16""","I guess maybe the question can be three frame in terms of saying what new rules could be implemented, just make it more open-ended, like, what would make it easier for third-party candidates to get on balance? So that includes, you know, not just rules or regulations but more what kind of system reforms that that we can do or we can change to make it easier for third-party, candidates to get unbalanced.",no,,,,,,,,,,,,,,,,,,False,False,False,False,False,False,False,False,False,False,False,False,False,False,False,False
77,48270,"""43:58""","I have a question and we quite a corporations and large donors, know, what is the definition of a large donor. I mean, you have unions that have thousands of members that contribute to a fund for them to use because they can't, they don't feel that they have enough money to do it on their own to make it different. So they all contribute, so they can,",yes," 1. A question was asked about the definition of a large donor.
2. It was mentioned that there are corporations and unions that contribute to funds.
3. Unions have thousands of members who contribute to the fund.
4. It was stated that unions cannot make significant contributions on their own, so they collect smaller contributions from individual members.
5. These collective contributions from union members allow them to make a larger impact."," It was stated that unions cannot make significant contributions on their own, so they collect smaller contributions from individual members  These collective contributions from union members allow them to make a larger impact",,,,,,,,,,,,,, It was mentioned that there are corporations and unions that contribute to funds  Unions have thousands of members who contribute to the fund, A question was asked about the definition of a large donor,True,False,False,False,False,False,False,False,False,False,False,False,False,False,True,True
78,48270,"""43:58"""," Co has one one entity. Same thing goes for corporations. What, what is it Corporation? You know many Family Farms are Incorporated because if they're still owned by a family, so you put limitations on them too. Because you know, some some large farming operations go into the multi-millions.",no,,,,,,,,,,,,,,,,,,False,False,False,False,False,False,False,False,False,False,False,False,False,False,False,False
79,48503,"""44:45""","So I think you would have to Define what a large large corporation is in my mind, a corporation that makes over, you know, say like a hundred million dollars a year or more that has, you know, over, you know, 5,000 employees, for instance, you know, like like your Jeff Bezos or your, you know, you know, people like that. Should definitely not be able to allow, you know, stuff like that. So to your point I think yes there should be a",no,,,,,,,,,,,,,,,,,,False,False,False,False,False,False,False,False,False,False,False,False,False,False,False,False
80,48503,"""44:45""", Nishan but something like that would be in my opinion. What a what a large corporation is I think even some Unions would fall under that that definition even but I believe there's some unions that take advantage of our political system already.,no,,,,,,,,,,,,,,,,,,False,False,False,False,False,False,False,False,False,False,False,False,False,False,False,False
81,48270,"""45:30""",,no,,,,,,,,,,,,,,,,,,False,False,False,False,False,False,False,False,False,False,False,False,False,False,False,False
82,48270,"""45:30""","I lost my train of thought, sorry.",no,,,,,,,,,,,,,,,,,,False,False,False,False,False,False,False,False,False,False,False,False,False,False,False,False
83,48368,"""45:40""","That's okay. That's okay. John I do that too. Um, I think, you know, corporate you're talking about Farms as corporations. That's not that. That's we're talking about corporations and, you know, in citizens united corporations, don't vote but corporations are spending massive amounts of money to influence our elections, including Farms. Maybe, I don't know, corporate Farms, perhaps I'm not sure about",yes," 1. The text discusses the influence of corporations on elections.
2. The Supreme Court case ""Citizens United"" is mentioned as allowing corporations to spend large amounts of money in elections.
3. The text suggests that this issue is not limited to corporate farms, but includes all corporations.
4. The text acknowledges that corporations do not have the right to vote, but argue that they still have a significant influence on elections.",,,,,,,,,,,,," The text acknowledges that corporations do not have the right to vote, but argue that they still have a significant influence on elections",," The text discusses the influence of corporations on elections  The Supreme Court case ""Citizens United"" is mentioned as allowing corporations to spend large amounts of money in elections"," The text suggests that this issue is not limited to corporate farms, but includes all corporations",False,False,False,False,False,False,False,False,False,False,False,False,True,False,True,True
84,48368,"""45:40"""," Out mom-and-pop Farms, but I think we need to get, you know, we need to get more serious about funding elections and getting the money out.",no,,,,,,,,,,,,,,,,,,False,False,False,False,False,False,False,False,False,False,False,False,False,False,False,False
