51,9687,"""27:53""","Suppose the other thing would be to not have District setup and you know, just a certain number of elected officials per state. Let's say and you know you pick people that that you think represent your state. Well as opposed to just your section of the state.",no,,,,,,,,,,,,,,,,,,False,False,False,False,False,False,False,False,False,False,False,False,False,False,False,False
52,9780,"""29:14""","Well, for me personally, allowing 16 year olds to vote and School Board elections. I think that's that's a good goal. I think it gives them up for becoming a teen and full-on voters in our country making voting a Civic obligation. I think we've pretty much exhausted that, you know, it's not really going to produce",yes," 1. The speaker believes that allowing 16 year olds to vote is a good goal.
2. They think that allowing 16 year olds to vote will help them transition into becoming full-fledged voters in the country.
3. The speaker also thinks that making voting a civic obligation is a positive outcome of allowing 16 year olds to vote.
4. The speaker mentions School Board elections in relation to allowing 16 year olds to vote.
5. The speaker believes that the proposal of allowing 16 year olds to vote has been discussed thoroughly and will not produce any new arguments.",,,,,,,,,,, The speaker also thinks that making voting a civic obligation is a positive outcome of allowing 16 year olds to vote,,,,, The speaker believes that allowing 16 year olds to vote is a good goal  They think that allowing 16 year olds to vote will help them transition into becoming full-fledged voters in the country  The speaker mentions School Board elections in relation to allowing 16 year olds to vote  The speaker believes that the proposal of allowing 16 year olds to vote has been discussed thoroughly and will not produce any new arguments,False,False,False,False,False,False,False,False,False,False,True,False,False,False,False,True
53,9780,"""29:14"""," valid reflective results at the polls. I see no reason in this day and age of technology to make Federal Election Day. A national holiday, and I have mixed feelings about having a independent candidates.",yes," 1. The writer sees valid reflective results at the polls.
2. They think there is no reason not to make Federal Election Day a national holiday, in this day and age of technology.
3. The writer has mixed feelings about having independent candidates.",,,,,,,,," They think there is no reason not to make Federal Election Day a national holiday, in this day and age of technology",,,,,, The writer has mixed feelings about having independent candidates, The writer sees valid reflective results at the polls,False,False,False,False,False,False,False,False,True,False,False,False,False,False,True,True
54,48742,"""29:59""",,no,,,,,,,,,,,,,,,,,,False,False,False,False,False,False,False,False,False,False,False,False,False,False,False,False
55,48742,"""29:59""","So, I think it's a good idea to include more third parties and independent candidates on the ballot. I think they need more exposure instead of being dominated by the two major parties. Federal election day is a national holiday. I think it's probably a little bit. Excessive. I know many employers are very supportive of the election day, anyways like our employer will usually give you time to go and vote if you want.",yes," 1. It's a good idea to include more third parties and independent candidates on the ballot.
2. They need more exposure instead of being dominated by the two major parties.
3. Federal election day should not be a national holiday.
4. Many employers are supportive of the election day, and they usually give time to go and vote.",,,,,,,,,,, They need more exposure instead of being dominated by the two major parties,,,, It's a good idea to include more third parties and independent candidates on the ballot," Federal election day should not be a national holiday  Many employers are supportive of the election day, and they usually give time to go and vote",False,False,False,False,False,False,False,False,False,False,True,False,False,False,True,True
56,48742,"""29:59""","Vote there. You can do it ahead of time and I'm also in favor of 16 year olds to start voting in School Board elections, as well. I think it's a good practice to start.",yes," 1. It is recommended to vote at the specified location.
2. The speaker is in favor of advance voting.
3. The speaker supports 16 year olds being allowed to vote in School Board elections.
4. The speaker believes that this can serve as good practice for young individuals.",,,,,,,,,,,,,,,, It is recommended to vote at the specified location  The speaker is in favor of advance voting  The speaker supports 16 year olds being allowed to vote in School Board elections  The speaker believes that this can serve as good practice for young individuals,False,False,False,False,False,False,False,False,False,False,False,False,False,False,False,True
57,9687,"""30:42""","I do like the idea of third parties, being on the ballot, you know, they say lowering the requirements, I think there is a required number of either signatures or primary type votes otherwise that ballot could become, you know, very excessive with the number of names on it as far as federal holiday. I don't necessarily think we need a Federal holiday for elections, but we do need to have some sort of Provisions that require",no,,,,,,,,,,,,,,,,,,False,False,False,False,False,False,False,False,False,False,False,False,False,False,False,False
58,9687,"""30:42"""," Choir, you know, by law, employers can't prevent their employees from taking time, off to go vote. And then, as far as a Civic obligation, like jury duty with fine,",yes," 1. Employers cannot prevent employees from taking time off to vote, according to law.
2. Jury duty is a civic obligation, and there may be fines for not fulfilling this duty.",,,,,,,,,,,,,,,," Employers cannot prevent employees from taking time off to vote, according to law  Jury duty is a civic obligation, and there may be fines for not fulfilling this duty",False,False,False,False,False,False,False,False,False,False,False,False,False,False,False,True
59,48743,"""31:27""",,no,,,,,,,,,,,,,,,,,,False,False,False,False,False,False,False,False,False,False,False,False,False,False,False,False
60,48743,"""31:27""","That's I think the third parties, I would definitely like to see more and that the sixteen-year-olds again would be a good way to get more people out. I don't see any reason for a holiday but like Mike had mentioned making sure that corporations and businesses do allow people to go out to vote if they decide to vote on the day of the election.",yes," 1. The third parties should be increased.
2. It would be beneficial to allow sixteen-year-olds to vote.
3. There is no need for a holiday for the election.
4. It is important to ensure that corporations and businesses allow employees to go out and vote on the day of the election.",,,,,,,,,,,,,,, It is important to ensure that corporations and businesses allow employees to go out and vote on the day of the election, The third parties should be increased  It would be beneficial to allow sixteen-year-olds to vote  There is no need for a holiday for the election,False,False,False,False,False,False,False,False,False,False,False,False,False,False,True,True
61,9780,"""32:11""","Just a piece of useless. Trivia, most American voters do not vote in their School Board elections locally and",yes," 1. Most American voters do not participate in School Board elections in their community.
2. This fact is considered as trivia.
3. School Board elections decide on local educational policies and leadership.
4. The low voter turnout for these elections may have an impact on the representation of community members in educational decision-making.",,,,,,,,,,,,,,,, Most American voters do not participate in School Board elections in their community  This fact is considered as trivia  School Board elections decide on local educational policies and leadership  The low voter turnout for these elections may have an impact on the representation of community members in educational decision-making,False,False,False,False,False,False,False,False,False,False,False,False,False,False,False,True
62,9780,"""32:11""", Who knows? Maybe these sixteen-year-olds will get them involved as well.,no,,,,,,,,,,,,,,,,,,False,False,False,False,False,False,False,False,False,False,False,False,False,False,False,False
63,9687,"""35:14""",,no,,,,,,,,,,,,,,,,,,False,False,False,False,False,False,False,False,False,False,False,False,False,False,False,False
64,9687,"""35:14""",I was typing as fast as I could couldn't didn't hit submit in time.,no,,,,,,,,,,,,,,,,,,False,False,False,False,False,False,False,False,False,False,False,False,False,False,False,False
65,48743,"""35:21""","Yeah, that makes two of us. Mike, I did the same thing.",no,,,,,,,,,,,,,,,,,,False,False,False,False,False,False,False,False,False,False,False,False,False,False,False,False
66,9780,"""35:28""",,no,,,,,,,,,,,,,,,,,,False,False,False,False,False,False,False,False,False,False,False,False,False,False,False,False
67,9780,"""35:28""",Yeah. Same as both of you. Do you mind telling us what your questions were? What line of thought they were?,no,,,,,,,,,,,,,,,,,,False,False,False,False,False,False,False,False,False,False,False,False,False,False,False,False
68,9687,"""35:40""","Mine was on the Democracy vouchers and how it would be basically a tax in that, you know, that's what it felt like was.",yes," 1. The text is about the speaker's opinion on Democracy vouchers.
2. The speaker equates Democracy vouchers to a tax.
3. The speaker's opinion is that using Democracy vouchers feels like paying a tax.",,,,,,,,,,,,, The text is about the speaker's opinion on Democracy vouchers,, The speaker equates Democracy vouchers to a tax, The speaker's opinion is that using Democracy vouchers feels like paying a tax,False,False,False,False,False,False,False,False,False,False,False,False,True,False,True,True
69,48743,"""35:53""",Mine was more addressing. Why don't we hold the line on spending for campaigns and instead of trying to increase the amount of money we spend on,yes," 1. The author's view is focused on addressing the issue of campaign spending.
2. They suggest holding the line on spending for political campaigns.
3. The author proposes to shift the focus from increasing campaign funds to other strategies.",,,,,,,,,,,,,, They suggest holding the line on spending for political campaigns, The author's view is focused on addressing the issue of campaign spending  The author proposes to shift the focus from increasing campaign funds to other strategies,,False,False,False,False,False,False,False,False,False,False,False,False,False,True,True,False
70,9780,"""36:04""","Now Bob, I like that a lot.",no,,,,,,,,,,,,,,,,,,False,False,False,False,False,False,False,False,False,False,False,False,False,False,False,False
71,9780,"""36:04"""," So, the question we've got is how to address loopholes that allow foreign entities to interfere in US elections.",no,,,,,,,,,,,,,,,,,,False,False,False,False,False,False,False,False,False,False,False,False,False,False,False,False
72,48743,"""36:50""","Well, I'm pretty sure we're not going to waste too much time on addressing the question at this point, but yeah, it'll be interesting to see where we go with this. Hopefully, somebody else will and what are the other groups might have come up with a question?",yes," 1. The text does not directly address a specific question.
2. The author suggests that they will not spend much time on the question.
3. There is interest in seeing what other groups have come up with.
4. The author hopes that other groups have developed a question.",,,,,,,,,,,,,,,, The text does not directly address a specific question  The author suggests that they will not spend much time on the question  There is interest in seeing what other groups have come up with  The author hopes that other groups have developed a question,False,False,False,False,False,False,False,False,False,False,False,False,False,False,False,True
73,9780,"""37:07""","Yeah, I kind of feel like there's a lot of material to cover here before I could get a question off myself.",no,,,,,,,,,,,,,,,,,,False,False,False,False,False,False,False,False,False,False,False,False,False,False,False,False
74,9687,"""37:18""","Yeah, it would have been nice if we had a little bit longer to actually, you know, type out our questions.",yes," 1. The speaker would have preferred more time to type out their questions.
2. The speaker seems to be in a situation where they are expected to type out questions.",,,,,,,,,,,,,,,, The speaker would have preferred more time to type out their questions  The speaker seems to be in a situation where they are expected to type out questions,False,False,False,False,False,False,False,False,False,False,False,False,False,False,False,True
75,9687,"""37:29""",Do we see any changes that we want to make two catchiest question?,no,,,,,,,,,,,,,,,,,,False,False,False,False,False,False,False,False,False,False,False,False,False,False,False,False
76,9780,"""37:41""","Yeah. I mean I guess my question would be, who does that fall to would that fall to our banking institutions? Would it fall to our federal government? Yeah, I mean the opportunities are endless real",no,,,,,,,,,,,,,,,,,,False,False,False,False,False,False,False,False,False,False,False,False,False,False,False,False
77,48743,"""37:58""","You know, it's probably a little bit of everything. It is probably the FED doesn't and probably government intercession as far as what's going on with any other kind of one. They end up having these big conferences and meetings and other things it's probably some way to address it at that point.",yes," 1. The cause of the situation is likely a combination of different factors.
2. The Federal Reserve (FED) may be involved in some way.
3. Government intervention could be a contributing factor.
4. Large conferences and meetings are likely being held to address the situation.",,,,,,,,,,,,,,,, The cause of the situation is likely a combination of different factors  The Federal Reserve (FED) may be involved in some way  Government intervention could be a contributing factor  Large conferences and meetings are likely being held to address the situation,False,False,False,False,False,False,False,False,False,False,False,False,False,False,False,True
78,9687,"""38:24""","Yeah, I have concerns about, you know, all the loopholes that are out there, I mean, you know, let's face it there's ways around everything at this point, you know? If you're limited to two hundred dollars per candidate then you know you and you want to give more well you know you give your kids two hundred dollars each and tell them to sign their name up for it even if they had no you no interest in giving money to that candidate. Or you give it to somebody else or if a company needs you know or wants a particular candidate they can.",yes," 1. Concern about loopholes in limiting campaign contributions to $200 per candidate.
2. Way to get around the limit is by giving $200 to multiple individuals who then donate it to the same candidate.
3. Another way is by giving the money to someone else who can donate it to the candidate.
4. Companies can also find ways to donate to a candidate who they want to support.",, Way to get around the limit is by giving $200 to multiple individuals who then donate it to the same candidate  Another way is by giving the money to someone else who can donate it to the candidate  Companies can also find ways to donate to a candidate who they want to support, Concern about loopholes in limiting campaign contributions to $200 per candidate,,,,,,,,,,,,,,False,True,True,False,False,False,False,False,False,False,False,False,False,False,False,False
79,9687,"""38:24"""," Stipend their employees with two hundred dollars each, you know, under the table or whatever, and tell them to donate it to that that particular candidate with their, under their name. There's ways around stuff.",yes," 1. The text suggests giving employees two hundred dollars each.
2. This payment should be given under the table.
3. Employees are then told to donate this money to a specific candidate.
4. The donation should be made under the employee's name.
5. The text implies that this is a way to circumvent campaign finance laws or regulations.",,,,,,,,,,,,,,, The text implies that this is a way to circumvent campaign finance laws or regulations, The text suggests giving employees two hundred dollars each  This payment should be given under the table  Employees are then told to donate this money to a specific candidate  The donation should be made under the employee's name,False,False,False,False,False,False,False,False,False,False,False,False,False,False,True,True
80,48743,"""39:08""","Especially since so many companies are international, it really wouldn't be too difficult to get around it.",yes," 1. Many companies are international in nature.
2. This makes it easier for them to get around restrictions.
3. The specific restriction being referred to is not mentioned in the text.",, This makes it easier for them to get around restrictions,,,,,,,,,,,,, Many companies are international in nature  The specific restriction being referred to is not mentioned in the text,,False,True,False,False,False,False,False,False,False,False,False,False,False,False,True,False
81,48743,"""40:03""",Real country looks like your number one. And number two.,no,,,,,,,,,,,,,,,,,,False,False,False,False,False,False,False,False,False,False,False,False,False,False,False,False
82,9780,"""40:09""",,no,,,,,,,,,,,,,,,,,,False,False,False,False,False,False,False,False,False,False,False,False,False,False,False,False
83,9780,"""40:09""",Well done cat. And it's been a pleasure speaking with all of you.,no,,,,,,,,,,,,,,,,,,False,False,False,False,False,False,False,False,False,False,False,False,False,False,False,False
84,48742,"""40:17""","Yeah, thank you. Everyone participating. It was really nice meeting. You all as well.",no,,,,,,,,,,,,,,,,,,False,False,False,False,False,False,False,False,False,False,False,False,False,False,False,False
85,48743,"""40:24""",It was great talking to everybody.,no,,,,,,,,,,,,,,,,,,False,False,False,False,False,False,False,False,False,False,False,False,False,False,False,False
86,9687,"""40:27""","I don't know if the if anybody saw the email, there's like some extra session after this session. I'm not sure what that's all about.",no,,,,,,,,,,,,,,,,,,False,False,False,False,False,False,False,False,False,False,False,False,False,False,False,False
87,9780,"""40:34""","Well, when I think there's a survey, we have to complete as part of this process, but I'm curious about when and where to look for results of all this.",no,,,,,,,,,,,,,,,,,,False,False,False,False,False,False,False,False,False,False,False,False,False,False,False,False
88,48742,"""40:47""","Yes, it sounded like we may have to reconnect at a later time. Again was a small group but I guess we'll find out. Maybe we'll get directed to it.",no,,,,,,,,,,,,,,,,,,False,False,False,False,False,False,False,False,False,False,False,False,False,False,False,False
