Order,Speaker,Time,Text,Has Arguments,All Arguments Summarized,FOR: limitCampaignContributions,AGAINST: limitCampaignContributions,FOR: closeForeignLoopholes,AGAINST: closeForeignLoopholes,FOR: establishRedistrictingCommissions,AGAINST: establishRedistrictingCommissions,FOR: implementProportionalRepresentation,AGAINST: implementProportionalRepresentation,FOR: encourageTransparency,AGAINST: encourageTransparency,FOR: promoteCivicEducation,AGAINST: promoteCivicEducation,FOR: explorePublicFunding,AGAINST: explorePublicFunding,other,notRelevant,FOR: limitCampaignContributions (bool),AGAINST: limitCampaignContributions (bool),FOR: closeForeignLoopholes (bool),AGAINST: closeForeignLoopholes (bool),FOR: establishRedistrictingCommissions (bool),AGAINST: establishRedistrictingCommissions (bool),FOR: implementProportionalRepresentation (bool),AGAINST: implementProportionalRepresentation (bool),FOR: encourageTransparency (bool),AGAINST: encourageTransparency (bool),FOR: promoteCivicEducation (bool),AGAINST: promoteCivicEducation (bool),FOR: explorePublicFunding (bool),AGAINST: explorePublicFunding (bool),other (bool),notRelevant (bool)
1,10383,"""9:51""","I think citizens united was a mistake. I think allowing so much money to be pumped into these campaigns was just a bad idea. In general, I think there should be a Max not contribution but like Max budget for every candidate at each level because I think that would lit level the playing field a bit and especially allow more third-party candidates to have a voice. That's just as loud.",yes," 1. The speaker thinks that the Citizens United decision was a mistake.
2. They believe that allowing large amounts of money to be contributed to campaigns was a bad idea.
3. The speaker thinks that there should be a maximum budget for every candidate at each level.
4. They believe this would level the playing field and allow more third-party candidates to have a voice that is just as loud.", They believe that allowing large amounts of money to be contributed to campaigns was a bad idea  The speaker thinks that there should be a maximum budget for every candidate at each level  They believe this would level the playing field and allow more third-party candidates to have a voice that is just as loud,,,,,,,,,,,,,, The speaker thinks that the Citizens United decision was a mistake,,True,False,False,False,False,False,False,False,False,False,False,False,False,False,True,False
2,10383,"""9:51""", One reasons that third-party candidates are pushed out is because we allow these two party candidates gets so much money.,no,,,,,,,,,,,,,,,,,,False,False,False,False,False,False,False,False,False,False,False,False,False,False,False,False
3,10383,"""9:51""",,no,,,,,,,,,,,,,,,,,,False,False,False,False,False,False,False,False,False,False,False,False,False,False,False,False
4,48475,"""10:32""","I definitely agree with what James is saying as far as there should be a budget limit. But as far as what people contribute this their money, they earned it, they went out and they work for it and have or they want to spend it. That's up them, that's their business. So I'm completely okay. With that, as far as individual donations, it could be whatever you want but I agree there should be a limit to as far as a budget. I want a degree.",yes," 1. The speaker agrees with the idea of having a budget limit for something, likely a campaign or project.
2. The speaker believes that individuals should have the freedom to decide how to use their own money, which they have earned through work.
3. The speaker is in favor of having no limit for individual donations.
4. The speaker wants a degree."," The speaker agrees with the idea of having a budget limit for something, likely a campaign or project", The speaker is in favor of having no limit for individual donations,,,,,,,,,,,,,," The speaker believes that individuals should have the freedom to decide how to use their own money, which they have earned through work  The speaker wants a degree",True,True,False,False,False,False,False,False,False,False,False,False,False,False,False,True
5,48263,"""11:02""","Yeah, I think limits, they have to be raced at every level, you know, due to inflation 3,000 hours. Ten years ago, was a lot right now is, how much. And so it should be raised better, man. I have a problem with corporations. You know, being seen as a Corp, you know, as an entity would free speech. I just, nope. Nope, sorry, corporations robots, a eyes. Nope. They shouldn't have a say, so.",yes," 1. Limits should be raced at every level due to inflation.
2. 3,000 hours is now considered a lot, compared to ten years ago when it was not.
3. The speaker thinks that limits should be raised.
4. The speaker has a problem with corporations being seen as entities with free speech.
5. The speaker does not believe that corporations, including robots, should have a say.",, The speaker thinks that limits should be raised,,,,,,,,,,,,," The speaker has a problem with corporations being seen as entities with free speech  The speaker does not believe that corporations, including robots, should have a say"," Limits should be raced at every level due to inflation  3,000 hours is now considered a lot, compared to ten years ago when it was not",False,True,False,False,False,False,False,False,False,False,False,False,False,False,True,True
6,48263,"""11:02"""," And it elections better. Everything else. Yes, control foreign entities from influencing. There should be some restrictions on that and raise the limits, I didn't see any issues or problems on raising those limits.",yes," 1. Elections should be improved.
2. There should be restrictions on foreign entities to prevent them from influencing elections.
3. The limits on these restrictions should be raised.
4. No issues or problems were mentioned regarding the raising of these limits.",, The limits on these restrictions should be raised, There should be restrictions on foreign entities to prevent them from influencing elections,,,,,,,,,,,,, Elections should be improved  No issues or problems were mentioned regarding the raising of these limits,False,True,True,False,False,False,False,False,False,False,False,False,False,False,False,True
7,48265,"""11:55""","Seems to me that the amount or adequate like has been said before people you know, work hard so they want to contribute that, you know, that's what it is. But just looking at, what was given his background, 14 billion dollars was spent on the last national election. Think about that 14 billion dollars on campaign contributions.",yes," 1. A large amount of money, specifically 14 billion dollars, was spent on the last national election.
2. This money was spent on campaign contributions.
3. The reason for this large expenditure is that people who work hard want to contribute to the election process.
4. It is implied that this is a well-known fact or has been discussed before.",,,,,,,,,,,,,,,," A large amount of money, specifically 14 billion dollars, was spent on the last national election  This money was spent on campaign contributions  The reason for this large expenditure is that people who work hard want to contribute to the election process  It is implied that this is a well-known fact or has been discussed before",False,False,False,False,False,False,False,False,False,False,False,False,False,False,False,True
8,48265,"""11:55"""," Abuse ins. Wow. And that seems like that quite a bit. I mean, it is double the amount from the previous election. So anyway, I think the current amounts are we need",yes," I apologize, but the text you provided seems incomplete and difficult to summarize. Here is a summary based on the given text:

1. There is an issue of abuse involving insufficient information.
2. The abuse seems significant and has doubled since the previous election.
3. It is important to address the issue and take necessary actions.",,,,,,,,,,,,,,, Here is a summary based on the given text:  There is an issue of abuse involving insufficient information  The abuse seems significant and has doubled since the previous election,"apologize, but the text you provided seems incomplete and difficult to summarize  It is important to address the issue and take necessary actions",False,False,False,False,False,False,False,False,False,False,False,False,False,False,True,True
9,48326,"""12:40""",I agree with Clinton James that there should be some cap on how much they can spend on.,yes," 1. There is agreement with Clinton James' viewpoint.
2. Clinton James believes there should be a limit on spending.
3. This limit on spending applies to a particular entity or entities, but the text does not specify who or what.", Clinton James believes there should be a limit on spending,,,,,,,,,,,,,," This limit on spending applies to a particular entity or entities, but the text does not specify who or what", There is agreement with Clinton James' viewpoint,True,False,False,False,False,False,False,False,False,False,False,False,False,False,True,True
10,48326,"""12:40"""," Campaigns. Because it's just going to keep going up and up, as just got into his ridiculous. And loopholes, it's, you know, why of there are loopholes that exist for foreign-controlled entities, making contributions and everything that's just for them to get more money. So it all comes back to the money.",no,,,,,,,,,,,,,,,,,,False,False,False,False,False,False,False,False,False,False,False,False,False,False,False,False
11,48475,"""15:04""","I don't think we should ever use public funds to finance any of this. That's my money. It's your money. And we work for we learned it. If we want to donate it, that's fine. But as far as coming out of public funds, I absolutely disagree with that. And then, as far as donors go, I see both sides of it. I may not want you to do it. It's none of your business. But at the same time, I can also understand where people would want to understand. Okay, why did this person back that? This person I can get both sides of that.",no,,,,,,,,,,,,,,,,,,False,False,False,False,False,False,False,False,False,False,False,False,False,False,False,False
12,48475,"""15:04""", At.,no,,,,,,,,,,,,,,,,,,False,False,False,False,False,False,False,False,False,False,False,False,False,False,False,False
13,10475,"""15:39""","Can y'all hear me now, cool? I also agree. Hum sent public funds. I don't get it, but I'm a pretty big fan of knowing who's voted. Who's putting money towards things because I am one of those people. If I see a company that is not backing something that I support, I will choose to go the competitive because that's important to me. And I like having that right, I don't think it should be like, oh, if they donated $1, we should know. But of us on the mount I like to kind of know where",yes," 1. The speaker wants to know who has contributed money to things.
2. The speaker is a fan of knowing which politicians have received public funds.
3. The speaker is one of the people who contributes money.
4. If a company does not support something that the speaker does, they will choose a competitor.
5. The speaker values the right to have this information.
6. The speaker does not think that the amount of money donated should determine whether or not it is made public.
7. The speaker refers to ""us on the mount,"" suggesting that they are part of a group that values transparency in political funding.",, The speaker is one of the people who contributes money,,,,,,," The speaker does not think that the amount of money donated should determine whether or not it is made public  The speaker refers to ""us on the mount,"" suggesting that they are part of a group that values transparency in political funding",,,, The speaker is a fan of knowing which politicians have received public funds,,," The speaker wants to know who has contributed money to things  If a company does not support something that the speaker does, they will choose a competitor  The speaker values the right to have this information",False,True,False,False,False,False,False,False,True,False,False,False,True,False,False,True
14,10475,"""15:39""", Accompanying set. Sit especially if I'm walking for that company. I want to make sure they're aligned with my values.,no,,,,,,,,,,,,,,,,,,False,False,False,False,False,False,False,False,False,False,False,False,False,False,False,False
15,48265,"""16:14""","Yeah, I agree that public funds should not be used. That's that's to be used for more pressing matters. If I want to contribute to something, I will do that first one and I have no problem with being disclosed or being identified. I don't think anybody should be a problem with that. So I think that the current laws with the disclosure of who's",no,,,,,,,,,,,,,,,,,,False,False,False,False,False,False,False,False,False,False,False,False,False,False,False,False
16,48265,"""16:14"""," Contributing I think that should stand placed some of the big wealthy donors. They don't like to have that, but hey that's that's that's too bad.",no,,,,,,,,,,,,,,,,,,False,False,False,False,False,False,False,False,False,False,False,False,False,False,False,False
17,48326,"""16:59""",I agree that public funds should not be used in any of the elections. Also going down to the bottom as far as packs or concerned. I think it's very important to disclose top donors and officials for packs. So that voters what have information supplied to him about those packs?,no,,,,,,,,,,,,,,,,,,False,False,False,False,False,False,False,False,False,False,False,False,False,False,False,False
18,10485,"""18:10""",How can we ever guarantee non-partisanship in anything?,no,,,,,,,,,,,,,,,,,,False,False,False,False,False,False,False,False,False,False,False,False,False,False,False,False
19,10485,"""18:10"""," If if you have a human being involved they're going to have biases. And it just seems to me that we've to even considers just because we hire someone and they're not appointed by political party, doesn't mean they have personal beliefs. So I just I'll just throw that out there too.",yes," 1. The involvement of a human being in a situation can lead to biases.
2. Even if someone is not appointed by a political party, they may still have personal beliefs.
3. These personal beliefs can potentially affect their judgment.
4. The speaker suggests that this is an important point to consider.",,,,,,,,,,,,,,, The involvement of a human being in a situation can lead to biases  These personal beliefs can potentially affect their judgment," Even if someone is not appointed by a political party, they may still have personal beliefs  The speaker suggests that this is an important point to consider",False,False,False,False,False,False,False,False,False,False,False,False,False,False,True,True
20,10696,"""18:39""","I would agree. We want to make sure that any of those, the commission's are truly nonpartisan, but I think leaving it the way, it is right now is absolutely recipe for continued disasters, letting the leaders choose who their voters are going to be is just a recipe to entrench up certain groups in power on both sides of the aisle. What I've seen with some commissions is that each party is able to nominate like two officers for a commission and then like a fifth is, you know, chosen. I don't know how independently I'm a basically, allowing the parties.",yes," 1. It is important that any commissions are truly nonpartisan.
2. Leaving the current system of commission selection unchanged will lead to continued disasters.
3. Allowing leaders to choose who their voters are, entrenches certain groups in power on both sides of the aisle.
4. In some commissions, each party is able to nominate a few officers.
5. A fifth member is often chosen independently, but this method may not ensure true independence.",,,,," It is important that any commissions are truly nonpartisan  Allowing leaders to choose who their voters are, entrenches certain groups in power on both sides of the aisle  In some commissions, each party is able to nominate a few officers",,,,,,,,,," A fifth member is often chosen independently, but this method may not ensure true independence", Leaving the current system of commission selection unchanged will lead to continued disasters,False,False,False,False,True,False,False,False,False,False,False,False,False,False,True,True
21,10696,"""18:39"""," To nominate their folks, as long as they, you know, meet certain wedding requirements, and such can help to make it, you know, more fair. So I think we need the commission's, you know. Of course, they're going to be debates over how to set them up, but I think is very important that it not be the legislature's, drawing their own boundaries and choosing their voters.",yes," 1. It is suggested that a system for nominating folks to help ensure fairness in weddings, as long as they meet certain requirements, be implemented.
2. This system should not be set up by the legislature, as it would risk them drawing their own boundaries and choosing their voters.
3. The involvement of an impartial commission is considered crucial in establishing these requirements.
4. There will likely be debates over how to set up this system, but it is important that the legislature is not responsible for drawing boundaries and selecting voters.",,,,," There will likely be debates over how to set up this system, but it is important that the legislature is not responsible for drawing boundaries and selecting voters"," This system should not be set up by the legislature, as it would risk them drawing their own boundaries and choosing their voters",,,,,,,,, The involvement of an impartial commission is considered crucial in establishing these requirements," It is suggested that a system for nominating folks to help ensure fairness in weddings, as long as they meet certain requirements, be implemented",False,False,False,False,True,True,False,False,False,False,False,False,False,False,True,True
22,10475,"""19:24""","I want to apologize to my lack of knowledge heal but I was just wondering, does anyone know how often these are redrawn? Because I remember what I learned about this in my class I was shocked by how not fail. It was to some individuals and some folks so I don't know if they're common thing to redraw them or would this be something?",no,,,,,,,,,,,,,,,,,,False,False,False,False,False,False,False,False,False,False,False,False,False,False,False,False
23,48265,"""19:43""",,no,,,,,,,,,,,,,,,,,,False,False,False,False,False,False,False,False,False,False,False,False,False,False,False,False
24,48265,"""19:43""","I think that the independent redistricting commission would be a good thing. Certainly, whoever is in power, whichever parties in power is going to favor themselves. So if you can establish, the non partisan redistricting Commission on a national level, that would be terrific because then it's going to be a balanced strictly working off of, I believe it worked off the consensus of the",yes," 1. The establishment of an independent redistricting commission is considered a good idea.
2. Those in power, regardless of party, will likely favor themselves in redistricting.
3. A national non-partisan redistricting Commission would be beneficial.
4. Such a commission would work off of consensus and ensure a balanced redistricting process.",,,,, The establishment of an independent redistricting commission is considered a good idea  A national non-partisan redistricting Commission would be beneficial  Such a commission would work off of consensus and ensure a balanced redistricting process," Those in power, regardless of party, will likely favor themselves in redistricting",,,,,,,,,,,False,False,False,False,True,True,False,False,False,False,False,False,False,False,False,False
25,48265,"""19:43"""," yeah, consensus of everybody and it would be good.",no,,,,,,,,,,,,,,,,,,False,False,False,False,False,False,False,False,False,False,False,False,False,False,False,False
26,48265,"""19:43""",,no,,,,,,,,,,,,,,,,,,False,False,False,False,False,False,False,False,False,False,False,False,False,False,False,False
27,10696,"""20:28""","To answer your question, Nikki, I believe it's required to be done every 10 years after each census when the numbers come out in order to make sure that you know any movement of people changes in population are addressed though. I believe there are some states that do it more frequently and in every state that doesn't have the independent commission, it is done by the legislature. And so in legislators that are heavily dominated by one party or another, which is most of our state's to be honest. There are very few like, truly bipartisan State still where they're required to have cooperation.",yes," 1. The redrawing of voting district boundaries is required to be done every 10 years after each census.
2. This is done to address any movement or changes in population.
3. Some states may choose to redraw districts more frequently.
4. In states without an independent commission, the redrawing of districts is done by the legislature.
5. In legislatures that are heavily dominated by one party, there is a lack of requirement for cooperation.
6. There are very few truly bipartisan states where cooperation is required for redrawing voting districts.",,,,," The redrawing of voting district boundaries is required to be done every 10 years after each census  In states without an independent commission, the redrawing of districts is done by the legislature  There are very few truly bipartisan states where cooperation is required for redrawing voting districts",,,,,,,,,," Some states may choose to redraw districts more frequently  In legislatures that are heavily dominated by one party, there is a lack of requirement for cooperation", This is done to address any movement or changes in population,False,False,False,False,True,False,False,False,False,False,False,False,False,False,True,True
28,10696,"""20:28"""," Ation and you got one party drawing the lines and again choosing their voters they can split what would be it? You know minority dominant area divided in half and just completely invalidate. The the role of those voters by splitting them into different districts,",no,,,,,,,,,,,,,,,,,,False,False,False,False,False,False,False,False,False,False,False,False,False,False,False,False
29,48475,"""21:12""","So a similar thing, I'm one of the few counties here in the State of Florida that we don't get to vote for all of the County Commissioners, even because we're not in that District. So we're one of the few but it is kind of aggravating that I can't vote for all the districts because they all vote and make decisions for my County. So I can definitely understand how that is aggravating. I don't exactly know what the answer is for that. But I completely",no,,,,,,,,,,,,,,,,,,False,False,False,False,False,False,False,False,False,False,False,False,False,False,False,False
30,10383,"""22:58""",,no,,,,,,,,,,,,,,,,,,False,False,False,False,False,False,False,False,False,False,False,False,False,False,False,False
31,10383,"""22:58""",I mean I've already mentioned much too.,no,,,,,,,,,,,,,,,,,,False,False,False,False,False,False,False,False,False,False,False,False,False,False,False,False
32,10383,"""22:58""","A lot of disagreement that voting is a Civic obligation and should be required mandatory. And also yeah, third-party independent candidates that are all watching day all those fantastic. Now for as far as allowing 16 year, olds to register and vote,",yes," 1. There is disagreement about whether voting is a civic obligation that should be mandatory.
2. The role of third-party and independent candidates in elections is being discussed.
3. There is a proposal to allow 16-year-olds to register and vote.",,,,,,,,,,,,,,,, There is disagreement about whether voting is a civic obligation that should be mandatory  The role of third-party and independent candidates in elections is being discussed  There is a proposal to allow 16-year-olds to register and vote,False,False,False,False,False,False,False,False,False,False,False,False,False,False,False,True
33,10383,"""22:58""","I think that we should reconsider that even being a possibility of 16 year olds, their brain isn't halfway developed these kids they can't buy tobacco, they can't buy guns, they can't buy alcohol. Why should we expect them to make changes that will affect policy?",no,,,,,,,,,,,,,,,,,,False,False,False,False,False,False,False,False,False,False,False,False,False,False,False,False
34,48475,"""23:43""","I completely agree with James on 16 year, olds voting, you know, you got to be 21 by firearm. You have to be 21 to buy cigarettes. You need to be, you know, at least 18 to be able to vote. I'm all for making it easier for third parties, the federal election day, I'm all for that. If it's a holiday if we're not doing all the mail-in voting and all the online voting and stuff, then yes, people can get their get where they need to get and they need to vote. But I think that",yes," 1. 16 year-olds should not be allowed to vote.
2. One must be 21 to buy firearms.
3. One must be 21 to buy cigarettes.
4. It is acceptable for 18 year-olds to vote.
5. The speaker supports making it easier for third parties to vote.
6. The speaker supports making federal election day a holiday.
7. The speaker supports traditional in-person voting methods over mail-in and online voting.",,,,,,,,,,,,,,,, 16 year-olds should not be allowed to vote  One must be 21 to buy firearms  One must be 21 to buy cigarettes  It is acceptable for 18 year-olds to vote  The speaker supports making it easier for third parties to vote  The speaker supports making federal election day a holiday  The speaker supports traditional in-person voting methods over mail-in and online voting,False,False,False,False,False,False,False,False,False,False,False,False,False,False,False,True
