Order,Speaker,Time,Text,Has Arguments,All Arguments Summarized,FOR: limitCampaignContributions,AGAINST: limitCampaignContributions,FOR: closeForeignLoopholes,AGAINST: closeForeignLoopholes,FOR: establishRedistrictingCommissions,AGAINST: establishRedistrictingCommissions,FOR: implementProportionalRepresentation,AGAINST: implementProportionalRepresentation,FOR: encourageTransparency,AGAINST: encourageTransparency,FOR: promoteCivicEducation,AGAINST: promoteCivicEducation,FOR: explorePublicFunding,AGAINST: explorePublicFunding,other,notRelevant,FOR: limitCampaignContributions (bool),AGAINST: limitCampaignContributions (bool),FOR: closeForeignLoopholes (bool),AGAINST: closeForeignLoopholes (bool),FOR: establishRedistrictingCommissions (bool),AGAINST: establishRedistrictingCommissions (bool),FOR: implementProportionalRepresentation (bool),AGAINST: implementProportionalRepresentation (bool),FOR: encourageTransparency (bool),AGAINST: encourageTransparency (bool),FOR: promoteCivicEducation (bool),AGAINST: promoteCivicEducation (bool),FOR: explorePublicFunding (bool),AGAINST: explorePublicFunding (bool),other (bool),notRelevant (bool)
1,48503,"""10:07""","Well, I personally think that citizens united should be overturned if not anything. I mean I don't think corporations should equate to being actual people. I think that's a very nonsensical rule.",yes," 1. The speaker thinks that the Citizens United decision should be overturned.
2. They do not believe that corporations should be considered equal to people.
3. They think this is a nonsensical rule.",,,,,,,,,,,,,,, They do not believe that corporations should be considered equal to people, The speaker thinks that the Citizens United decision should be overturned  They think this is a nonsensical rule,False,False,False,False,False,False,False,False,False,False,False,False,False,False,True,True
2,48356,"""10:33""",,no,,,,,,,,,,,,,,,,,,False,False,False,False,False,False,False,False,False,False,False,False,False,False,False,False
3,48402,"""10:43""","I believe the idea of closing, loopholes, and minimize foreign expenditures getting around. The law should be advocated passed unanimously.",no,,,,,,,,,,,,,,,,,,False,False,False,False,False,False,False,False,False,False,False,False,False,False,False,False
4,48270,"""13:24""",I don't believe we should use any public funds for political campaigns.,yes," 1. The text is about the use of public funds for political campaigns.
2. The author expresses their belief that public funds should not be used for this purpose.",,,,,,,,,,,,, The text is about the use of public funds for political campaigns, The author expresses their belief that public funds should not be used for this purpose,,,False,False,False,False,False,False,False,False,False,False,False,False,True,True,False,False
5,48497,"""13:34""","I feel the same now I'm with you, Jon",no,,,,,,,,,,,,,,,,,,False,False,False,False,False,False,False,False,False,False,False,False,False,False,False,False
6,48402,"""13:44""",I agree with gone.,no,,,,,,,,,,,,,,,,,,False,False,False,False,False,False,False,False,False,False,False,False,False,False,False,False
7,48429,"""13:49""",,no,,,,,,,,,,,,,,,,,,False,False,False,False,False,False,False,False,False,False,False,False,False,False,False,False
8,48429,"""13:49""",Agreed.,no,,,,,,,,,,,,,,,,,,False,False,False,False,False,False,False,False,False,False,False,False,False,False,False,False
9,48503,"""13:57""","I agree with that too. I 125 percent agree that businesses should not public campaign fund should not be used. And I think that big businesses should not be able to donate to candidates either. I think only small businesses Beyond below, a certain amount of employees should be able to donate to political candidates.",yes," 1. The writer agrees that businesses should not use public campaign funds.
2. The writer strongly agrees with this point (125%).
3. The writer thinks that big businesses should not be allowed to donate to political candidates.
4. The writer believes that only small businesses, with a limited number of employees, should be allowed to donate to political candidates.
5. The writer does not specify the exact number of employees that should define a ""small"" business."," The writer thinks that big businesses should not be allowed to donate to political candidates  The writer believes that only small businesses, with a limited number of employees, should be allowed to donate to political candidates",,,,,,,,,,,,, The writer agrees that businesses should not use public campaign funds,," The writer strongly agrees with this point (125%)  The writer does not specify the exact number of employees that should define a ""small"" business",True,False,False,False,False,False,False,False,False,False,False,False,False,True,False,True
10,48402,"""14:28""","In the last election, we saw some Mega billionaires in twos. Large quantities of funds into various States, the biased Viewpoint of people of the public. It is my belief that those people should be limited as to what they can do.",yes," 1. In the last election, there was an involvement of Mega billionaires.
2. Large quantities of funds were invested by these billionaires into various States.
3. This funding resulted in a biased viewpoint of people in the public.
4. The billionaires should be limited in their actions during elections.", The billionaires should be limited in their actions during elections," In the last election, there was an involvement of Mega billionaires",,,,,,,,,,,,, Large quantities of funds were invested by these billionaires into various States, This funding resulted in a biased viewpoint of people in the public,True,True,False,False,False,False,False,False,False,False,False,False,False,False,True,True
11,48274,"""14:59""",Does anyone have any further information about how democracy vouchers were? I'm really interested in that.,no,,,,,,,,,,,,,,,,,,False,False,False,False,False,False,False,False,False,False,False,False,False,False,False,False
12,48270,"""15:11""","Democracy, vouchers are what the government again using public funds to finance campaigns, whether they be given to individuals, to support them or two others to support them, still public funds, that money has to come from somewhere. We don't have the best budget system in the world.",yes," 1. The government is using public funds to finance campaigns through democracy and vouchers.
2. These vouchers can be given to individuals to support their own campaigns or to support others.
3. The money for these vouchers comes from public funds, which must come from somewhere in the budget.
4. The budget system in the United States is not the best, which could make financing these vouchers difficult.",,,,,,,,,,,,, The government is using public funds to finance campaigns through democracy and vouchers  These vouchers can be given to individuals to support their own campaigns or to support others," The money for these vouchers comes from public funds, which must come from somewhere in the budget  The budget system in the United States is not the best, which could make financing these vouchers difficult",,,False,False,False,False,False,False,False,False,False,False,False,False,True,True,False,False
13,48368,"""15:35""",I'm probably an outlier here. I just don't think public money should be going into elections at all.,yes," 1. The person expresses a personal viewpoint.
2. They believe they are an exception or unusual in this opinion.
3. They think public funds should not be used for elections.",,,,,,,,,,,,,, They think public funds should not be used for elections, They believe they are an exception or unusual in this opinion, The person expresses a personal viewpoint,False,False,False,False,False,False,False,False,False,False,False,False,False,True,True,True
14,48368,"""15:35"""," And I mean, tax money.",no,,,,,,,,,,,,,,,,,,False,False,False,False,False,False,False,False,False,False,False,False,False,False,False,False
15,48274,"""15:51""","Isn't the idea of using public money to fund election, is to equalize the ability to participate. I mean, to make it less privatized.",yes," 1. The purpose of using public money to fund elections is to equalize the ability to participate.
2. This is done to make the election process less privatized.
3. Public funding for elections aims to ensure that all have an equal opportunity to participate.",,,,,,,,,,,,, The purpose of using public money to fund elections is to equalize the ability to participate  This is done to make the election process less privatized  Public funding for elections aims to ensure that all have an equal opportunity to participate,,,,False,False,False,False,False,False,False,False,False,False,False,False,True,False,False,False
16,48368,"""16:08""","Well, I'm somebody who completely disagrees with the Supreme Court's decision in, you know, making corporations into people and corporations giving unlimited amount of what I call dark money, but you know just clandestine money. I just, I completely did citizens. United completely needs to be overturned. Just it's",no,,,,,,,,,,,,,,,,,,False,False,False,False,False,False,False,False,False,False,False,False,False,False,False,False
17,48368,"""16:08""", It has just really turned our elections into just a new industry and that's not what they were ever intended to be.,no,,,,,,,,,,,,,,,,,,False,False,False,False,False,False,False,False,False,False,False,False,False,False,False,False
18,48274,"""16:46""",Right? So if we have a problem with private money specifically corporations funding elections and we want greater transparency when Public Funding be more transparent and more equal.,yes," 1. The problem discussed is private money, particularly corporations, funding elections.
2. The desire is to have greater transparency in election funding.
3. Public funding is suggested as a more transparent and more equal alternative to private funding in elections.",,,,,,,,, The desire is to have greater transparency in election funding,,,, Public funding is suggested as a more transparent and more equal alternative to private funding in elections,," The problem discussed is private money, particularly corporations, funding elections",,False,False,False,False,False,False,False,False,True,False,False,False,True,False,True,False
19,48402,"""17:02""","Well, if you consider the fact that you can donate money from your income tax, you would think that that money would be used in a way to provide, a more balanced view on elections. But if you look at the actual law and how the funds are actually distributed, it only AIDS, the people that are currently in office, does not provide any assistance for those people who are trying to enter it.",yes," 1. It is possible to donate money from income tax for election purposes.
2. The intention of this donation could be to create a more balanced view on elections.
3. However, the actual law and distribution of funds only supports people who are currently in office.
4. The funds do not assist people who are trying to enter the election.",,,,,,,,, The intention of this donation could be to create a more balanced view on elections,,,,,," It is possible to donate money from income tax for election purposes  However, the actual law and distribution of funds only supports people who are currently in office  The funds do not assist people who are trying to enter the election",,False,False,False,False,False,False,False,False,True,False,False,False,False,False,True,False
20,48368,"""17:34""","And as far as transparency, I think that any donation to a political campaign should should identify the person or company or corporation that is contributing that money but I just go back to, I don't care about transparency. I really believe that citizens united was incorrectly resolved and it needs to be overturned.",yes," 1. The speaker thinks donations to political campaigns should identify the contributor.
2. The speaker believes that the Supreme Court case ""Citizens United"" was incorrectly resolved.
3. The speaker advocates for the overturn of the ""Citizens United"" case.",,," The speaker advocates for the overturn of the ""Citizens United"" case",,,,,, The speaker thinks donations to political campaigns should identify the contributor,,,,,," The speaker believes that the Supreme Court case ""Citizens United"" was incorrectly resolved",,False,False,True,False,False,False,False,False,True,False,False,False,False,False,True,False
21,48503,"""18:23""","I did just look it up. It looks like Seattle actually uses has democracy vouchers. They provide this to provide residents with, for vouchers. Each worth $25, and you can pledge it to any candidate you want, want?",yes," 1. Seattle has a program called democracy vouchers.
2. The purpose of the program is to provide residents with vouchers to use in political campaigns.
3. Each voucher is worth $25.
4. Residents can pledge their vouchers to any candidate they choose.",,,,,,,,, Residents can pledge their vouchers to any candidate they choose,,,, Seattle has a program called democracy vouchers  The purpose of the program is to provide residents with vouchers to use in political campaigns, Each voucher is worth $25,,,False,False,False,False,False,False,False,False,True,False,False,False,True,True,False,False
22,48270,"""19:30""",California has a redistricting Commission.,no,,,,,,,,,,,,,,,,,,False,False,False,False,False,False,False,False,False,False,False,False,False,False,False,False
23,48270,"""19:30"""," Before the legislature used to, they did a horrible job of it because it was very self-serving, the Supreme Court looked at the let the map to redistricting ago and put other people in charge of it. And it came out really good and really well-thought-out that we went to an independent commission and a question word independent because a lot of the people who have to go through the legislature to be appointed",yes," 1. The legislature used to do a poor job of redistricting, which was self-serving.
2. The Supreme Court intervened and put other people in charge of redistricting, resulting in a better and well-thought-out map.
3. The state moved to an independent commission for redistricting.
4. The term ""independent"" is questioned because the people appointed to the commission still have to go through the legislature.",,,,," The legislature used to do a poor job of redistricting, which was self-serving  The Supreme Court intervened and put other people in charge of redistricting, resulting in a better and well-thought-out map  The state moved to an independent commission for redistricting",,,,,,,,,," The term ""independent"" is questioned because the people appointed to the commission still have to go through the legislature",,False,False,False,False,True,False,False,False,False,False,False,False,False,False,True,False
24,48368,"""20:07""","North Carolina. Now has a I live in North Carolina, we have now a case pending before The Supreme Court that it will basically remove any authority of a state supreme court to make any rulings about Congressional or any kind of voting districts in a state leaving it completely up to the legislature. And right now we have a veto-proof",no,,,,,,,,,,,,,,,,,,False,False,False,False,False,False,False,False,False,False,False,False,False,False,False,False
25,48368,"""20:07"""," Proof majority because North Carolina has been gerrymandered to have very, very little representation from Democrats and Republicans now control everything except the governorship right now. But",yes," 1. North Carolina has been gerrymandered, resulting in very little representation for Democrats.
2. Republicans currently control everything in the state government except for the governorship.",,,,," North Carolina has been gerrymandered, resulting in very little representation for Democrats",,,,,,,,,,, Republicans currently control everything in the state government except for the governorship,False,False,False,False,True,False,False,False,False,False,False,False,False,False,False,True
26,48402,"""20:55""","well, the problem with jury men is that if you look at some of the state's the way they have arbitrarily drawn, it the districts are not contiguous their pieces scattered all over the place, which doesn't really",no,,,,,,,,,,,,,,,,,,False,False,False,False,False,False,False,False,False,False,False,False,False,False,False,False
27,48402,"""20:55"""," Do a job of doing a representation of a district. It represents some geographical thing that really doesn't represent anything it that that in my opinion, that should be against the law.",yes," 1. The job is to represent a district.
2. This representation refers to a geographical area.
3. The speaker believes that this kind of representation is meaningless.
4. The speaker thinks that it should be illegal.",,,,,,,,,,,,,,,, The job is to represent a district  This representation refers to a geographical area  The speaker believes that this kind of representation is meaningless  The speaker thinks that it should be illegal,False,False,False,False,False,False,False,False,False,False,False,False,False,False,False,True
28,48368,"""21:37""","I'm not sure that a national law is is anything that could be agreed to in Congress or passed at any level. I mean, States can't even, can't even do anything to get something a nonpartisan commission passed.",yes," 1. The creation of a national law is a complex process.
2. Such a law would need to be agreed upon in Congress.
3. Even at the state level, passing nonpartisan commission proposals can be challenging.
4. Therefore, creating a national law is likely to be difficult.",,,,," Even at the state level, passing nonpartisan commission proposals can be challenging",,,,,,,,,,," The creation of a national law is a complex process  Such a law would need to be agreed upon in Congress  Therefore, creating a national law is likely to be difficult",False,False,False,False,True,False,False,False,False,False,False,False,False,False,False,True
29,48402,"""21:58""","Well, the problem is you're dealing with state rights versus Federal rights and this Republic was established on a state rights principle and so anything that you're trying to do the controls or minimizes, the states rights is going to be highly resistant in Congress.",no,,,,,,,,,,,,,,,,,,False,False,False,False,False,False,False,False,False,False,False,False,False,False,False,False
30,48274,"""22:22""","Um, yesterday we heard about proportional representation vs. First-past-the-post, I wonder if proportional representation would alleviate some of the problems of gerrymandering",no,,,,,,,,,,,,,,,,,,False,False,False,False,False,False,False,False,False,False,False,False,False,False,False,False
31,48356,"""22:45""","I think because our population has become so much larger than it was years ago, that Congressional District boundaries should definitely be checked into. And that would certainly make the House of Representatives a lot larger.",yes," 1. The population has become larger than in the past.
2. Congressional District boundaries should be checked due to this.
3. This would result in a larger House of Representatives.",,,,, Congressional District boundaries should be checked due to this,,,,,,,,,,, The population has become larger than in the past  This would result in a larger House of Representatives,False,False,False,False,True,False,False,False,False,False,False,False,False,False,False,True
32,48368,"""23:08""","Yeah, I agree with Peggy, you know, long ago, it was the number in the house was fixed at what 425 435 something like that. And now each each person representing people in the house is representing. I think in some places, millions of people, and that's not what the founders intended at all. So,",no,,,,,,,,,,,,,,,,,,False,False,False,False,False,False,False,False,False,False,False,False,False,False,False,False
33,48368,"""23:08""", but that that's away from redistricting and gerrymandering.,no,,,,,,,,,,,,,,,,,,False,False,False,False,False,False,False,False,False,False,False,False,False,False,False,False
34,48402,"""23:43""","But in reality, don't the old tie in together because gerrymandering forces people to try to accommodate. I happen to believe that the limit on the House of Representatives should be revoked. And, for example, in some states, one representative represents a hundred and twenty thousand people. Now, I can go to California and I think there are people that represent numbers of there that are million.",yes," 1. Gerrymandering forces people to accommodate to the old system.
2. The limit on the House of Representatives should be revoked.
3. In some states, one representative represents around 120,000 people.
4. In contrast, in California, some representatives may represent numbers of people in the millions.",,,,,, Gerrymandering forces people to accommodate to the old system,,,,,,,,," In contrast, in California, some representatives may represent numbers of people in the millions"," The limit on the House of Representatives should be revoked  In some states, one representative represents around 120,000 people",False,False,False,False,False,True,False,False,False,False,False,False,False,False,True,True
35,48402,"""23:43""", The two hundred thousand million two hundred thousand people that's totally different than Montana Wyoming North Dakota or any of the Central States.,no,,,,,,,,,,,,,,,,,,False,False,False,False,False,False,False,False,False,False,False,False,False,False,False,False
36,48274,"""24:32""","So, maybe the question should be how can we improve representation?",yes," 1. The text discusses the importance of representation in various contexts.
2. It suggests that representation can be improved in different ways.
3. However, the text does not provide specific methods for achieving this improvement.
4. Therefore, the main argument of the text is that representation should be improved, but it does not provide a clear answer to how this can be done.",,,,,,,,,,,,,,," It suggests that representation can be improved in different ways  However, the text does not provide specific methods for achieving this improvement  Therefore, the main argument of the text is that representation should be improved, but it does not provide a clear answer to how this can be done", The text discusses the importance of representation in various contexts,False,False,False,False,False,False,False,False,False,False,False,False,False,False,True,True
37,48274,"""24:32""", In other ways other than just redistricting.,no,,,,,,,,,,,,,,,,,,False,False,False,False,False,False,False,False,False,False,False,False,False,False,False,False
38,48368,"""25:45""","My first thought is the last thing we need in this country is making more things illegal. So yes, we can pressure, our friends, and relatives and acquaintances, Etc, to get out and vote, but finding people for that for not voting, I think is an absurd and an absurd proposition, there are enough things already in this country that are illegal illegal. We don't",no,,,,,,,,,,,,,,,,,,False,False,False,False,False,False,False,False,False,False,False,False,False,False,False,False
39,48356,"""26:20""","I'm not sure we need another national holiday federal holiday, but I think having election day off, it's a good idea, because some people have trouble getting to the polls because of their job.",yes," 1. The text discusses the idea of having another national holiday/federal holiday.
2. The author thinks having election day off is a good idea.
3. The reason for this suggestion is that some people have difficulty getting to the polls because of their job.",,,,,,,,,,,,,,,, The text discusses the idea of having another national holiday/federal holiday  The author thinks having election day off is a good idea  The reason for this suggestion is that some people have difficulty getting to the polls because of their job,False,False,False,False,False,False,False,False,False,False,False,False,False,False,False,True
40,48402,"""26:36""",,no,,,,,,,,,,,,,,,,,,False,False,False,False,False,False,False,False,False,False,False,False,False,False,False,False
41,48402,"""26:36""","Sadly, it one time.",no,,,,,,,,,,,,,,,,,,False,False,False,False,False,False,False,False,False,False,False,False,False,False,False,False
42,48402,"""26:36""","Businesses were required to give the people up 24 hours a day, off to go vote in an election for say, I don't know where that is anymore, but it doesn't appear that, that is still a practice.",no,,,,,,,,,,,,,,,,,,False,False,False,False,False,False,False,False,False,False,False,False,False,False,False,False
43,48368,"""26:56""","I wish we can make election day on the weekend or make election day two days on the weekend, Saturday and Sunday. And I think that would saw, I know people still work on Saturday and Sunday, but most people have at least one of those days off, but the vast majority of workers in this country do not have Tuesday off.",no,,,,,,,,,,,,,,,,,,False,False,False,False,False,False,False,False,False,False,False,False,False,False,False,False
