Order,Speaker,Time,Text,Has Arguments,All Arguments Summarized,FOR: limitCampaignContributions,AGAINST: limitCampaignContributions,FOR: closeForeignLoopholes,AGAINST: closeForeignLoopholes,FOR: establishRedistrictingCommissions,AGAINST: establishRedistrictingCommissions,FOR: implementProportionalRepresentation,AGAINST: implementProportionalRepresentation,FOR: encourageTransparency,AGAINST: encourageTransparency,FOR: promoteCivicEducation,AGAINST: promoteCivicEducation,FOR: explorePublicFunding,AGAINST: explorePublicFunding,other,notRelevant,FOR: limitCampaignContributions (bool),AGAINST: limitCampaignContributions (bool),FOR: closeForeignLoopholes (bool),AGAINST: closeForeignLoopholes (bool),FOR: establishRedistrictingCommissions (bool),AGAINST: establishRedistrictingCommissions (bool),FOR: implementProportionalRepresentation (bool),AGAINST: implementProportionalRepresentation (bool),FOR: encourageTransparency (bool),AGAINST: encourageTransparency (bool),FOR: promoteCivicEducation (bool),AGAINST: promoteCivicEducation (bool),FOR: explorePublicFunding (bool),AGAINST: explorePublicFunding (bool),other (bool),notRelevant (bool)
1,10512,"""9:59""","I'm not opposed to raising the individual limits on contributions except for the packs. I think they're problematic and I don't know what the answer to that is most people. I know don't have a lot of money to donate to campaigns anyway, but I don't know. This is just such a sticky issue.",yes," 1. The speaker is open to increasing the individual limits on campaign contributions, with the exception of ""packs.""
2. The speaker considers ""packs"" to be problematic, but does not offer a solution to this issue.
3. The speaker acknowledges that many people do not have much money to donate to campaigns.
4. The speaker finds the issue of campaign contribution limits to be complex and difficult to solve."," The speaker is open to increasing the individual limits on campaign contributions, with the exception of ""packs",,,,,,,,,, The speaker acknowledges that many people do not have much money to donate to campaigns,,,,,""" The speaker considers ""packs"" to be problematic, but does not offer a solution to this issue  The speaker finds the issue of campaign contribution limits to be complex and difficult to solve",True,False,False,False,False,False,False,False,False,False,True,False,False,False,False,True
2,48333,"""10:25""",Yeah. I mean the limits need to be there. I don't know if they need to be that low. So maybe raise them a little bit. The Constitutional limit definitely is desperately needed. We've got to get citizens united out of here or we're dead. That was the decision that basically said corporations are people and they can spend as much money as they want you to buy elections.,no,,,,,,,,,,,,,,,,,,False,False,False,False,False,False,False,False,False,False,False,False,False,False,False,False
3,48333,"""10:25"""," And the foreign-controlled. Yeah, that's got to go. So those are all good. We said the limits were, they should be is debatable, but I think they do need to be there. So",no,,,,,,,,,,,,,,,,,,False,False,False,False,False,False,False,False,False,False,False,False,False,False,False,False
4,48524,"""11:02""","Yeah, I agree with James on this. I think the foreign money is a huge problem in that can be some secret of the way through super Pacs and citizens. United is just a nightmare and a mistake. And when most people like me and maybe many of you from having any kind of influence at all and I don't have a problem. Raising raising individual donation limits, they seem somewhat arbitrary, but I'm sure they're not. Whether something could be easily investigate.",yes," 1. The person agrees with James regarding the issue of foreign money in politics through super PACs and citizens united.
2. They believe that the current system is a ""nightmare and a mistake.""
3. The person thinks that most people, including themselves, should not have any influence on politics.
4. They do not have a problem with raising individual donation limits, although they seem arbitrary.
5. The person suggests that these limits could be easily investigated.", The person suggests that these limits could be easily investigated,, The person agrees with James regarding the issue of foreign money in politics through super PACs and citizens united,,,,,,,,,,,,," They believe that the current system is a ""nightmare and a mistake "" The person thinks that most people, including themselves, should not have any influence on politics  They do not have a problem with raising individual donation limits, although they seem arbitrary",True,False,True,False,False,False,False,False,False,False,False,False,False,False,False,True
5,9738,"""11:31""","I think I agree with the others that we could raise the limits on the individual. So inflation is made money by less and definitely, we should strengthen up them, keep foreign entities from interfering with our elections.",yes," 1. It is suggested to raise the limits on individuals.
2. Inflation can be reduced by making money less available.
3. There is agreement about the need to strengthen limits.
4. Foreign entities should be prevented from interfering with elections.",, It is suggested to raise the limits on individuals, Foreign entities should be prevented from interfering with elections,,,,,,,,,,,,, Inflation can be reduced by making money less available  There is agreement about the need to strengthen limits,False,True,True,False,False,False,False,False,False,False,False,False,False,False,False,True
6,48502,"""11:48""","Yes, I feel the same way as everybody else. Get rid of the citizens united and also close those loopholes on foreign and increase the amount that individuals can contribute.",no,,,,,,,,,,,,,,,,,,False,False,False,False,False,False,False,False,False,False,False,False,False,False,False,False
7,9788,"""12:02""",Knows if they're going to increase it. Don't just increase it once but make it that it continues to be increased by the CPI annually. So it keeps up with inflation.,yes," 1. It is known if they plan to increase it.
2. The increase is not just once, but it should continue to be increased annually.
3. The annual increase is in accordance with the Consumer Price Index (CPI).
4. This is done to keep up with inflation.",,,,,,,,,,,,,,,," It is known if they plan to increase it  The increase is not just once, but it should continue to be increased annually  The annual increase is in accordance with the Consumer Price Index (CPI)  This is done to keep up with inflation",False,False,False,False,False,False,False,False,False,False,False,False,False,False,False,True
8,48313,"""12:11""","I would only support raising the limit on individual contributions as a mean of opposing corporations from, you know, donating unopposed or in much greater quantities. But I would prefer to see public financing. Like, we have here as opposed to individuals having to having to fund parties and candidates themselves which allows richer areas to outsize idli influence elections,",yes," 1. The text discusses the idea of raising the limit on individual contributions to political campaigns.
2. The author supports this idea as a way to counteract corporations donating large amounts of money to campaigns.
3. The author prefers public financing of political campaigns.
4. The author believes that current system allows richer areas to have a greater influence on elections, as individuals in these areas are more able to fund parties and candidates."," The author supports this idea as a way to counteract corporations donating large amounts of money to campaigns  The author believes that current system allows richer areas to have a greater influence on elections, as individuals in these areas are more able to fund parties and candidates", The text discusses the idea of raising the limit on individual contributions to political campaigns,,,,,,,,,,, The author prefers public financing of political campaigns,,,,True,True,False,False,False,False,False,False,False,False,False,False,True,False,False,False
9,48313,"""12:11""", Ins.,no,,,,,,,,,,,,,,,,,,False,False,False,False,False,False,False,False,False,False,False,False,False,False,False,False
10,48524,"""12:47""","Yeah, I don't have a problem with investigations and Public Funding of Elections and seems to make sense. As one of the most important things we do, and we do individually and do as a country. So I think the idea of seeing how public money can go towards, it is a good idea.",no,,,,,,,,,,,,,,,,,,False,False,False,False,False,False,False,False,False,False,False,False,False,False,False,False
11,10512,"""14:57""","I'm not a big fan of public financing for individual candidates. I think that's problematic because you're, you don't have as much control over where your support financial support is going. I'm up to debate on it on that. I do think we should raise the minimum level of the contributions that are reported. I don't know. It just seems like a privacy issue.",yes," 1. Opposes public financing for individual candidates.
2. Believes it's problematic because of lack of control over financial support.
3. Open to debate on public financing for individual candidates.
4. Thinks the minimum level of reported contributions should be raised.
5. Considers it a privacy issue.", Believes it's problematic because of lack of control over financial support,,,,,,,,,,,, Open to debate on public financing for individual candidates, Opposes public financing for individual candidates, Thinks the minimum level of reported contributions should be raised, Considers it a privacy issue,True,False,False,False,False,False,False,False,False,False,False,False,True,True,True,True
12,10512,"""14:57"""," Sometimes that information gets weaponized one way or another. Oh, you gave such and such this much amount of money and you know, blah, blah blah. And I think that doesn't need to be raised.",no,,,,,,,,,,,,,,,,,,False,False,False,False,False,False,False,False,False,False,False,False,False,False,False,False
13,48333,"""15:40""","I mean the public financing I think there's ways that that can be directed. The Democracy vouchers would be an idea that the voices raised problem with it. You target where your money is going. So, that's one way around. I did, I do think public financing of Elections is a good idea, especially if we're wanting to eliminate the the corruption that's there. Now, I do like any requirement for disclosure.",no,,,,,,,,,,,,,,,,,,False,False,False,False,False,False,False,False,False,False,False,False,False,False,False,False
14,48333,"""15:40"""," I mean, any at any level? I think, if you're, if you're supporting something, you're afraid to have your name on, maybe you should not be supporting it. That's my thoughts.",no,,,,,,,,,,,,,,,,,,False,False,False,False,False,False,False,False,False,False,False,False,False,False,False,False
15,9738,"""16:19""","With a situation. So I'll just local elections, you know things down, just two referendums on bond elections were lots of money and talking about hundreds of thousands are put in by out-of-state donors that had Behind these organizations that don't have to have any disclosure. So, nobody knows for sure who's trying to influence the election of whether it's somebody that's involved in gaining from it or not.",yes," 1. The text is about local elections, specifically two referendums on bond elections.
2. Large amounts of money were involved in these elections, with hundreds of thousands of dollars put in by out-of-state donors.
3. The organizations behind these donations do not have to disclose their funding sources, making it unclear who is trying to influence the election.
4. It is unknown whether the donors have anything to gain from the outcome of the election.",,," Large amounts of money were involved in these elections, with hundreds of thousands of dollars put in by out-of-state donors",,,,,," The organizations behind these donations do not have to disclose their funding sources, making it unclear who is trying to influence the election",,,,,,," The text is about local elections, specifically two referendums on bond elections  It is unknown whether the donors have anything to gain from the outcome of the election",False,False,True,False,False,False,False,False,True,False,False,False,False,False,False,True
16,48313,"""16:46""","I think any level of organization donation should be disclosed because if you're, if you're afraid for that disclosure, you know, you shouldn't be afraid if you have nothing to hide. But for individuals, I do think that there should be a higher limit. And I think that should exist primarily to protect political minorities. You know, Democrats and Republican areas and vice versa people that might receive backlash from donating to one party from family and friends on the opposite side.",yes," 1. Donations of any level of organization should be disclosed.
2. Disclosure is necessary to maintain transparency and trust.
3. There should be a higher limit for individual donations.
4. The higher limit is to protect political minorities.
5. This protection is important in both Democratic and Republican areas.
6. Donors might face backlash from family and friends on the opposite side.",, There should be a higher limit for individual donations,,,,,,, Donations of any level of organization should be disclosed  Disclosure is necessary to maintain transparency and trust,,,,,, The higher limit is to protect political minorities  Donors might face backlash from family and friends on the opposite side, This protection is important in both Democratic and Republican areas,False,True,False,False,False,False,False,False,True,False,False,False,False,False,True,True
17,48524,"""17:15""","Yeah, I think public disclosure for all people that almost any level is a good idea. Understand there's can be potential backlash and it's going to be coming from those people who investigate need to find out, who's been giving to water, and what my neighbor is doing. And there's some problems there, but I think disclosures a good idea across the board.",yes," 1. Public disclosure of almost any level is a good idea.
2. There could be potential backlash from people who investigate water donations and neighbors' activities.
3. Disclosure may cause issues for those who value privacy.
4. Despite potential problems, disclosure is generally considered a good idea.",,,,,,,,," Public disclosure of almost any level is a good idea  Despite potential problems, disclosure is generally considered a good idea",,,,,, There could be potential backlash from people who investigate water donations and neighbors' activities  Disclosure may cause issues for those who value privacy,,False,False,False,False,False,False,False,False,True,False,False,False,False,False,True,False
18,9788,"""17:35""",,no,,,,,,,,,,,,,,,,,,False,False,False,False,False,False,False,False,False,False,False,False,False,False,False,False
19,9788,"""17:35""",I have some concerned with creating another department and bureaucracy that back and distribute all the Public Funding for,yes," 1. Concern about creating an additional department and bureaucracy
2. The new department would be responsible for distributing public funding
3. This may lead to increased complexity in the system
4. It is important to consider the effectiveness and efficiency of the proposed department
5. Concerns about the potential misuse or mismanagement of public funds
6. The need to ensure transparency and accountability in the use of public funds
7. The impact on the current budget and potential strain on resources
8. The need to weigh the benefits against the potential drawbacks before making a decision.",,,,,,,,,,,,,, Concern about creating an additional department and bureaucracy The new department would be responsible for distributing public funding This may lead to increased complexity in the system It is important to consider the effectiveness and efficiency of the proposed department Concerns about the potential misuse or mismanagement of public funds The need to ensure transparency and accountability in the use of public funds The impact on the current budget and potential strain on resources The need to weigh the benefits against the potential drawbacks before making a decision,,,False,False,False,False,False,False,False,False,False,False,False,False,False,True,False,False
20,9788,"""17:35""", The campaign don't think that's needed.,yes," 1. The campaign has expressed that they do not think a certain action is necessary.

",,,,,,,,,,,,,,,, The campaign has expressed that they do not think a certain action is necessary   ,False,False,False,False,False,False,False,False,False,False,False,False,False,False,False,True
21,10512,"""17:49""","Yeah, I'm going to Stand My Ground on the Privacy issue. It's not a matter of hiding things are being ashamed. It's just you know sometimes we weren't privacy about what we are doing with our money. I mean, it's not really your right to know who I support, you know, our folks are private and they're supposed to be. But I mean that's just, I guess one of my little Stickley issues",yes," 1. The speaker is determined to maintain their position on the issue of privacy.
2. They do not view their stance as being about hiding or being ashamed of something.
3. The speaker believes that privacy is important when it comes to how they use their money.
4. They do not think that others have a right to know who they choose to support financially.
5. The speaker considers privacy to be a matter of principle for them.",,,,,,,,,,,,,,,, The speaker is determined to maintain their position on the issue of privacy  They do not view their stance as being about hiding or being ashamed of something  The speaker believes that privacy is important when it comes to how they use their money  They do not think that others have a right to know who they choose to support financially  The speaker considers privacy to be a matter of principle for them,False,False,False,False,False,False,False,False,False,False,False,False,False,False,False,True
22,48502,"""18:14""","Yeah, I don't like the idea of Public Funding, for any of this stuff. I just, it's just another gravity in our pockets. And I just don't think that's a good idea and but I do to save Full disclosures for everything. I mean, come on. What do you got to hide? So your neighbor doesn't like you big deal. So your family member gets mad at you big deal, just, you know me,",no,,,,,,,,,,,,,,,,,,False,False,False,False,False,False,False,False,False,False,False,False,False,False,False,False
23,48502,"""18:14"""," It's your money. So, but full disclosure I think is a good idea.",no,,,,,,,,,,,,,,,,,,False,False,False,False,False,False,False,False,False,False,False,False,False,False,False,False
24,9738,"""19:36""","At least now, when we get the redistricting done by the legislature, we know who's doing it and what and if there's implications that it is not legal, then they can come back over them. There's no such thing as an independent commission, their appointed or elected by somebody. They've got political ties to somebody and if it's quote independent, then they don't even have to disclose who which side their own when they try to get on that Commission.",yes," 1. Redistricting is currently done by the legislature.
2. With the legislature responsible for redistricting, it is known who is doing it and there is accountability for any legal implications.
3. The creation of an ""independent"" commission for redistricting is not truly independent, as the members are appointed or elected by someone.
4. These appointees or elected officials will have political ties to someone.
5. If the commission is supposedly independent, there is no requirement for them to disclose their own political leanings.
6. This lack of transparency can be problematic when trying to ensure fair and unbiased redistricting.",,,,, This lack of transparency can be problematic when trying to ensure fair and unbiased redistricting," Redistricting is currently done by the legislature  With the legislature responsible for redistricting, it is known who is doing it and there is accountability for any legal implications  The creation of an ""independent"" commission for redistricting is not truly independent, as the members are appointed or elected by someone",,,," If the commission is supposedly independent, there is no requirement for them to disclose their own political leanings",,,,,, These appointees or elected officials will have political ties to someone,False,False,False,False,True,True,False,False,False,True,False,False,False,False,False,True
25,48524,"""20:05""","I think there is some commission to, to help with her to be good idea. At least it's having a conversation which, with whatever legislators in power at the time and we're maybe have that as a checks and balance against against. Just whoever happens to be in office. The time next time, the census comes around because some of this gerrymandered districts are just crazy and they're crazy on both sides. So something has to be done about it and perhaps our conversation between a group like that, an independent counsel, if you will and legislators.",yes," 1. There is a suggestion to have a commission to assist in ensuring the goodness of ideas.
2. This commission would facilitate conversations with legislators in power during its tenure.
3. These conversations would serve as a check and balance against whoever is in office at the time.
4. The need for this commission arises due to the existence of gerrymandered districts, which are present on both sides.
5. The commission would be formed with the intention of addressing this issue, especially as the census comes around.
6. The proposed commission can be thought of as an independent counsel that would work alongside legislators.",,,,," These conversations would serve as a check and balance against whoever is in office at the time  The need for this commission arises due to the existence of gerrymandered districts, which are present on both sides",,,,,,,,,," The commission would be formed with the intention of addressing this issue, especially as the census comes around", There is a suggestion to have a commission to assist in ensuring the goodness of ideas  This commission would facilitate conversations with legislators in power during its tenure  The proposed commission can be thought of as an independent counsel that would work alongside legislators,False,False,False,False,True,False,False,False,False,False,False,False,False,False,True,True
26,48524,"""20:05""", Self would like make the conversation public and get us involved.,no,,,,,,,,,,,,,,,,,,False,False,False,False,False,False,False,False,False,False,False,False,False,False,False,False
27,9788,"""20:38""",I agree with Michael. I don't think there's any type of independent nonpartisan commission that can be formed. It's just a dream.,no,,,,,,,,,,,,,,,,,,False,False,False,False,False,False,False,False,False,False,False,False,False,False,False,False
28,48333,"""20:48""","I think there's room for a middle ground. I mean, honestly, it would take her. Any reasonably competent mathematician about 10 minutes to divide up the population areas and estate.",no,,,,,,,,,,,,,,,,,,False,False,False,False,False,False,False,False,False,False,False,False,False,False,False,False
29,48333,"""20:48"""," Fairly. So I think you could have some experts but I don't think they should be the deciders. I think they should be the experts. They should come up with a map submitted to the legislature legislature votes. Now the legislature is going to have to explain why they're voting it down, if they go down, but that way, you preserve public control that you also have some level of expertise and independents are just a thought.",no,,,,,,,,,,,,,,,,,,False,False,False,False,False,False,False,False,False,False,False,False,False,False,False,False
30,10512,"""21:23""","And hopefully, this would be done with the proportional representation that we were talking about yesterday. You know, that would sort of help with the Jeremy enduring and getting more equal districts,",yes," 1. The hope is for proportional representation.
2. This type of representation would assist in creating more equal districts.
3. It would help in the Jeremy enduring.",,,,, This type of representation would assist in creating more equal districts,, The hope is for proportional representation,,,,,,,,, It would help in the Jeremy enduring,False,False,False,False,True,False,True,False,False,False,False,False,False,False,False,True
31,48502,"""21:41""",,no,,,,,,,,,,,,,,,,,,False,False,False,False,False,False,False,False,False,False,False,False,False,False,False,False
32,48502,"""21:41""","I'm a little bit more of an optimist than some of the folks. I think you can be independent my whole career has been in the land, use planning area. And my job was to present different proposals to boards that would then vote on those things, I always thought I was pretty independent about it. I was never swayed one way or the other by any political people, but I do think that it has to be approved by a political body, and so that's it.",no,,,,,,,,,,,,,,,,,,False,False,False,False,False,False,False,False,False,False,False,False,False,False,False,False
33,48502,"""21:41""",,no,,,,,,,,,,,,,,,,,,False,False,False,False,False,False,False,False,False,False,False,False,False,False,False,False
