77,48502,"""42:33""","If you recall, I mentioned that I had been in a school board and you know, 16 year olds are great, love them. We're trying to educate them but you really don't want him sitting in public hearing.",yes," 1. The speaker had been in a school board.
2. Sixteen-year-olds are great and should be educated.
3. It is not appropriate for sixteen-year-olds to sit in public hearings.",,,,,,,,,,,,,,,, The speaker had been in a school board  Sixteen-year-olds are great and should be educated  It is not appropriate for sixteen-year-olds to sit in public hearings,False,False,False,False,False,False,False,False,False,False,False,False,False,False,False,True
78,48489,"""42:46""","Yeah, this is piggybacking on. Think it was James about, you know, the age thing. Then I think we ought to reconsider at what age. We put a gun in a person's hand in order to perform in the military.",yes," 1. The topic is related to a discussion involving James about the age requirement.
2. The discussion is about reconsidering the age at which a person is given a gun to serve in the military.",,,,,,,,,,,,,,,, The topic is related to a discussion involving James about the age requirement  The discussion is about reconsidering the age at which a person is given a gun to serve in the military,False,False,False,False,False,False,False,False,False,False,False,False,False,False,False,True
79,10512,"""43:01""","Yeah, I agree with Jacoby. That was a great idea, having, you know, non voting representation. That's why I like that idea a lot.",yes," 1. The speaker agrees with Jacoby.
2. The speaker thinks that having non-voting representation is a great idea.
3. The speaker expresses a lot of liking for the idea of non-voting representation.",,,,,,,,,,,,,,,, The speaker agrees with Jacoby  The speaker thinks that having non-voting representation is a great idea  The speaker expresses a lot of liking for the idea of non-voting representation,False,False,False,False,False,False,False,False,False,False,False,False,False,False,False,True
80,9788,"""43:10""",,no,,,,,,,,,,,,,,,,,,False,False,False,False,False,False,False,False,False,False,False,False,False,False,False,False
81,9788,"""43:10""","The other thing to keep in mind here is every 16 year old, it's going to have the guardian of some sort that they're involved with in their household that can represent them at the voting booth.",no,,,,,,,,,,,,,,,,,,False,False,False,False,False,False,False,False,False,False,False,False,False,False,False,False
82,48313,"""43:24""","Something else that just came to my mind is a potential flaw with a lot of six-year-olds to vote or high schoolers to vote in general. Is it seems like anyone that would be running to fill this role. They're just going to be, it's going to be so much lip service because they're going to be appealing to a more emotional state. And and so it seems like you might not be able to actually ascertain what a board member would actually be campaigning for.",yes," 1. A potential flaw with allowing six-year-olds or high schoolers to vote is that candidates may focus on emotional appeals rather than specific policies.
2. This is because young voters may be more susceptible to emotional messaging.
3. As a result, it may be difficult to determine what a board member is truly campaigning for, as their promises may be vague and not based on concrete plans.
4. Therefore, candidates may prioritize making emotional appeals over providing substantial policy proposals.",,,,,,,,," As a result, it may be difficult to determine what a board member is truly campaigning for, as their promises may be vague and not based on concrete plans",,, This is because young voters may be more susceptible to emotional messaging,,,," A potential flaw with allowing six-year-olds or high schoolers to vote is that candidates may focus on emotional appeals rather than specific policies  Therefore, candidates may prioritize making emotional appeals over providing substantial policy proposals",False,False,False,False,False,False,False,False,True,False,False,True,False,False,False,True
83,48524,"""44:05""",,no,,,,,,,,,,,,,,,,,,False,False,False,False,False,False,False,False,False,False,False,False,False,False,False,False
84,48524,"""44:05""","Some are some, aren't I guess it's not even all people are different. I should have been certain that some very young people who are very mature and some people at least my age who were ridiculous.",no,,,,,,,,,,,,,,,,,,False,False,False,False,False,False,False,False,False,False,False,False,False,False,False,False
85,48333,"""44:35""","I think there's a practical difficulty there because not all states. Do the driver's education system, the same. There are some places you can drive as young as twelve. So,",yes," 1. Not all states have the same driver's education system.
2. In some places, individuals can start driving as young as twelve.",,,,,,,,,,,,,,,," Not all states have the same driver's education system  In some places, individuals can start driving as young as twelve",False,False,False,False,False,False,False,False,False,False,False,False,False,False,False,True
86,48313,"""44:49""",It's a little bit off topic but I feel like a better question would be should sixteen-year-olds be driving freely on the road.,yes," 1. The text suggests that the question of college students having cars on campus may be less important than whether sixteen-year-olds should be allowed to drive freely on the road.
2. The author seems to imply that there may be safety concerns regarding sixteen-year-olds driving, as they may not have enough driving experience or maturity to handle the responsibility.
3. The text does not provide a definitive answer to the question, but leaves it open for discussion.",,,,,,,,,,,,,,,," The text suggests that the question of college students having cars on campus may be less important than whether sixteen-year-olds should be allowed to drive freely on the road  The author seems to imply that there may be safety concerns regarding sixteen-year-olds driving, as they may not have enough driving experience or maturity to handle the responsibility  The text does not provide a definitive answer to the question, but leaves it open for discussion",False,False,False,False,False,False,False,False,False,False,False,False,False,False,False,True
