Order,Speaker,Time,Text,Has Arguments,All Arguments Summarized,FOR: limitCampaignContributions,AGAINST: limitCampaignContributions,FOR: closeForeignLoopholes,AGAINST: closeForeignLoopholes,FOR: establishRedistrictingCommissions,AGAINST: establishRedistrictingCommissions,FOR: implementProportionalRepresentation,AGAINST: implementProportionalRepresentation,FOR: encourageTransparency,AGAINST: encourageTransparency,FOR: promoteCivicEducation,AGAINST: promoteCivicEducation,FOR: explorePublicFunding,AGAINST: explorePublicFunding,other,notRelevant,FOR: limitCampaignContributions (bool),AGAINST: limitCampaignContributions (bool),FOR: closeForeignLoopholes (bool),AGAINST: closeForeignLoopholes (bool),FOR: establishRedistrictingCommissions (bool),AGAINST: establishRedistrictingCommissions (bool),FOR: implementProportionalRepresentation (bool),AGAINST: implementProportionalRepresentation (bool),FOR: encourageTransparency (bool),AGAINST: encourageTransparency (bool),FOR: promoteCivicEducation (bool),AGAINST: promoteCivicEducation (bool),FOR: explorePublicFunding (bool),AGAINST: explorePublicFunding (bool),other (bool),notRelevant (bool)
1,48348,"""9:57""",Hello everybody.,no,,,,,,,,,,,,,,,,,,False,False,False,False,False,False,False,False,False,False,False,False,False,False,False,False
2,48443,"""9:59""",,no,,,,,,,,,,,,,,,,,,False,False,False,False,False,False,False,False,False,False,False,False,False,False,False,False
3,48443,"""9:59""",I don't think they should put. Leave the regulation on how much money he had to give to the political party. They think you should be open and he shouldn't be like a sir.,yes," 1. It is not recommended to regulate the amount of money an individual has to donate to a political party.
2. The speaker believes in open regulation.
3. The individual in question should not be treated like a ""sir"" in this context.
4. The speaker thinks there should be transparency in the regulation.",, It is not recommended to regulate the amount of money an individual has to donate to a political party,,,,,,, The speaker thinks there should be transparency in the regulation,,,,,, The speaker believes in open regulation," The individual in question should not be treated like a ""sir"" in this context",False,True,False,False,False,False,False,False,True,False,False,False,False,False,True,True
4,48443,"""9:59""",,no,,,,,,,,,,,,,,,,,,False,False,False,False,False,False,False,False,False,False,False,False,False,False,False,False
5,48443,"""9:59""",,no,,,,,,,,,,,,,,,,,,False,False,False,False,False,False,False,False,False,False,False,False,False,False,False,False
6,48413,"""10:44""","I really disagree. I think that there's plenty of money in elections. Now, I mean from the amount of ads and things but we see leading up to elections even over a year out. I think that there's plenty of spending on elections, and I think that any increases in contributions especially with individual donors or with, you know, political action committees would",yes," 1. The speaker strongly disagrees with the idea that there is not enough money in elections.
2. They believe that there is already significant spending in elections, as evidenced by the numerous ads and other expenses that occur in the lead-up to elections, even more than a year in advance.
3. The speaker thinks that there is already plenty of money in elections.
4. They also believe that any increase in campaign contributions, particularly from individual donors or political action committees, would be unnecessary.",," They also believe that any increase in campaign contributions, particularly from individual donors or political action committees, would be unnecessary",,,,,,,,,,,,," They believe that there is already significant spending in elections, as evidenced by the numerous ads and other expenses that occur in the lead-up to elections, even more than a year in advance  The speaker thinks that there is already plenty of money in elections", The speaker strongly disagrees with the idea that there is not enough money in elections,False,True,False,False,False,False,False,False,False,False,False,False,False,False,True,True
7,48413,"""10:44""", Just increase the amount of maybe disinformation out there.,no,,,,,,,,,,,,,,,,,,False,False,False,False,False,False,False,False,False,False,False,False,False,False,False,False
8,48348,"""11:20""","I agree and it should be a cat in full disclosure, should be also made of public because a lot of these corporations do spend a lot of money on these candidates for their own personal gain and not for the, the US",yes," 1. The subject is in agreement that it should be disclosed if a cat is involved.
2. It is noted that this disclosure should be made publicly.
3. The text suggests that many corporations spend large amounts of money on candidates for their own benefit, rather than for the good of the US."," The text suggests that many corporations spend large amounts of money on candidates for their own benefit, rather than for the good of the US",,,,,,,, It is noted that this disclosure should be made publicly,,,,,,, The subject is in agreement that it should be disclosed if a cat is involved,True,False,False,False,False,False,False,False,True,False,False,False,False,False,False,True
9,48295,"""11:36""","Yeah, I struggle with this a little bit because I think the value of a contribution to an individual candidate, maybe how effective that is maybe up to question concerning the cause of airtime, the cross of advertisement, all of those things. But I think the bigger issue is the dark money of issue ads of attack ads that don't have that arm for a specific.",yes," 1. The effectiveness of a contribution to an individual candidate's campaign is questionable.
2. Factors that may affect the contribution's impact include the availability of airtime and cross-advertisement.
3. A more significant issue is the presence of ""dark money"" in politics.
4. Dark money refers to the funding of issue ads or attack ads that do not advocate for a specific candidate.",,,,,,,,,,,,,,," The effectiveness of a contribution to an individual candidate's campaign is questionable  Factors that may affect the contribution's impact include the availability of airtime and cross-advertisement  A more significant issue is the presence of ""dark money"" in politics  Dark money refers to the funding of issue ads or attack ads that do not advocate for a specific candidate",,False,False,False,False,False,False,False,False,False,False,False,False,False,False,True,False
10,48295,"""11:36"""," If a candidate but are for a specific position and I don't think any of these cover that. So even if the the contribution limits were to increase, decrease, whatever there are still those that I think are a big source of money.",yes," 1. The candidate is running for a specific position.
2. The contribution limits for the race could change.
3. The speaker believes that there are still significant sources of money in the race, regardless of changes to the contribution limits.
4. The speaker does not think that the current list of contribution sources covers all of the significant contributors.", The contribution limits for the race could change," The speaker believes that there are still significant sources of money in the race, regardless of changes to the contribution limits",,,,,,,,,,,,, The speaker does not think that the current list of contribution sources covers all of the significant contributors, The candidate is running for a specific position,True,True,False,False,False,False,False,False,False,False,False,False,False,False,True,True
11,48440,"""12:22""",,no,,,,,,,,,,,,,,,,,,False,False,False,False,False,False,False,False,False,False,False,False,False,False,False,False
12,48440,"""12:22""","I prefer to defer on this topic and not really speak. The only one part of the topic that I would like to discuss for me is keeping foreign money out of our ads and out of our political system. And that's the only one that I do agree. We should not allow everything else. I'm just going to listen and hey, we've got a new group. I'm new to this group or you guys are new to my old groupie.",no,,,,,,,,,,,,,,,,,,False,False,False,False,False,False,False,False,False,False,False,False,False,False,False,False
13,48440,"""12:22"""," Group, nice to see you.",no,,,,,,,,,,,,,,,,,,False,False,False,False,False,False,False,False,False,False,False,False,False,False,False,False
14,48576,"""12:55""","Bill and Mike, I agree with you, both for is the corporations, using it, for their personal gain, and real. Just like you said, as far as the for money, I feel like that should be included and to not be a part of what's going on as far as the presidential elections, or any of the elections for that. Ma'am.",no,,,,,,,,,,,,,,,,,,False,False,False,False,False,False,False,False,False,False,False,False,False,False,False,False
15,48511,"""13:23""","Yeah, so speaking about that before and control that in the points. Yeah, I agree that foreign entities should keep their hands off of our elections. The only con I see listed here is that you know people are saying that it solves the this this proposal would like help solve the symptom rather than the problem and the problem being disclosure and transparency. But I don't think those two things are mutually exclusive we should still close those loopholes regardless",yes," 1. It is important to prevent foreign entities from interfering in US elections.
2. A concern is that regulating foreign involvement may only address the symptom, not the underlying problem of disclosure and transparency.
3. However, addressing disclosure and transparency loopholes should still be pursued, regardless of foreign involvement regulations.",,, It is important to prevent foreign entities from interfering in US elections,,,,,," A concern is that regulating foreign involvement may only address the symptom, not the underlying problem of disclosure and transparency  However, addressing disclosure and transparency loopholes should still be pursued, regardless of foreign involvement regulations",,,,,,,,False,False,True,False,False,False,False,False,True,False,False,False,False,False,False,False
16,48295,"""13:52""","Yeah, I totally agree with that, Jordan, and I wanted to touch or talk very briefly about this fourth proposal about Citizens United and reversing that decision. And I think it's interesting and I understand the performance being talked of discussion about freedom of speech. And I think something that has been came up in one of the plenary sessions yesterday's that difference between freedom of speech versus freedom of",no,,,,,,,,,,,,,,,,,,False,False,False,False,False,False,False,False,False,False,False,False,False,False,False,False
17,48295,"""13:52"""," reach. And I think really, that's what the money equates, his being able to buy the air time, being able to buy the ads and it's that reach that you shouldn't. I think a corporation can say whatever they want, but do they have the rights to broadcast it wherever they want?",no,,,,,,,,,,,,,,,,,,False,False,False,False,False,False,False,False,False,False,False,False,False,False,False,False
18,48413,"""14:37""","Yeah, I think if we raise the limits on campaign contributions and without that Constitutional Amendment you know the wealthy are going to continue to control politics to a huge degree and I think that that's a big problem.",yes," 1. The person thinks that raising campaign contribution limits is a good idea.
2. They believe that without a Constitutional Amendment, the wealthy will continue to have a lot of control in politics.
3. The person thinks that this is a big problem.",, The person thinks that raising campaign contribution limits is a good idea,,,,,,,,,,,,," They believe that without a Constitutional Amendment, the wealthy will continue to have a lot of control in politics", The person thinks that this is a big problem,False,True,False,False,False,False,False,False,False,False,False,False,False,False,True,True
19,48440,"""17:06""","On this one, I don't see the the way or the desire for me to increase public spending, but I do notice that on all my tax returns. There's contribute to political campaigns presidential campaigns, and I don't think that money should be mandated to me to be paid. And should be a choice, but I can",yes," 1. The writer does not advocate for an increase in public spending.
2. The writer has been contributing to political campaigns, including presidential campaigns, through their tax returns.
3. The writer believes that contributing to political campaigns should be a choice, not a mandatory payment.",," The writer believes that contributing to political campaigns should be a choice, not a mandatory payment",,,,,,,,,,,, The writer does not advocate for an increase in public spending,," The writer has been contributing to political campaigns, including presidential campaigns, through their tax returns",False,True,False,False,False,False,False,False,False,False,False,False,False,True,False,True
20,48440,"""17:06"""," C using that money in some manner shape or form, but I can't see how it can be used economically within any of the three proposals that want to increase spending.",yes," 1. The text discusses the use of a sum of money in the context of three proposals aimed at increasing spending.
2. The author is skeptical about the economic use of this money in any of the three proposals.
3. The money mentioned is not specified in amount or origin.
4. The three proposals that aim to increase spending are not described in detail.
5. The author's skepticism suggests that the money may not be used effectively or efficiently in the proposed spending increases.",,,,,,,,,,,,,,, The author is skeptical about the economic use of this money in any of the three proposals  The money mentioned is not specified in amount or origin, The text discusses the use of a sum of money in the context of three proposals aimed at increasing spending  The three proposals that aim to increase spending are not described in detail  The author's skepticism suggests that the money may not be used effectively or efficiently in the proposed spending increases,False,False,False,False,False,False,False,False,False,False,False,False,False,False,True,True
21,48413,"""17:49""","Yeah, I agree. I don't agree. I agree with Bill that I don't agree with public funds being used in elections. I think these democracy vouchers are kind of ridiculous, but I do support. A lot of the things that in the campaign finance, that would just offer more clarity to where money is coming from, who is donating it.",no,,,,,,,,,,,,,,,,,,False,False,False,False,False,False,False,False,False,False,False,False,False,False,False,False
22,48413,"""17:49"""," and because I think that voters should have that information about who is supporting, which messaging",yes," I am unable to summarize the text provided as there is no text given, only a partial sentence. Please provide the full text to be summarized.

However, I can provide an example of the output format for a numbered list summary:

1. Identify the main points in the text.
2. Condense each main point into a single sentence.
3. Number each condensed sentence.
4. Place each numbered sentence on a new line.",,,,,,,,,,,,,,,,"am unable to summarize the text provided as there is no text given, only a partial sentence  Please provide the full text to be summarized   ever, I can provide an example of the output format for a numbered list summary:  Identify the main points in the text  Condense each main point into a single sentence  Number each condensed sentence  Place each numbered sentence on a new line",False,False,False,False,False,False,False,False,False,False,False,False,False,False,False,True
23,48295,"""18:22""","So I think the public financing could work but only if there were also caps on how much money could be spent or limiting private contributions, I think doing or having public financing a large-scale public financing without some other controls just doesn't really add a tremendous amount of value but I believe in our materials there was a discussion. I think it was Seattle who had tried to democracy vouchers but there was a",no,,,,,,,,,,,,,,,,,,False,False,False,False,False,False,False,False,False,False,False,False,False,False,False,False
24,48295,"""18:22""","overall limit of 75 thousand dollars that could be spent on on The Campaign. Which I think I think I'd be the only way to make it, make it feasible.",no,,,,,,,,,,,,,,,,,,False,False,False,False,False,False,False,False,False,False,False,False,False,False,False,False
25,48511,"""19:02""","Okay, so regarding the topic of the Democracy, vouchers, I do understand the sentiment and the reasoning behind it and I appreciate it. You know, it the idea would be to give everyone a bit bit more donating power to, no matter, their financial background, but I feel like it's kind of ripe for some Bad actors because, like, some people might be like, oh, I don't really like and I'm not very politically aware, so I'm just going to sell my democracy vouchers. And then someone might be like",no,,,,,,,,,,,,,,,,,,False,False,False,False,False,False,False,False,False,False,False,False,False,False,False,False
26,48511,"""19:02"""," Oh yeah, I'll give you a hundred bucks for your democracy vouchers and they'll go spend it to whatever candidate they support, right?",yes," 1. The speaker is willing to pay the listener $100.
2. The payment is for the listener's democracy vouchers.
3. The democracy vouchers will be used to support a candidate of the recipient's choice.",,,,,,,,,,,,, The payment is for the listener's democracy vouchers,,, The speaker is willing to pay the listener $100  The democracy vouchers will be used to support a candidate of the recipient's choice,False,False,False,False,False,False,False,False,False,False,False,False,True,False,False,True
27,48295,"""19:42""","One thing I did want to touch on this, I agree. And I think we already talked about something about the disclosure of donors or contributors to packs and, and to political candidates one thing I do somewhat worried about is having these dollar thresholds and how many times, or how many different organizations can come in right underneath the dollar threshold. And I know, in the news recently, in the Jorge Santos, up in New York campaign, he had a number of",no,,,,,,,,,,,,,,,,,,False,False,False,False,False,False,False,False,False,False,False,False,False,False,False,False
28,48295,"""19:42""","Contributions $109.99 which comes in right under that $200 reporting threshold. So I just wonder, even if we put these in place, are we as going to see everybody? You know, a penny below the level?",no,,,,,,,,,,,,,,,,,,False,False,False,False,False,False,False,False,False,False,False,False,False,False,False,False
29,48440,"""20:29""","I don't think there's anything wrong with knowing who's contributing to who personally, I don't look it up if somebody were to want to know or if it's a somebody nefarious, it wants to know who I'm contributing to, then I might be wanting to hide myself, but I don't think it's it's anything. The most of the United States population is concerned about",no,,,,,,,,,,,,,,,,,,False,False,False,False,False,False,False,False,False,False,False,False,False,False,False,False
30,48440,"""20:29"""," their name being associated, with either a political party or political candidate, but I don't know that for",no,,,,,,,,,,,,,,,,,,False,False,False,False,False,False,False,False,False,False,False,False,False,False,False,False
31,48443,"""21:12""",,no,,,,,,,,,,,,,,,,,,False,False,False,False,False,False,False,False,False,False,False,False,False,False,False,False
32,48348,"""21:21""","Raina, we still can't.",no,,,,,,,,,,,,,,,,,,False,False,False,False,False,False,False,False,False,False,False,False,False,False,False,False
33,48440,"""21:33""","Yeah, reading are. You might want to hit the help button to get help to get your microphone.",no,,,,,,,,,,,,,,,,,,False,False,False,False,False,False,False,False,False,False,False,False,False,False,False,False
34,48440,"""22:25""","I think it all our plenary discussions, there is no such thing as an independent panel. So I think that's all just bogus bow.",no,,,,,,,,,,,,,,,,,,False,False,False,False,False,False,False,False,False,False,False,False,False,False,False,False
35,48413,"""22:40""","Yeah, I think this came up, when we were talking about the independent election, official in the states, where, like, what does nonpartisan really mean and how do you Shield them from political influence? But I definitely would support, you know, to some steps being taken towards taking this out of, you know, active politicians hands and making it more of a Municipal Employee Duty rather than an elected Duty.",no,,,,,,,,,,,,,,,,,,False,False,False,False,False,False,False,False,False,False,False,False,False,False,False,False
36,48295,"""23:11""","I agree that I would prefer an independent, the extent such thing can exist and I wonder if there's some way in now or the near future to be able to use Technologies to be able to automate the process, given a set of rules and guidelines or at least evaluate the and I know there have been state supreme court cases around the country that talk to the talk of. How do you how do you evaluate whether something is",no,,,,,,,,,,,,,,,,,,False,False,False,False,False,False,False,False,False,False,False,False,False,False,False,False
37,48295,"""23:11""", Gerrymandered or not. And I think that is something that we could automate and create some sort of tool to be able to say you have to pass this test or even have a tool that draws it for us.,no,,,,,,,,,,,,,,,,,,False,False,False,False,False,False,False,False,False,False,False,False,False,False,False,False
38,48440,"""23:52""","Calling, I think you're talking almost of the AI aspect of that and I don't think that AI is in it state where we can do something like that, but I do agree that I don't enjoy going through gerrymandering. Redistricting it happens all over the country, they try to get political groups from certain areas because certain areas vote one.",no,,,,,,,,,,,,,,,,,,False,False,False,False,False,False,False,False,False,False,False,False,False,False,False,False
39,48440,"""23:52"""," Way more than another way. And that's well known fact. So, yeah, I wish we could do away with gerrymandering in some manner shape or form but I don't know how it can.",yes," 1. Gerrymandering is a well-known fact.
2. It is unclear how to eliminate gerrymandering.",,,,,,,,,,,,,,, It is unclear how to eliminate gerrymandering, Gerrymandering is a well-known fact,False,False,False,False,False,False,False,False,False,False,False,False,False,False,True,True
40,48511,"""24:36""","Yes, I do appreciate that. Colin brought up the whole using technology to kind of maybe circumvent this issue. But I do agree with build at like, you know, as not if Colin was talk about AI, that it's not in the state that like it should be used for that. But if it ever gets to that point it might be useful because AI kid potentially be like independent but you know, I think older Generations might have a problem with that. If, you know, if it does get to that point because older Generations might not necessarily understand the technology behind",no,,,,,,,,,,,,,,,,,,False,False,False,False,False,False,False,False,False,False,False,False,False,False,False,False
41,48511,"""24:36""", Find it and they won't be able to support it and they won't feel as comfortable with it.,no,,,,,,,,,,,,,,,,,,False,False,False,False,False,False,False,False,False,False,False,False,False,False,False,False
42,48295,"""25:11""","Yeah, I totally agree and I think one thing with AI in terms of using it is whoever writes the rules then gets to control how that program works. But I do think that there could be opportunities for the evaluation of this strikes of you know they're supposed to be Compact and have a similar number of people and I think that's where a lot of them. Go rise or not compact at all, they're all over the place. And so I think, you know is there what formula could be",no,,,,,,,,,,,,,,,,,,False,False,False,False,False,False,False,False,False,False,False,False,False,False,False,False
43,48295,"""25:11"""," It together to evaluate that and then avoid whoever draws it to get evaluated the same way, because ultimately what the courts are supposed to be doing as it is.",no,,,,,,,,,,,,,,,,,,False,False,False,False,False,False,False,False,False,False,False,False,False,False,False,False
44,48576,"""25:52""","With a, I I don't think that would be a good situation. Because the person who writes the South where Ford, how do we truly know that they're independent? So, I don't think that would be a good idea.",yes," 1. The speaker expresses concern about a situation involving a person writing about the South, where Ford is located.
2. The speaker questions the independence of the person writing, implying that they may not be objective or unbiased.
3. The speaker does not think it is a good idea for this person to write about the South and Ford.",,,,,,,,,,,,,,,," The speaker expresses concern about a situation involving a person writing about the South, where Ford is located  The speaker questions the independence of the person writing, implying that they may not be objective or unbiased  The speaker does not think it is a good idea for this person to write about the South and Ford",False,False,False,False,False,False,False,False,False,False,False,False,False,False,False,True
