Order,Speaker,Time,Text,Has Arguments,All Arguments Summarized,FOR: limitCampaignContributions,AGAINST: limitCampaignContributions,FOR: closeForeignLoopholes,AGAINST: closeForeignLoopholes,FOR: establishRedistrictingCommissions,AGAINST: establishRedistrictingCommissions,FOR: implementProportionalRepresentation,AGAINST: implementProportionalRepresentation,FOR: encourageTransparency,AGAINST: encourageTransparency,FOR: promoteCivicEducation,AGAINST: promoteCivicEducation,FOR: explorePublicFunding,AGAINST: explorePublicFunding,other,notRelevant,FOR: limitCampaignContributions (bool),AGAINST: limitCampaignContributions (bool),FOR: closeForeignLoopholes (bool),AGAINST: closeForeignLoopholes (bool),FOR: establishRedistrictingCommissions (bool),AGAINST: establishRedistrictingCommissions (bool),FOR: implementProportionalRepresentation (bool),AGAINST: implementProportionalRepresentation (bool),FOR: encourageTransparency (bool),AGAINST: encourageTransparency (bool),FOR: promoteCivicEducation (bool),AGAINST: promoteCivicEducation (bool),FOR: explorePublicFunding (bool),AGAINST: explorePublicFunding (bool),other (bool),notRelevant (bool)
1,48346,"""9:52""",,no,,,,,,,,,,,,,,,,,,False,False,False,False,False,False,False,False,False,False,False,False,False,False,False,False
2,48346,"""9:52""","Hello. Welcome back. So I think this is probably one of the most important things that we'll talk about in this entire thing because our elections have been influenced by, you know, dark money. And the thing about citizens united that really, really freaks me out is that these major corporations can spend as much money as they want on our elections and we don't know who the shareholders are, we don't know who owns them.",yes," 1. The importance of discussing the influence of dark money in elections.
2. Elections have been influenced by dark money.
3. Concerns about the Citizens United ruling.
4. Major corporations can spend unlimited amounts of money on elections.
5. Lack of transparency regarding the identity of shareholders and owners of corporations.",,,,,,,,, Lack of transparency regarding the identity of shareholders and owners of corporations,,,,,, The importance of discussing the influence of dark money in elections  Elections have been influenced by dark money  Concerns about the Citizens United ruling  Major corporations can spend unlimited amounts of money on elections,,False,False,False,False,False,False,False,False,True,False,False,False,False,False,True,False
3,48346,"""9:52"""," So, they are influenced by Foreign entities and that loophole be really hard to close.",no,,,,,,,,,,,,,,,,,,False,False,False,False,False,False,False,False,False,False,False,False,False,False,False,False
4,48507,"""10:31""",,no,,,,,,,,,,,,,,,,,,False,False,False,False,False,False,False,False,False,False,False,False,False,False,False,False
5,48507,"""10:31""","Yes close that loophole on foreign entities and no do not raise donations. I don't care how much media cost them. If everybody spending the same amount, then they all get the same. A lot of time on Media or amount to spend on media and they can make better use of it, maybe.",yes," 1. Close the loophole on foreign entities' involvement in political campaigns.
2. Do not raise donations, regardless of the amount of media costs.
3. If all entities spend the same amount on media, they will receive equal exposure.
4. A lot of time or money spent on media can be used in other beneficial ways.
5. Media spending should be done judiciously for maximum benefit.",,, Close the loophole on foreign entities' involvement in political campaigns,,,,,," If all entities spend the same amount on media, they will receive equal exposure"," Do not raise donations, regardless of the amount of media costs",,,,, A lot of time or money spent on media can be used in other beneficial ways  Media spending should be done judiciously for maximum benefit,,False,False,True,False,False,False,False,False,True,True,False,False,False,False,True,False
6,48436,"""10:52""","Maybe one thing people are worried about the cost for commercials you have a, you Institute a flat rate of every, you know, politician X doesn't matter what party whoever's running pays, the same amount for a commercial, and they're always going to be shown say during new segments during prime time when they'll reach the most people.",yes," 1. People may be concerned about the cost of political commercials.
2. A proposed solution is to institute a flat rate for all commercials.
3. The rate would be the same for every politician, regardless of their party.
4. The commercials would always be shown during news segments in prime time.
5. This would ensure that the commercials reach the most people.",,,,," The rate would be the same for every politician, regardless of their party",,,, People may be concerned about the cost of political commercials  A proposed solution is to institute a flat rate for all commercials,,,,,,, The commercials would always be shown during news segments in prime time  This would ensure that the commercials reach the most people,False,False,False,False,True,False,False,False,True,False,False,False,False,False,False,True
7,48436,"""10:52"""," I wouldn't raise the amount, people can contribute because the more money you have, the more you contribute, the more your voice gets heard versus somebody else and you do need to close the loopholes to stop foreign governments, foreign Agents from contributing money to influence the elections.",yes," 1. The speaker does not recommend increasing the amount of money that people can contribute in elections.
2. They argue that larger contributions can give some people more influence over the election process than others.
3. The speaker believes that it is important to close loopholes that allow foreign governments or agents to contribute money and potentially influence elections.",, The speaker does not recommend increasing the amount of money that people can contribute in elections, The speaker believes that it is important to close loopholes that allow foreign governments or agents to contribute money and potentially influence elections,,,,,,,,,,,,, They argue that larger contributions can give some people more influence over the election process than others,False,True,True,False,False,False,False,False,False,False,False,False,False,False,False,True
8,10544,"""11:35""","Oh sorry, it looks like my camera's not on. I don't know why. Hopefully I would ever be near me. But yeah, I don't think that there should be influence from foreign entities at all. Actually, the interesting thing to me is that most people now use social media for everything. So a lot of people don't do a lot of the traditional sources. Like I'll see a ton of waste wasted money on Mike.",no,,,,,,,,,,,,,,,,,,False,False,False,False,False,False,False,False,False,False,False,False,False,False,False,False
9,10544,"""11:35"""," Like side of the road campaigning and I'm like, how many people just drive past that to know what I mean?",no,,,,,,,,,,,,,,,,,,False,False,False,False,False,False,False,False,False,False,False,False,False,False,False,False
10,48507,"""12:12""","Agree on that. For sure I'm jumping tracks to the compulsory part whether or not it should be compulsory. You know I don't I don't think so at all. I mean it's a right but I don't I think even a small fine for that and I get why it should. But there's got to be another way to attack that to increase the interest to increase the voter turnout in that group, that middle group, that may not be showing up.",no,,,,,,,,,,,,,,,,,,False,False,False,False,False,False,False,False,False,False,False,False,False,False,False,False
11,48433,"""12:42""","Yeah, I absolutely believe campaign daughter should be revealed just for transparency and close loopholes for other countries. I mean, that Russia funneled, 23 million through the NRA into the Trump Campaign, which is ridiculous. Other countries should have nothing to do with our elections.",yes," 1. The speaker believes that the campaign's funding should be revealed for transparency.
2. This is to close loopholes for other countries' interference in elections.
3. The speaker mentions Russia as an example, having funneled 23 million dollars through the NRA into the Trump campaign.
4. The speaker thinks that no country should have anything to do with domestic elections.",,," This is to close loopholes for other countries' interference in elections  The speaker mentions Russia as an example, having funneled 23 million dollars through the NRA into the Trump campaign", The speaker thinks that no country should have anything to do with domestic elections,,,,, The speaker believes that the campaign's funding should be revealed for transparency,,,,,,,,False,False,True,True,False,False,False,False,True,False,False,False,False,False,False,False
12,48346,"""13:02""",I think ultimately our best system is going to be a publicly-funded election which I know will increase the cost of electrical increase the amount we pay in taxes for that. I think the long-term benefit outweighs the short term cost.,no,,,,,,,,,,,,,,,,,,False,False,False,False,False,False,False,False,False,False,False,False,False,False,False,False
13,48436,"""13:20""","I would not want it publicly funded because then you'll get too many people who would have no chance of winning just because they wouldn't have the support they try and jump in. So you have to figure out some way to initially, weed out the people who shouldn't be running in the first place. And we all know the government can't live by a budget or set a budget and all they want to keep doing is taking our hard-earned money to throw away on other things.",yes," 1. The text argues against public funding of a certain entity or activity.
2. The author believes that public funding would result in unqualified individuals participating, who otherwise would not have a chance of winning.
3. The author suggests a need to ""weed out"" unqualified individuals from the process.
4. The author expresses skepticism about the government's ability to live within a budget and manage funds effectively.
5. The author believes that the government wastes taxpayer money on unnecessary things.",,,,,,,,,,,,,," The text argues against public funding of a certain entity or activity  The author believes that public funding would result in unqualified individuals participating, who otherwise would not have a chance of winning  The author expresses skepticism about the government's ability to live within a budget and manage funds effectively",," The author suggests a need to ""weed out"" unqualified individuals from the process  The author believes that the government wastes taxpayer money on unnecessary things",False,False,False,False,False,False,False,False,False,False,False,False,False,True,False,True
14,48436,"""13:20"""," Things and I really don't think they have the ability government in general. Has the ability to run that kind of system and any Fairway. And anyway, that would be cost effective and transparent.",yes," It seems like the text you provided is not well-formed and lacks clear arguments. However, I'll try to summarize it to the best of my ability:

1. The author doubts that ""things"" and the government have the ability to run a certain kind of system.
2. The author believes that any Fairway would not have the ability to run that kind of system either.
3. The author thinks that such a system would not be cost-effective.
4. The author suggests that a transparent system would be preferable.",,,,,,,,, The author suggests that a transparent system would be preferable,,,,, The author thinks that such a system would not be cost-effective,," seems like the text you provided is not well-formed and lacks clear arguments  However, I'll try to summarize it to the best of my ability:  The author doubts that ""things"" and the government have the ability to run a certain kind of system  The author believes that any Fairway would not have the ability to run that kind of system either",False,False,False,False,False,False,False,False,True,False,False,False,False,True,False,True
15,10544,"""15:54""",I would say I'm in favor of disclosure.,yes, 1. The speaker is in favor of disclosure.,,,,,,,,, The speaker is in favor of disclosure,,,,,,,,False,False,False,False,False,False,False,False,True,False,False,False,False,False,False,False
16,48346,"""15:58""","I think transparency is absolutely important right now. Our politicians spend a substantial amount of their time and day doing nothing but raising contributions so that they can run for office again. And that is another reason why a lot of our processes are gummed up. So I don't know if the answer is democracy, vouchers or matching small contributions, but I do know that the big huge donations that they get from",yes," 1. The importance of transparency is highlighted.
2. Politicians are reported to spend a significant amount of time raising contributions for re-election campaigns.
3. This contribution-raising behavior is mentioned as a reason for processes being ""gummed up"".
4. The text suggests possible solutions to address the issue of big donations, including democracy, vouchers, or matching small contributions.
5. The source of big donations is indicated to be from certain unnamed entities."," Politicians are reported to spend a significant amount of time raising contributions for re-election campaigns  This contribution-raising behavior is mentioned as a reason for processes being ""gummed up""",,,,,,,, The importance of transparency is highlighted,,,," The text suggests possible solutions to address the issue of big donations, including democracy, vouchers, or matching small contributions",, The source of big donations is indicated to be from certain unnamed entities,,True,False,False,False,False,False,False,False,True,False,False,False,True,False,True,False
17,48346,"""15:58"""," You know these private entities, we need to know who's giving to those entities. It should be completely transparent.",no,,,,,,,,,,,,,,,,,,False,False,False,False,False,False,False,False,False,False,False,False,False,False,False,False
18,48436,"""16:37""",,no,,,,,,,,,,,,,,,,,,False,False,False,False,False,False,False,False,False,False,False,False,False,False,False,False
19,48436,"""16:37""","I agree, it should be completely transparent. And if any pack goes to make a commercial for any politician, the entire, the entirety of that packs donor list should be available. I think, if you donate a dollar to a campaign, we should know who we should know who you are.",yes," 1. The process of creating political commercials should be completely transparent.
2. If a political campaign receives funds from a ""pack"" (group of organizations or individuals) that creates commercials for them, the entire donor list of that pack should be made available to the public.
3. Donors who contribute as little as one dollar to a political campaign should be identified, and this information should be made publicly available.",,,,,,,,," The process of creating political commercials should be completely transparent  If a political campaign receives funds from a ""pack"" (group of organizations or individuals) that creates commercials for them, the entire donor list of that pack should be made available to the public  Donors who contribute as little as one dollar to a political campaign should be identified, and this information should be made publicly available",,,,,,,,False,False,False,False,False,False,False,False,True,False,False,False,False,False,False,False
20,48436,"""16:37"""," That way you can hide all of the small, the small that way you get rid of all the small donors that turn out to be one person with multiple names or a group of people trying to undermine something. And as I always said, I don't want any public money from the government in it because I don't trust the government to do anything, right? So how could they do this, right?",no,,,,,,,,,,,,,,,,,,False,False,False,False,False,False,False,False,False,False,False,False,False,False,False,False
21,48264,"""17:19""","I think full disclosure and transparency is absolutely important and should be followed as far as this proposal of democracy vouchers. So if they're going to send that to all eligible voters, would they not also include their voter registration cards in that. Maybe it's just something to think about and it would I think in get more people to at least if they want to participate to participate,",yes," 1. Full disclosure and transparency is important regarding the proposal of democracy vouchers.
2. The vouchers should be sent to all eligible voters.
3. Voter registration cards could also be included with the vouchers.
4. This action could potentially increase participation in the voting process.",,,,,,,,, Full disclosure and transparency is important regarding the proposal of democracy vouchers,,,,,, Voter registration cards could also be included with the vouchers  This action could potentially increase participation in the voting process, The vouchers should be sent to all eligible voters,False,False,False,False,False,False,False,False,True,False,False,False,False,False,True,True
22,48264,"""17:19""", I'm open on.,no,,,,,,,,,,,,,,,,,,False,False,False,False,False,False,False,False,False,False,False,False,False,False,False,False
23,10663,"""17:51""",,no,,,,,,,,,,,,,,,,,,False,False,False,False,False,False,False,False,False,False,False,False,False,False,False,False
24,10663,"""17:51""",Yeah. I'm also very in favor of disclosures and making sure that people know who's donating to these political campaigns. I'm intrigued by the idea of democracy vouchers. I've not heard of anything like that before. I think it would be nice to allow people who may not have disposable income to donate to political campaigns that they believe in and have their like voice heard. But I'm skeptical of,no,,,,,,,,,,,,,,,,,,False,False,False,False,False,False,False,False,False,False,False,False,False,False,False,False
25,10663,"""17:51"""," The idea that that would do a lot compared to the like, huge donations that some of these people are seeing from like, larger entities.",yes," 1. The idea being discussed involves a smaller donation or action.
2. This is being compared to the larger donations given by larger entities.
3. The speaker suggests that the smaller donation or action would still have a significant impact.",,,,,,,,, The idea being discussed involves a smaller donation or action  The speaker suggests that the smaller donation or action would still have a significant impact,,,,,, This is being compared to the larger donations given by larger entities,,False,False,False,False,False,False,False,False,True,False,False,False,False,False,True,False
26,48397,"""18:32""",,no,,,,,,,,,,,,,,,,,,False,False,False,False,False,False,False,False,False,False,False,False,False,False,False,False
27,48397,"""18:32""","I agree with what I said. I would also say, I love Jim's idea of, including the voter ID cards, or what have you with those vouchers? I think that'd be a great way to cheaply and",no,,,,,,,,,,,,,,,,,,False,False,False,False,False,False,False,False,False,False,False,False,False,False,False,False
28,48397,"""18:32""", cheaply. Get those out to everyone.,no,,,,,,,,,,,,,,,,,,False,False,False,False,False,False,False,False,False,False,False,False,False,False,False,False
29,48507,"""18:52""","Yes, the voucher idea is great but with all of that limitations, I mean the packs are just they're insane. You know on both sides.",no,,,,,,,,,,,,,,,,,,False,False,False,False,False,False,False,False,False,False,False,False,False,False,False,False
30,48337,"""19:55""","I definitely think that the gerrymandering situation, the United States has gotten a little bit out of control here and there and I think there ought to be an independent commission, and if there's any issue, then it could go be kicked up for appeal or review, but I would like to see that.",yes," 1. The gerrymandering situation in the United States has become out of control.
2. There should be an independent commission to address this issue.
3. If there is any problem, it could be reviewed or appealed.
4. The speaker would like to see the implementation of this commission to handle gerrymandering.",,,,, The speaker would like to see the implementation of this commission to handle gerrymandering,,,,,,,,,, There should be an independent commission to address this issue," The gerrymandering situation in the United States has become out of control  If there is any problem, it could be reviewed or appealed",False,False,False,False,True,False,False,False,False,False,False,False,False,False,True,True
31,48507,"""20:15""",100%. Did I think you do?,no,,,,,,,,,,,,,,,,,,False,False,False,False,False,False,False,False,False,False,False,False,False,False,False,False
32,48436,"""20:18""",,no,,,,,,,,,,,,,,,,,,False,False,False,False,False,False,False,False,False,False,False,False,False,False,False,False
33,48436,"""20:18""","I completely agree. There needs to be a impartial group that can draw the lines to make it fair. So you don't have one District. That's that leans. Horribly one, way or horribly another way. It needs to represent the people living in that District, not just a small group of them.",yes," 1. The need for an impartial group to establish district boundaries is essential.
2. Districts should not favor one group over another.
3. A district should represent all of its residents, not just a select few.
4. Districts should not have lopsided representation towards one side or the other.",,,,," The need for an impartial group to establish district boundaries is essential  Districts should not favor one group over another  A district should represent all of its residents, not just a select few  Districts should not have lopsided representation towards one side or the other",,,,,,,,,,,,False,False,False,False,True,False,False,False,False,False,False,False,False,False,False,False
34,48346,"""20:38""","Yeah, I think independent commissions is probably the best way to go about that. I'm not sure how that can be instituted in all states. Since we are incredibly independent about how we do our elections, but I do think when we kick those up, like if we draw a map and it has to be reviewed by somebody, perhaps it should be reviewed by the state court system, like this it, whatever the score system is the state supreme court would be the equivalent of that, but I don't think it should be done by legislators who are politically motivated.",yes," 1. Independent commissions are the best way to address election issues.
2. The implementation of independent commissions in all states may be challenging due to the independence of election processes in different states.
3. When election maps are drawn, they should be reviewed by a higher authority to ensure fairness.
4. In the context of the state supreme court, the equivalent of this higher authority would be the state court system.
5. Election maps should not be reviewed by legislators who may be politically motivated.",,,,," When election maps are drawn, they should be reviewed by a higher authority to ensure fairness  Election maps should not be reviewed by legislators who may be politically motivated",,,,,,,,,, Independent commissions are the best way to address election issues  The implementation of independent commissions in all states may be challenging due to the independence of election processes in different states," In the context of the state supreme court, the equivalent of this higher authority would be the state court system",False,False,False,False,True,False,False,False,False,False,False,False,False,False,True,True
35,48346,"""20:38""", It's not giving us a good.,no,,,,,,,,,,,,,,,,,,False,False,False,False,False,False,False,False,False,False,False,False,False,False,False,False
36,48433,"""21:10""","I totally agree of the people are supposed to pick their elected officials. And in some states, the elected officials are picking their voters which is way wrong it. So I totally agree with a",no,,,,,,,,,,,,,,,,,,False,False,False,False,False,False,False,False,False,False,False,False,False,False,False,False
37,48433,"""21:10""", totally agree with them nonpartisan Commission.,no,,,,,,,,,,,,,,,,,,False,False,False,False,False,False,False,False,False,False,False,False,False,False,False,False
38,10544,"""21:28""",I think the only challenge would be finding an independent.,no,,,,,,,,,,,,,,,,,,False,False,False,False,False,False,False,False,False,False,False,False,False,False,False,False
39,10544,"""21:28""", Nonpartisan party to do it right? Like so that's going to be they're going to have to have things in place that will actually Institute this properly so that's going to be the real catch to this.,no,,,,,,,,,,,,,,,,,,False,False,False,False,False,False,False,False,False,False,False,False,False,False,False,False
40,48383,"""21:46""","Very good point, Virginia.",no,,,,,,,,,,,,,,,,,,False,False,False,False,False,False,False,False,False,False,False,False,False,False,False,False
41,48433,"""21:51""",What's up next?,no,,,,,,,,,,,,,,,,,,False,False,False,False,False,False,False,False,False,False,False,False,False,False,False,False
42,48433,"""21:51""",,no,,,,,,,,,,,,,,,,,,False,False,False,False,False,False,False,False,False,False,False,False,False,False,False,False
