41,10458,"""21:33""","Yeah, I think to one of the issues with full disclosure is, who's deciding, what's considered extreme right today? Like we would consider certain things.",no,,,,,,,,,,,,,,,,,,False,False,False,False,False,False,False,False,False,False,False,False,False,False,False,False
42,10458,"""21:33""",,no,,,,,,,,,,,,,,,,,,False,False,False,False,False,False,False,False,False,False,False,False,False,False,False,False
43,10458,"""21:33"""," Like it's just it's just I don't I don't like that idea. Right saying that like oh somebody's too extreme and maybe you shouldn't vote for them. I can I can certainly see where that's true and negative ways but it's a possibility is that in the future, you know, things that we would want would be considered extreme.",no,,,,,,,,,,,,,,,,,,False,False,False,False,False,False,False,False,False,False,False,False,False,False,False,False
44,48467,"""22:13""","But if we take that to kind of you know, to present day you got a Supreme Court Justice Wright. Who didn't bother really disclosing the donations that he got from a wealthy donor, right? He's like oh well I just didn't do the form right I didn't do that in time and you know I'm talking about just as Thomas right? He's literally going over there. Getting his mom's house. Pay getting his children's education paid all while not disclosing.",no,,,,,,,,,,,,,,,,,,False,False,False,False,False,False,False,False,False,False,False,False,False,False,False,False
45,48467,"""22:13"""," And you know that's has implications at the day, right? Like he, he's in the control of the sky, who, who basically is voting, you know, he's one of the highest court judges in the land. So I feel that that something that we definitely need to",yes," 1. The sky god has control over the sky.
2. The sky god is compared to a high court judge in the land.
3. The concept of the sky god has implications in daily life.
4. The sky god is depicted as having significant power and influence.
5. The speaker believes that the sky god is an important concept to consider.",,,,,,,,,,,,,,,, The sky god has control over the sky  The sky god is compared to a high court judge in the land  The concept of the sky god has implications in daily life  The sky god is depicted as having significant power and influence  The speaker believes that the sky god is an important concept to consider,False,False,False,False,False,False,False,False,False,False,False,False,False,False,False,True
46,48464,"""22:58""","So I also read a little bit about this and from what I understand it's that these like I agree that any sort of appearance of misconduct should be very carefully considered especially if your Supreme Court justice. But I will say that all these events that happen before that disclosure law came into effect and afterwards. He discloses do I think that he should have done them in the first place? No, but",no,,,,,,,,,,,,,,,,,,False,False,False,False,False,False,False,False,False,False,False,False,False,False,False,False
47,48464,"""22:58""", What? I understand. He did follow the law.,no,,,,,,,,,,,,,,,,,,False,False,False,False,False,False,False,False,False,False,False,False,False,False,False,False
48,48506,"""23:33""","I am against discrimination of any type. I'm a black person I've already said that and so, you know that I just don't feel like being on camera today. I know some people just not on camera in general. But anyway, the bottom line is, is that I",yes," 1. The person is against all forms of discrimination.
2. They are a black person.
3. They do not want to appear on camera today.
4. Some people prefer not to appear on camera in general.
5. The person's bottom line is that they are opposed to discrimination.",,,,,,,,,,,,,,,, The person is against all forms of discrimination  They are a black person  They do not want to appear on camera today  Some people prefer not to appear on camera in general  The person's bottom line is that they are opposed to discrimination,False,False,False,False,False,False,False,False,False,False,False,False,False,False,False,True
49,48506,"""23:33"""," I'm against any discrimination. So any discrimination is wrong but I want to go back to the what someone else says. I'm sorry I don't remember the name, I know it was a woman or someone who presents as a woman. And so let me just say this that I just really disagree that you should be trying or able to hide the money you give to people. I just don't agree with that even if it's to do.",no,,,,,,,,,,,,,,,,,,False,False,False,False,False,False,False,False,False,False,False,False,False,False,False,False
50,48463,"""24:17""","I agree, completely. I like the idea of the Democracy vouchers in the sense of for Community votes, but I'm not sure how that would work for a more National level.",yes," 1. The reader agrees with the idea of Democracy vouchers for community votes.
2. The reader is unsure about the implementation of Democracy vouchers on a national level.",,,,,,,,,,,,, The reader agrees with the idea of Democracy vouchers for community votes  The reader is unsure about the implementation of Democracy vouchers on a national level,,,,False,False,False,False,False,False,False,False,False,False,False,False,True,False,False,False
51,48393,"""24:35""","I think one of my biggest concerns when it comes to, the things that transparency is that it's just that this data is available. If you are technologically like competent enough to go find it, so I can be available to those who can afford to pay those people who can find it or it could be available to everyone.",no,,,,,,,,,,,,,,,,,,False,False,False,False,False,False,False,False,False,False,False,False,False,False,False,False
52,48464,"""25:09""","yeah, one thing I will say is that once your personal information is out there,",no,,,,,,,,,,,,,,,,,,False,False,False,False,False,False,False,False,False,False,False,False,False,False,False,False
53,48464,"""25:09""", Even if it's just the first name and the City.,no,,,,,,,,,,,,,,,,,,False,False,False,False,False,False,False,False,False,False,False,False,False,False,False,False
54,48464,"""25:09"""," It's very easy for people who disagree with you and who don't know you personally and so they have no reason for moderation to Target you for harassment campaign. Like if Twitter harassment campaigns are bad enough, imagine how much worse it would be with this additional information and it not being restricted restricted to Twitter",yes," 1. People who disagree with you may target you for harassment.
2. This is easier if the person does not know you personally.
3. Such harassment campaigns can be as bad as or worse than those on Twitter.
4. This is concerning because the harassment is not restricted to Twitter.",,,,,,,,,,,,,,,, People who disagree with you may target you for harassment  This is easier if the person does not know you personally  Such harassment campaigns can be as bad as or worse than those on Twitter  This is concerning because the harassment is not restricted to Twitter,False,False,False,False,False,False,False,False,False,False,False,False,False,False,False,True
55,10458,"""26:54""","I think if we're going to keep boundaries, we should just let a computer program to it.",yes," 1. The text suggests using a computer program to manage boundaries.
2. This is because the task of maintaining boundaries can be effectively handled by a computer program.",,,,,,,,,,,,,,,, The text suggests using a computer program to manage boundaries  This is because the task of maintaining boundaries can be effectively handled by a computer program,False,False,False,False,False,False,False,False,False,False,False,False,False,False,False,True
56,10458,"""26:54"""," But I think yesterday, you know, we discussed proportional representation, I think that's a way, better way to go about things.",yes," 1. The person discussed proportional representation.
2. They believe proportional representation is a better way to do things compared to the current system.
3. The discussion about proportional representation may have taken place yesterday.",,,,,,, The person discussed proportional representation  They believe proportional representation is a better way to do things compared to the current system  The discussion about proportional representation may have taken place yesterday,,,,,,,,,,False,False,False,False,False,False,True,False,False,False,False,False,False,False,False,False
57,48310,"""27:15""",,no,,,,,,,,,,,,,,,,,,False,False,False,False,False,False,False,False,False,False,False,False,False,False,False,False
58,48310,"""27:15""","Yeah, I think gerrymandering should be outlawed. Somehow, we need to get rid of that.",yes," 1. The user believes that gerrymandering should be prohibited.
2. The user expresses a need to eliminate gerrymandering.",,,,, The user believes that gerrymandering should be prohibited  The user expresses a need to eliminate gerrymandering,,,,,,,,,,,,False,False,False,False,True,False,False,False,False,False,False,False,False,False,False,False
59,48464,"""27:23""","So I have a pretty interesting perspective on this. I worked on the 2010, redistricting for California and we had like an independent Commission of maybe eight to 12 people which took comments from people all over State talking about how they wanted their District to look. And from what I remember, like the results are pretty good, especially in comparison to the very gerrymandered districts in other states.",no,,,,,,,,,,,,,,,,,,False,False,False,False,False,False,False,False,False,False,False,False,False,False,False,False
60,48393,"""27:51""","Yeah, I think having that independent commission working together is a good idea. My worry with a computer program is it's not like the conscious thing, and there are factors that a computer might, not take into account that indirectly lead to some sort of discrimination, or some are unfairness in the boundaries of drawers. But again, I'm not a computer scientist so I don't know how they write those programs or if they could apply like AI to it. Now I would just worry about",yes," 1. The proposal is to have an independent commission working together.
2. The speaker has concerns about using a computer program for this task.
3. The concern is that a computer program may not consider certain factors that could lead to discrimination or unfairness.
4. The speaker is not a computer scientist, and is unsure about how computer programs are written or if AI can be applied to it.
5. The speaker expresses worry about the boundaries that could be drawn.",,,,,, The speaker expresses worry about the boundaries that could be drawn,,,,,,,,, The concern is that a computer program may not consider certain factors that could lead to discrimination or unfairness," The proposal is to have an independent commission working together  The speaker has concerns about using a computer program for this task  The speaker is not a computer scientist, and is unsure about how computer programs are written or if AI can be applied to it",False,False,False,False,False,True,False,False,False,False,False,False,False,False,True,True
61,48393,"""27:51""", Issues there.,no,,,,,,,,,,,,,,,,,,False,False,False,False,False,False,False,False,False,False,False,False,False,False,False,False
62,48479,"""28:22""","I was going to say, if I remember right, as of yesterday, we were all pretty much of the opinion that",no,,,,,,,,,,,,,,,,,,False,False,False,False,False,False,False,False,False,False,False,False,False,False,False,False
63,48479,"""28:22""", there should be some sort of system put in place to replace your manager in all together. It just hasn't been working.,yes," 1. A system should be put in place to replace the current manager.
2. The current management system is not working effectively.",,,,,,,,,,,,,,,, A system should be put in place to replace the current manager  The current management system is not working effectively,False,False,False,False,False,False,False,False,False,False,False,False,False,False,False,True
64,48464,"""28:41""","So, to expand Kate, if people aren't doing it, if say an independent commission isn't doing it, and a computer program is doing it, the programmer is essentially making decisions for how heavily to wait each different item. So it's not going to be like a completely neutral party.",yes," 1. If an independent commission is not performing the task, and a computer program is taking over, then the programmer is making decisions.
2. The programmer decides how heavily to weigh each item.
3. The computer program is not a completely neutral party.",,,,,,,,,,,,,,," If an independent commission is not performing the task, and a computer program is taking over, then the programmer is making decisions  The computer program is not a completely neutral party", The programmer decides how heavily to weigh each item,False,False,False,False,False,False,False,False,False,False,False,False,False,False,True,True
65,10282,"""29:05""","Yeah. And they always got to be set set parameters to everything that you do want to measure and it, you know, an algorithm or anything that you feed into an AI or any any things having to do with programming, you have to set a certain amount of parameters. So depending on where you stand, like, you could always somehow Niche it to move the goal posts, you know, you're always going to be. So there's always that.",yes," 1. When measuring or analyzing anything, especially with AI or programming, you need to set specific parameters.
2. The person who sets the parameters has some influence over the outcome.
3. By adjusting the parameters, the goalposts can be moved, or the outcome can be influenced.
4. This phenomenon can be observed in various contexts, and it allows for a degree of subjectivity or manipulation.",,,,,,,,,,,,,,," By adjusting the parameters, the goalposts can be moved, or the outcome can be influenced  This phenomenon can be observed in various contexts, and it allows for a degree of subjectivity or manipulation"," When measuring or analyzing anything, especially with AI or programming, you need to set specific parameters  The person who sets the parameters has some influence over the outcome",False,False,False,False,False,False,False,False,False,False,False,False,False,False,True,True
66,48506,"""30:24""","All of the above, sounds good to me. Endorse it.",no,,,,,,,,,,,,,,,,,,False,False,False,False,False,False,False,False,False,False,False,False,False,False,False,False
67,48393,"""30:28""","Yeah, I think we might have gotten a little ahead of ourselves because I'm pretty sure the first three we've already talked about a different points today for the fourth one. I think it's absolutely a good idea to have 16 year olds voting in School Board elections, one because it introduces them to the Democratic process and two because they are the ones who are being directly impacted by who is on the school board. So it makes sense that they would get to have an opinion on it.",yes," 1. The text suggests that discussing 16-year-olds voting in School Board elections is a good idea.
2. The first reason given is that it introduces 16-year-olds to the Democratic process.
3. The second reason presented is that 16-year-olds are directly impacted by School Board decisions, so they should have a say in the matter.
4. The text indicates that this topic has been previously discussed in the same conversation.",,,,,,,,,,,,,,,," The text suggests that discussing 16-year-olds voting in School Board elections is a good idea  The first reason given is that it introduces 16-year-olds to the Democratic process  The second reason presented is that 16-year-olds are directly impacted by School Board decisions, so they should have a say in the matter  The text indicates that this topic has been previously discussed in the same conversation",False,False,False,False,False,False,False,False,False,False,False,False,False,False,False,True
68,9839,"""30:52""",I agree with.,no,,,,,,,,,,,,,,,,,,False,False,False,False,False,False,False,False,False,False,False,False,False,False,False,False
69,48463,"""30:56""",I agree. Completely each step of these is a good step towards our future.,no,,,,,,,,,,,,,,,,,,False,False,False,False,False,False,False,False,False,False,False,False,False,False,False,False
70,48479,"""31:04""","I I agree under the condition that somebody properly teaches them, the whole process of the school board and the issues that they are arguing is one of the problems that we're coming across. Well, the last couple of Elections that",yes," 1. The person agrees to a certain condition.
2. The condition is proper teaching of the process of the school board and the issues they are arguing.
3. The person highlights one of the problems being faced as the lack of understanding of these issues in recent elections.
4. There have been multiple elections with this problem.
5. The ""they"" in the text refers to the school board.",,,,,,,,,,," The condition is proper teaching of the process of the school board and the issues they are arguing  The ""they"" in the text refers to the school board", The person highlights one of the problems being faced as the lack of understanding of these issues in recent elections,,,, The person agrees to a certain condition  There have been multiple elections with this problem,False,False,False,False,False,False,False,False,False,False,True,True,False,False,False,True
71,48479,"""31:04""", Is it? No boy. Seems to have been arguing the issues.,no,,,,,,,,,,,,,,,,,,False,False,False,False,False,False,False,False,False,False,False,False,False,False,False,False
72,48479,"""31:04"""," Between the presidents and nobody even pointed that out, earliest. As far as I can tell,",no,,,,,,,,,,,,,,,,,,False,False,False,False,False,False,False,False,False,False,False,False,False,False,False,False
73,48310,"""31:36""","Yeah, I agree. I think that if the 16 year olds are going to vote, they should at least",no,,,,,,,,,,,,,,,,,,False,False,False,False,False,False,False,False,False,False,False,False,False,False,False,False
74,48310,"""31:36""", I have to attend a few of those meetings school board meetings so that they realize how it works.,no,,,,,,,,,,,,,,,,,,False,False,False,False,False,False,False,False,False,False,False,False,False,False,False,False
75,48464,"""31:50""","I generally speaking, I am really supportive of allowing people who are most impacted by a decision to make the choice whether or not that decision should go through. So, for example, in this case, since 16 year olds are essentially professional students. They're the ones that are sitting eight hours a day for you. I forget how long school day is,",no,,,,,,,,,,,,,,,,,,False,False,False,False,False,False,False,False,False,False,False,False,False,False,False,False
76,48464,"""31:50""","let's say, 8 hours a day, 40 days a week in school, so they're the most impacted. And so it makes the most sense for them to have some say over",yes," 1. The text discusses the idea of children having a say in school schedules.
2. It is suggested that children spend a significant amount of time in school, approximately 8 hours a day and 40 days a week.
3. This makes them the most impacted group when it comes to school schedules.
4. Therefore, it is argued that children should have some input in the decision-making process regarding school schedules.",,,,,,,,,,,,,,,," The text discusses the idea of children having a say in school schedules  It is suggested that children spend a significant amount of time in school, approximately 8 hours a day and 40 days a week  This makes them the most impacted group when it comes to school schedules  Therefore, it is argued that children should have some input in the decision-making process regarding school schedules",False,False,False,False,False,False,False,False,False,False,False,False,False,False,False,True
77,48464,"""31:50""", the specifics of their school program.,no,,,,,,,,,,,,,,,,,,False,False,False,False,False,False,False,False,False,False,False,False,False,False,False,False
78,48393,"""32:30""","I like the idea of making sure that they're informed on these sorts of Elections, but I would ask then, what's the difference between the 17 year old voting, who needs to be? Apparently taught what they're doing and has to sit in on the meetings and the 18 year old, who has to do, none of those things. I didn't have to sit in on a state Congressional meeting to go vote. I didn't have to be taught any of these things. It's just, you turn 18 and you can go and I would just be concerned with",yes," 1. The proposal to allow 17-year-olds to vote, with the requirement of being informed through measures such as sitting in on meetings and being taught about the process.
2. The contrast between the 17-year-old voting requirements and the 18-year-old voting age, which does not have similar requirements.
3. The point that the speaker did not have to undergo any special teaching or meetings at the age of 18 to be able to vote.
4. The concern about the proposed difference in voting requirements based on age.",,,,,,,,,,,, The point that the speaker did not have to undergo any special teaching or meetings at the age of 18 to be able to vote,,,," The proposal to allow 17-year-olds to vote, with the requirement of being informed through measures such as sitting in on meetings and being taught about the process  The contrast between the 17-year-old voting requirements and the 18-year-old voting age, which does not have similar requirements  The concern about the proposed difference in voting requirements based on age",False,False,False,False,False,False,False,False,False,False,False,True,False,False,False,True
79,48393,"""32:30"""," Having the person teaching it. It's like we what we talked about, with civic education. There might be a slant or a bias based on who's teaching it.",yes," 1. Teaching of civic education is conducted by a person.
2. The person teaching civic education may have a particular viewpoint or bias.",,,,,,,,,,, Teaching of civic education is conducted by a person, The person teaching civic education may have a particular viewpoint or bias,,,,,False,False,False,False,False,False,False,False,False,False,True,True,False,False,False,False
80,10458,"""33:09""","Yeah. And I'd be curious how young like was 15. Okay, 14.",no,,,,,,,,,,,,,,,,,,False,False,False,False,False,False,False,False,False,False,False,False,False,False,False,False
81,10458,"""33:09""",,no,,,,,,,,,,,,,,,,,,False,False,False,False,False,False,False,False,False,False,False,False,False,False,False,False
82,48479,"""33:18""","I was going to say that's part of the point is, you know, we",no,,,,,,,,,,,,,,,,,,False,False,False,False,False,False,False,False,False,False,False,False,False,False,False,False
83,48479,"""33:18""", it took us a lot of time in a lot of,no,,,,,,,,,,,,,,,,,,False,False,False,False,False,False,False,False,False,False,False,False,False,False,False,False
84,48479,"""33:18"""," a lot of Elections to figure out what what each of our candidates are trying to argue maybe if we have the younger generation or taught, what the main issues to look out for my know what they're voting for.",yes," 1. The need for more elections to inform voters about candidate's arguments.
2. The importance of involving the younger generation in elections.
3. The need for education on the main issues to look out for in an election.
4. The importance of being informed about what one is voting for.",,,,,,,,,,, The need for education on the main issues to look out for in an election  The importance of being informed about what one is voting for, The importance of involving the younger generation in elections,,, The need for more elections to inform voters about candidate's arguments,,False,False,False,False,False,False,False,False,False,False,True,True,False,False,True,False
85,48464,"""33:48""",,no,,,,,,,,,,,,,,,,,,False,False,False,False,False,False,False,False,False,False,False,False,False,False,False,False
86,48464,"""33:48""",I don't understand.,no,,,,,,,,,,,,,,,,,,False,False,False,False,False,False,False,False,False,False,False,False,False,False,False,False
87,48464,"""33:48"""," The point of making very doing a Civic obligation with that business on obligation, with penalties for doing. So hopefully someone can help me understand but like, this is very comes across as very punitive, and yeah,",yes," 1. The speaker finds it hard to understand the concept of making ""very doing"" a civic obligation, with penalties for non-compliance.
2. The speaker finds this approach to be very punitive.
3. The speaker is seeking help to understand this idea better.",,,,,,,,,,,,,,,," The speaker finds it hard to understand the concept of making ""very doing"" a civic obligation, with penalties for non-compliance  The speaker finds this approach to be very punitive  The speaker is seeking help to understand this idea better",False,False,False,False,False,False,False,False,False,False,False,False,False,False,False,True
88,48310,"""34:12""",,no,,,,,,,,,,,,,,,,,,False,False,False,False,False,False,False,False,False,False,False,False,False,False,False,False
89,48310,"""34:12""",I think that it should be by maturity. Are there should be some frontal lobe action going on before they're given the right to vote.,yes," 1. The summary should be based on maturity.
2. The maturity is related to the frontal lobe development and function.
3. The right to vote should be given when there is sufficient frontal lobe action.",,,,,,,,,,,,,,,, The summary should be based on maturity  The maturity is related to the frontal lobe development and function  The right to vote should be given when there is sufficient frontal lobe action,False,False,False,False,False,False,False,False,False,False,False,False,False,False,False,True
