,Order,Speaker,Time,Text,Has Arguments,All Arguments Summarized,(Beta) For proposal: Implement RCV as an alternative method both to elected officials and representatives at all levels,(Beta) Against proposal: Implement RCV as an alternative method both to elected officials and representatives at all levels,(Beta) Proposal raw ouput for debugging: Implement RCV as an alternative method both to elected officials and representatives at all levels,(Beta) For proposal: Change the primary system,(Beta) Against proposal: Change the primary system,(Beta) Proposal raw ouput for debugging: Change the primary system,(Beta) For proposal: Use proportional representatives to elect elected officials,(Beta) Against proposal: Use proportional representatives to elect elected officials,(Beta) Proposal raw ouput for debugging: Use proportional representatives to elect elected officials,(Beta) For proposal: Change the current electoral college,(Beta) Against proposal: Change the current electoral college,(Beta) Proposal raw ouput for debugging: Change the current electoral college,(Beta) For proposal: Implement more accessibility to voting,(Beta) Against proposal: Implement more accessibility to voting,(Beta) Proposal raw ouput for debugging: Implement more accessibility to voting,(Beta) For proposal: Restore federal and state voting rights to citizens with felony convictions upon their release from prison,(Beta) Against proposal: Restore federal and state voting rights to citizens with felony convictions upon their release from prison,(Beta) Proposal raw ouput for debugging: Restore federal and state voting rights to citizens with felony convictions upon their release from prison,(Beta) For proposal: Implement voting standards that are less strict,(Beta) Against proposal: Implement voting standards that are less strict,(Beta) Proposal raw ouput for debugging: Implement voting standards that are less strict,(Beta) For proposal: Implement more measures to address voter fraud,(Beta) Against proposal: Implement more measures to address voter fraud,(Beta) Proposal raw ouput for debugging: Implement more measures to address voter fraud,(Beta) For proposal: Implement more fairness and transparency in the election process,(Beta) Against proposal: Implement more fairness and transparency in the election process,(Beta) Proposal raw ouput for debugging: Implement more fairness and transparency in the election process,(Beta) For proposal: Implement limits on financing individual candidates and parties,(Beta) Against proposal: Implement limits on financing individual candidates and parties,(Beta) Proposal raw ouput for debugging: Implement limits on financing individual candidates and parties,(Beta) For proposal: Increase in public funding and financing for campaigns,(Beta) Against proposal: Increase in public funding and financing for campaigns,(Beta) Proposal raw ouput for debugging: Increase in public funding and financing for campaigns,(Beta) For proposal: Implement a term limit for Supreme Court Justices,(Beta) Against proposal: Implement a term limit for Supreme Court Justices,(Beta) Proposal raw ouput for debugging: Implement a term limit for Supreme Court Justices,(Beta) For proposal: Increase opportunities for learning about civic education in schools,(Beta) Against proposal: Increase opportunities for learning about civic education in schools,(Beta) Proposal raw ouput for debugging: Increase opportunities for learning about civic education in schools,comparisonToCurrentSystem,votingDecisions,partyRepresentation,voterTurnout,strategicVoting,moderateCandidates,moneyInPolitics,other,notRelevant
0,1,48301,"""2:06"""," oh, hi everybody. my name is dino karahalios. i live in illinois and the chicago area",No,,,,,,,,,,,,,,,,,,,,,,,,,,,,,,,,,,,,,,,,,False,False,False,False,False,False,False,False,False
1,2,48301,"""2:06"""," i've been a journalist, a and right now, i'm retired and do some options trading.",No,,,,,,,,,,,,,,,,,,,,,,,,,,,,,,,,,,,,,,,,,False,False,False,False,False,False,False,False,False
2,3,48301,"""2:06"""," and that's who i am, i guess.",No,,,,,,,,,,,,,,,,,,,,,,,,,,,,,,,,,,,,,,,,,False,False,False,False,False,False,False,False,False
3,4,48365,"""2:36"""," i like to meet everybody, my name is michael cristero, i'm out of the oregon area. just excited me, everybody cuber you different points of view on everything. i'm a father of six, we're just able recently due to personal things and it's like me everybody and thanks for having me here.",No,,,,,,,,,,,,,,,,,,,,,,,,,,,,,,,,,,,,,,,,,False,False,False,False,False,False,False,False,False
4,5,9766,"""3:00"""," hello, my name is chris. i'm a truck driver live in virginia. two kids.",No,,,,,,,,,,,,,,,,,,,,,,,,,,,,,,,,,,,,,,,,,False,False,False,False,False,False,False,False,False
5,6,48269,"""3:10"""," hi, my name is josh. i live in texas and i work in the texas triangle. just doing low voltage work.",No,,,,,,,,,,,,,,,,,,,,,,,,,,,,,,,,,,,,,,,,,False,False,False,False,False,False,False,False,False
6,7,48269,"""3:10""", it's nice to get in here and share ideas with other americans from other places.,No,,,,,,,,,,,,,,,,,,,,,,,,,,,,,,,,,,,,,,,,,False,False,False,False,False,False,False,False,False
7,8,48308,"""3:26"""," i am mates. i live outside of cleveland ohio, i work for the us coast guard. three kids, my baby.",No,,,,,,,,,,,,,,,,,,,,,,,,,,,,,,,,,,,,,,,,,False,False,False,False,False,False,False,False,False
8,9,9833,"""3:39""", hi. my name is mike. kerner honking. well. hello illinois. and i'm tired.,No,,,,,,,,,,,,,,,,,,,,,,,,,,,,,,,,,,,,,,,,,False,False,False,False,False,False,False,False,False
9,10,9833,"""3:39""", i look forward to doing this survey.,No,,,,,,,,,,,,,,,,,,,,,,,,,,,,,,,,,,,,,,,,,False,False,False,False,False,False,False,False,False
10,11,48417,"""3:53"""," hi, my name is pat and i live in beaver, dam wisconsin. sitting outside enjoying that. wonderful wisconsin, weather happy to be here and listen to other people's viewpoints. thank you.",No,,,,,,,,,,,,,,,,,,,,,,,,,,,,,,,,,,,,,,,,,False,False,False,False,False,False,False,False,False
11,12,48477,"""4:16"""," hello needs brian. i live in south louisiana, cajun country. i work as an environmental consultant to all and gas companies and looking forward to this.",No,,,,,,,,,,,,,,,,,,,,,,,,,,,,,,,,,,,,,,,,,False,False,False,False,False,False,False,False,False
12,13,48477,"""4:16""", hello. maybe my microphone is not working properly.,No,,,,,,,,,,,,,,,,,,,,,,,,,,,,,,,,,,,,,,,,,False,False,False,False,False,False,False,False,False
13,14,48308,"""4:23""", sorry we're having trouble hearing,No,,,,,,,,,,,,,,,,,,,,,,,,,,,,,,,,,,,,,,,,,False,False,False,False,False,False,False,False,False
14,15,48301,"""4:44""", i think moving the microphone closer to your mouth was was a better solution.,Yes,"- Moving the microphone closer to the mouth improves sound quality
- It is a better solution for better audio clarity",,- It is a better solution for better audio clarity,"3. C Reason: This argument does not provide a clear stance on whether changing the current electoral college is good or bad, so it is not applicable.
4. B Reason: This argument is against changing the current electoral college, as it states that it is bad.
5. A Reason: This argument is in favor of changing the current electoral college, as it states that it is the best thing ever.",,- It is a better solution for better audio clarity,"3. C Reason: This argument does not provide a clear stance on whether implementing less strict voting standards is good or bad.
4. B Reason: This argument is against the proposal of implementing less strict voting standards.
5. A Reason: This argument is in favor of the proposal of implementing less strict voting standards.",- Moving the microphone closer to the mouth improves sound quality,,"2. A Reason: Moving the microphone closer to the mouth improves sound quality, which is a pro argument for the proposal of changing the primary system.
3. C Reason: This argument does not provide a clear stance on whether changing the primary system is good or bad, so it is not applicable to the proposal.
4. B Reason: This argument states that changing the primary system is bad, which is a con argument against the proposal.
5. A Reason: This argument states that changing the primary system is the best thing ever, which is a pro argument for the proposal.",- Moving the microphone closer to the mouth improves sound quality,- It is a better solution for better audio clarity,"3. A Reason: Implementing a term limit for Supreme Court Justices can bring fresh perspectives and prevent justices from becoming too entrenched in their positions.

4. B Reason: Some argue that implementing a term limit for Supreme Court Justices could lead to less experienced justices being appointed and potentially politicize the court even more.

5. C Reason: This statement is more of an opinion rather than a specific argument for or against the proposal.",,,"3. [C] Reason: This argument does not provide a clear stance on whether implementing limits on financing individual candidates and parties is good or bad, so it is not applicable to the proposal.
4. [B] Reason: This argument is against implementing limits on financing individual candidates and parties, stating that it is bad.
5. [A] Reason: This argument is in favor of implementing limits on financing individual candidates and parties, stating that it is the best thing ever.",,- It is a better solution for better audio clarity,"3. C Reason: This argument does not provide a clear stance on whether implementing more fairness and transparency in the election process is good or bad, so it is not applicable to the proposal.
4. B Reason: This argument is against implementing more fairness and transparency in the election process, so it is a con to the proposal.
5. A Reason: This argument is in favor of implementing more fairness and transparency in the election process, so it is a pro to the proposal.",,- It is a better solution for better audio clarity,"3. C Reason: This argument does not provide a clear stance on whether using proportional representatives to elect elected officials is good or bad.

4. B Reason: This argument is against the proposal of using proportional representatives to elect elected officials.

5. A Reason: This argument is in favor of the proposal of using proportional representatives to elect elected officials.",,- It is a better solution for better audio clarity,"3. C Reason: This argument is not applicable to the given proposal as it simply states that implementing more measures to address voter fraud is okay without providing any specific reasoning or stance.

4. B Reason: This argument is a con as it states that implementing more measures to address voter fraud is bad without providing any specific reasoning or evidence to support this claim.

5. A Reason: This argument is a pro as it states that implementing more measures to address voter fraud is the best thing ever, indicating strong support for the proposal.",,- It is a better solution for better audio clarity,"3. C Reason: This argument does not provide a clear stance on whether implementing more accessibility to voting is positive or negative. It simply states that it is okay, which does not align with being a pro or con argument.
4. B Reason: This argument is a con because it states that implementing more accessibility to voting is bad. It presents a negative viewpoint towards the proposal.
5. A Reason: This argument is a pro because it states that implementing more accessibility to voting is the best thing ever. It presents a positive viewpoint towards the proposal.",,- It is a better solution for better audio clarity,"3. C Reason: This argument does not provide a clear stance on whether implementing RCV is beneficial or not, it simply states that it is an acceptable option.
4. B Reason: This argument is against implementing RCV as an alternative method, stating that it is bad.
5. A Reason: This argument is in favor of implementing RCV as an alternative method, stating that it is the best thing ever.",,- It is a better solution for better audio clarity,"3. C Reason: This argument is not applicable to the given proposal because it simply states that the proposal is okay without providing any reasoning or evidence to support that claim.

4. B Reason: This argument is a con because it states that increasing opportunities for learning about civic education in schools is bad, without providing any reasoning or evidence to support that claim.

5. A Reason: This argument is a pro because it states that increasing opportunities for learning about civic education in schools is the best thing ever, indicating support for the proposal.",,- It is a better solution for better audio clarity,"3. C Reason: This argument does not provide a clear stance on whether restoring voting rights to citizens with felony convictions is good or bad, making it not applicable to the proposal.
4. B Reason: This argument is against restoring voting rights to citizens with felony convictions, as it states that it is a bad idea.
5. A Reason: This argument is in favor of restoring voting rights to citizens with felony convictions, as it states that it is the best thing ever.",,- It is a better solution for better audio clarity,"3. C Reason: This argument does not provide a clear stance on whether increasing public funding and financing for campaigns is good or bad, so it is not applicable to the proposal.
4. B Reason: This argument is against the proposal of increasing public funding and financing for campaigns, as it states that it is bad.
5. A Reason: This argument is in favor of the proposal, stating that increasing public funding and financing for campaigns is the best thing ever.",False,False,False,False,False,False,False,True,False
15,16,9673,"""5:12"""," hi, my name is bethany. i live in central, texas. this is one of my second event like this. i'm excited to be a part again and meet everyone in here. everyone's views.",No,,,,,,,,,,,,,,,,,,,,,,,,,,,,,,,,,,,,,,,,,False,False,False,False,False,False,False,False,False
16,17,48409,"""5:39"""," hi, my name is anna staviska's. my camera is not quite working, so that's why you see part of my living room. so i'm excited to hear what everyone has to say. thank you.",No,,,,,,,,,,,,,,,,,,,,,,,,,,,,,,,,,,,,,,,,,False,False,False,False,False,False,False,False,False
